Links,Main Heading,Chapter Headings,Description,Contents,Unordered Lists,Ordered Lists,Table Data
https://www.programiz.com/kotlin-programming/if-expression,Kotlin if...else Expression (With Examples),Traditional Usage of if...else$$$Kotlin if expression$$$Kotlin if..else..if Ladder$$$Kotlin Nested if Expression$$$Example: Traditional Usage of if...else$$$Example: Kotin if expression$$$Example: if block With Multiple Expressions$$$Example: if...else...if Ladder$$$Example: Nested if Expression$$$Table of Contents,,"In this article, you will learn to use if expression in Kotlin with the help of examples.|||The syntax of if...else is:|||if executes a certain section of code if the testExpression is evaluated to true. It can have optional else clause. Codes inside else clause are executed if the testExpression is false.|||When you run the program, the output will be:|||Unlike Java (and other many programming languages), if can be used an expression in Kotlin; it returns a value. Recommended Reading: Kotlin expression|||Here is an example:|||When you run the program, the output will be:|||The else branch is mandatory when using if as an expression.|||The curly braces are optional if the body of if has only one statement. For example,|||This is similar to ternary operator in Java. Hence, there is no ternary operator in Kotlin.||||||If the block of if branch contains more than one expression, the last expression is returned as the value of the block.|||When you run the program, the output will be:|||Recommended Reading: Kotlin when Statement|||You can return a block of code among many blocks in Kotlin using if..else...if ladder.|||This program checks whether number is positive number, negative number, or zero.|||An if expression can be inside the block of another if expression known as nested if expression.|||This program computes the largest number among three numbers.|||When you run the program, the output will be:",Traditional Usage of if...elseExample$$$Kotlin if expressionExample: if expressionExample: if block with multiple expressions$$$Kotlin if...else..if Ladder$$$Kotlin Nested if Expression$$$Example$$$Example: if expression$$$Example: if block with multiple expressions,,
https://www.programiz.com/kotlin-programming/when-expression,Kotlin when Expression (With Examples),Kotlin when Construct$$$Few possibilities$$$Example: Simple when Expression$$$Table of Contents,,"In this article, you will learn about when construct in Kotlin with the help of various examples.|||The when construct in Kotlin can be thought of as a replacement for Java switch Statement. It evaluates a section of code among many alternatives.|||When you run the program, the output will be something like:|||The program above takes an input string from the user (Recommended Reading: Get String Input from the User in Kotlin). Suppose, the user entered *. In this case, the expression a * b is evaluated, and the value is assigned to variable result.|||If none of the branch conditions are satisfied (user entered anything except +, -, *, or /) , else branch is evaluated.|||In the above example, we used when as an expression. However, it's not mandatory to use when as an expression. For example,|||When you run the program, the output will be something like:|||Here, when is not an expression (return value from when is not assigned to anything). In this case, the else branch is not mandatory.|||Combine two or more branch conditions with a comma. For example,||||||When you run the program, the output will be:|||Check value in the range. For example,|||When you run the program, the output will be:|||Check if a value is of a particular type.|||To check whether a value is of a particular type in runtime, we can use is and !is operator. For example,|||Use expressions as branch condition. For example,|||When you run the program, the output will be:",Kotlin when Expression$$$Example: Simple Example$$$Example: Combine two or more branch conditions$$$Example: Check value in the range$$$Example: Check if a value is of particular type$$$Example: Use expressions as branch condition,,
https://www.programiz.com/kotlin-programming/while-loop,Kotlin while and do...while Loop (With Examples),Kotlin while Loop$$$Kotlin do...while Loop$$$How while loop works?$$$Flowchart of while Loop$$$Example: Kotlin while Loop$$$Example: Compute sum of Natural Numbers$$$How do...while loop works?$$$Flowchart of do...while Loop$$$Example: Kotlin do...while Loop$$$Table of Contents,,"Loop is used in programming to repeat a specific block of code. In this article, you will learn to create while and do...while loops in Kotlin programming.|||Loop is used in programming to repeat a specific block of code until certain condition is met (test expression is false).|||Loops are what makes computers interesting machines. Imagine you need to print a sentence 50 times on your screen. Well, you can do it by using print statement 50 times (without using loops). How about you need to print a sentence one million times? You need to use loops.|||You will learn about two loops while and do..while in this article with the help of examples.|||If you are familiar with while and do...while loops in Java, you are already familiar with these loops in Kotlin as well.|||The syntax of while loop is:|||The test expression inside the parenthesis is a Boolean expression.|||If the test expression is evaluated to true,|||This process goes on until the test expression is evaluated to false.|||If the test expression is evaluated to false,||||||When you run the program, the output will be:|||Notice, ++i statement inside the while loop. After 5 iterations, variable i will be incremented to 6. Then, the test expression i <= 5 is evaluated to false and the loop terminates.|||If the body of loop has only one statement, it's not necessary to use curly braces { }. ||||||When you run the program, the output will be:|||Here, the variable sum is initialized to 0 and i is initialized to 100. In each iteration of while loop, variable sum is assigned sum + i, and the value of i is decreased by 1 until i is equal to 0. For better visualization,|||To learn more about test expression and how it is evaluated, visit comparison and logical operators.|||The do...while loop is similar to while loop with one key difference. The body of do...while loop is executed once before the test expression is checked.|||Its syntax is:|||The codes inside the body of do construct is executed once (without checking the testExpression). Then, the test expression is checked.|||If the test expression is evaluated to true, codes inside the body of the loop are executed, and test expression is evaluated again. This process goes on until the test expression is evaluated to false.|||When the test expression is evaluated to false, do..while loop terminates.||||||The program below calculates the sum of numbers entered by the user until user enters 0.|||To take input from the user, readline() function is used. Recommended Reading: Kotlin Basic Input|||When you run the program, the output will be something like:","statements inside the while loop are executed.$$$then, the test expression is evaluated again.$$$while loop is terminated.$$$Kotlin while LoopHow while loop works?Flowchart of while LoopExample$$$Kotlin do...while LoopHow do...while loop works?Flowchart of do...while LoopExample$$$How while loop works?$$$Flowchart of while Loop$$$Example$$$How do...while loop works?$$$Flowchart of do...while Loop$$$Example",,
https://www.programiz.com/kotlin-programming/for-loop,Kotlin for Loop (With Examples),Iterating Through an Array$$$Iterating Through a String$$$Example: Iterate Through a Range$$$Example: Different Ways to Iterate Through a Range$$$Table of Contents,,"The for loop in Kotlin iterates through anything that provides an iterator. In this article, you learn to create for loop (with the help of examples).|||There is no traditional for loop in Kotlin unlike Java and other languages.|||In Kotlin, for loop is used to iterate through ranges, arrays, maps and so on (anything that provides an iterator).|||The syntax of for loop in Kotlin is:|||Here, the loop iterates through the range and prints individual item.|||Output|||If the body of the loop contains only one statement (like above example), it's not necessary to use curly braces { }.|||It's possible to iterate through a range using for loop because ranges provides an iterator. To learn more, visit Kotlin iterators.|||Output|||Here's an example to iterate through a String array.||||||Output|||It's possible to iterate through an array with an index. For example,|||Output|||Note: Here, language.indices returns all all indices of each array elements.|||If you want to learn more about arrays, visit Kotlin arrays.|||Output|||Similar like arrays, you can iterate through a String with an index. For example,|||Output|||You will learn to iterate over a map using for loop in Kotin map article.",Kotlin for Loop (Introduction and Example)$$$Example: Different Ways to Iterate Through a Range$$$Iterating Through an Array$$$Iterating Through a String,,
https://www.programiz.com/kotlin-programming/break,Kotlin break (With Examples),How break works?$$$Kotlin Labeled break$$$Example: Kotlin break$$$Example: Calculate Sum Until User enters 0$$$How labeled break works?$$$Table of Contents,,"In this tutorial, you will learn to use break to terminate a loop. Also, you will also learn about break labels.|||Suppose you are working with loops. It is sometimes desirable to terminate the loop immediately without checking the test expression.|||In such case, break is used. It terminates the nearest enclosing loop when encountered (without checking the test expression). This is similar to how break statement works in Java.|||It is almost always used with if..else construct. For example,|||If testExpression is evaluated to true, break is executed which terminates the for loop.|||When you run the program, the output will be:|||When the value of i is equal to 5, expression i == 5 inside if is evaluated to true, and break is executed. This terminates the for loop.|||The program below calculates the sum of numbers entered by the user until user enters 0.|||Visit Kotlin Basic Input Output to learn more on how to take input from the user.|||When you run the program, the output will be:|||In the above program, the test expression of the while loop is always true.|||Here, the while loop runs until user enters 0. When user inputs 0, break is executed which terminates the while loop.||||||What you have learned till now is an unlabeled form of break, which terminates the nearest enclosing loop. There is another way break can be used (labeled form) to terminate the desired loop (can be an outer loop).|||Label in Kotlin starts with an identifier which is followed by @.|||Here, test@ is a label marked at the outer while loop. Now, by using break with a label (break@test in this case), you can break the specific loop.|||Here's an example:|||When you run the program, the output will be:|||Here, when i == 2 expression is evaluated to true, break@first is executed which terminates the loop marked with label first@.|||Here's a little variation of the above program.|||In the program below, break terminates the loop marked with label @second.|||When you run the program, the output will be:|||Note: Since, break is used to terminate the innermost loop in this program, it is not necessary to use labeled break in this case.|||There are 3 structural jump expressions in Kotlin: break, continue and return. To learn about continue and return expression, visit:",Kotlin continue$$$Kotlin function$$$Kotlin break$$$How break works in Kotlin?$$$Example: Kotlin break$$$Labeled break$$$How labeled break works?$$$Example: Labeled break,,
https://www.programiz.com/kotlin-programming/continue,Kotlin continue (With Examples),How continue works?$$$Kotlin Labeled continue$$$Example: Kotlin continue$$$Example: Calculate Sum of Positive Numbers Only$$$How labeled continue works?$$$Example: labeled continue$$$Table of Contents,,"In this tutorial, you will learn to use continue to skip the current iteration of a loop. Also, you will also learn about continue labels in this article.|||Suppose you are working with loops. It is sometimes desirable to skip the current iteration of the loop.|||In such case, continue is used. The continue construct skips the current iteration of the enclosing loop, and the control of the program jumps to the end of the loop body.|||It is almost always used with if...else construct. For example,|||If the testExpression2 is evaluated to true, continue is executed which skips all the codes inside while loop after it for that iteration.|||When you run the program, the output will be:|||When the value of i is greater than 1 and less than 5, continue is executed, which skips the execution of|||statement.|||However, the statement|||is executed in each iteration of the loop because this statement exists before the continue construct.||||||The program below calculates the sum of maximum of 6 positive numbers entered by the user. If the user enters negative number or zero, it is skipped from calculation.|||Visit Kotlin Basic Input Output to learn more on how to take input from the user.|||When you run the program, the output will be:|||What you have learned till now is unlabeled form of continue, which skips current iteration of the nearest enclosing loop. continue can also be used to skip the iteration of the desired loop (can be outer loop) by using continue labels.|||Label in Kotlin starts with an identifier which is followed by @.|||Here, outerloop@ is a label marked at outer while loop. Now, by using continue with the label (continue@outerloop in this case), you can skip the execution of codes of the specific loop for that iteration.|||When you run the program, the output will be:|||The use of labeled continue is often discouraged as it makes your code hard to understand. If you are in a situation where you have to use labeled continue, refactor your code and try to solve it in a different way to make it more readable.|||There are 3 structural jump expressions in Kotlin: break, continue and return. To learn about break and return expression, visit:",Kotlin break$$$Kotlin function$$$Kotlin continue$$$How continue works in Kotlin?$$$Example: Kotlin continue$$$Labeled continue$$$How labeled continue works?$$$Example: labeled continue,,
https://www.programiz.com/kotlin-programming/functions,Kotlin Function (With Example),Types of Functions$$$Kotlin Standard Library Function$$$User-defined Functions$$$How to create a user-defined function in Kotlin?$$$How to call a function?$$$Example: Simple Function Program$$$Example: Add Two Numbers Using Function$$$How functions with arguments and return value work?$$$Example: Display Name by Using Function$$$Table of Contents,,"In this article, you'll learn about functions; what functions are, its syntax and how to create a user-function in Kotlin.|||In programming, function is a group of related statements that perform a specific task.|||Functions are used to break a large program into smaller and modular chunks. For example, you need to create and color a circle based on input from the user. You can create two functions to solve this problem:|||Dividing a complex program into smaller components makes our program more organized and manageable.|||Furthermore, it avoids repetition and makes code reusable.|||Depending on whether a function is defined by the user, or available in standard library, there are two types of functions:|||The standard library functions are built-in functions in Kotlin that are readily available for use. For example,|||When you run the program, the output will be:|||Here is a link to the Kotlin Standard Library for you to explore.|||As mentioned, you can create functions yourself. Such functions are called user-defined functions.|||Before you can use (call) a function, you need to define it.|||Here's how you can define a function in Kotlin:|||To define a function in Kotlin, fun keyword is used. Then comes the name of the function (identifier). Here, the name of the function is callMe.|||In the above program, the parenthesis ( ) is empty. It means, this function doesn't accept any argument. You will learn about arguments later in this article.|||The codes inside curly braces { } is the body of the function.|||You have to call the function to run codes inside the body of the function. Here's how:|||This statement calls the callMe() function declared earlier.|||When you run the program, the output will be:|||The callMe() function in the above code doesn't accept any argument.||||||Also, the function doesn't return any value (return type is Unit).|||Let's take another function example. This function will accept arguments and also returns a value.|||When you run the program, the output will be:|||Here, two arguments number1 and number2 of type Double are passed to the addNumbers() function during function call. These arguments are called actual arguments.|||The parameters n1 and n2 accepts the passed arguments (in the function definition). These arguments are called formal arguments (or parameters).|||In Kotlin, arguments are separated using commas. Also, the type of the formal argument must be explicitly typed.|||Note that, the data type of actual and formal arguments should match, i.e., the data type of first actual argument should match the type of first formal argument. Similarly, the type of second actual argument must match the type of second formal argument and so on.|||Here,|||is the return statement. This code terminates the addNumbers() function, and control of the program jumps to the main() function.|||In the program, sumInteger is returned from addNumbers() function. This value is assigned to the variable result.|||Notice,|||If the function doesn't return any value, its return type is Unit. It is optional to specify the return type in the function definition if the return type is Unit.|||When you run the program, the output will be:|||Here, the getName() function takes two String arguments, and returns a String.|||You can omit the curly braces { } of the function body and specify the body after = symbol if the function returns a single expression (like above example).|||It is optional to explicitly declare the return type in such case because the return type can be inferred by the compiler. In the above example, you can replace|||with|||This is just the brief introduction to functions in Kotlin. Recommended articles related to functions:","createCircle() Function$$$colorCircle() Function$$$Kotlin Standard Library Function$$$User-defined functions$$$print() is a library function that prints message to the standard output stream (monitor).$$$sqrt() returns square root of a number (Double value)$$$both sumInteger and result are of type Int.$$$the return type of the function is specified in the function definition.// return type is Intfun addNumbers(n1: Double, n2: Double): Int {    ... .. ...}$$$Kotlin inline functions$$$Kotlin infix functions$$$Kotlin function scope$$$Kotlin Default and Named Arguments$$$Kotlin Recursion$$$Kotlin Tail Recursive function$$$Kotlin Extension Function$$$Kotlin High-Order Functions & Lambdas$$$Introduction to Function$$$Standard Library Function$$$User-defined FunctionHow to create a user-defined function?How to call a function?Example: Function With No Arguments and no Return ValueExample: Function With Arguments and a Return ValueHow functions with arguments and return value work?$$$Recommended Function Articles for you to Read$$$How to create a user-defined function?$$$How to call a function?$$$Example: Function With No Arguments and no Return Value$$$Example: Function With Arguments and a Return Value$$$How functions with arguments and return value work?",,
https://www.programiz.com/kotlin-programming/infix-notation,Kotlin Function Call Using Infix Notation,Example: Kotlin or & and function$$$How to create a function with infix notation?$$$Example: User-defined Function With Infix Notation$$$Table of Contents,,"In this article, you will learn to use infix notation to call a function in Kotlin (with the help of examples).|||Before you learn how to create a function having infix notation, let's explore two commonly used infix functions.|||When you use || and && operations, the compiler look up for or and and functions respectively, and calls them under the hood.|||These two functions support infix notation.|||When you run the program, the output will be:|||In the above program, a or b instead of a.or(b), and a and b instead of a.and(b) is used. It was possible because these two functions support infix notation.||||||You can make a function call in Kotlin using infix notation if the function|||When you run the program, the output will be:|||Here, createPyramid() is an infix function that creates a pyramid structure. It is a member function of class Structure, takes only one parameter of type Int, and starts with keyword infix.|||The number of rows of the pyramind depends on the argument passed to the function.",is a member function (or an extension function).$$$has only one single parameter.$$$is marked with infix keyword.$$$Introduction$$$Example: or & and Infix Functions$$$How to create a function with infix notation?$$$Example: User-defined Infix Function,,
https://www.programiz.com/kotlin-programming/default-named-arguments,Kotlin Default and Named Arguments (With Examples),Kotlin Default Argument$$$Kotlin named argument$$$How default arguments works?$$$Example: Kotlin Default Argument$$$Example: Kotlin named argument$$$Table of Contents,,"In this article, you will learn about default and named arguments with the help of examples.|||In Kotlin, you can provide default values to parameters in function definition.|||If the function is called with arguments passed, those arguments are used as parameters. However, if the function is called without passing argument(s), default arguments are used.|||Case I: All arguments passed|||The function foo() takes two arguments. The arguments are provided with default values. However, foo() is called by passing both arguments in the above program. Hence, the default arguments are not used.|||The value of letter and number will be 'x' and 2 respectively inside the foo() function.|||Case II: All arguments are not passed|||Here, only one (first) argument is passed to the foo() function. Hence, the first argument uses the value passed to the function. However, second argument number will take the default value since the second argument is not passed during function call.|||The value of letter and number will be 'y' and 15 respectively inside the foo() function.|||Case III: No argument is passed||||||Here, the foo() function is called without passing any argument. Hence, both arguments uses its default values.|||The value of letter and number will be 'a' and 15 respectively inside the foo() function.|||When you run the program, the output will be:|||Before talking about named argument, let us consider a little modification of the above code:|||Here, we are trying to pass second argument to the displayBorder() function, and use default argument for first argument. However, this code will give use an error. It's because the compiler thinks we are trying to provide 5 (Int value) to character (Char type).|||To solve this situation, named arguments can be used. Here' how:|||When you run the program, the output will be:|||In the above program, we are using named argument (length = 5) specifying that the length parameter in the function definition should take this value (doesn't matter the position of the argument).|||The first argument character uses the default value '=' in the program.",Kotlin default argument$$$How default argument works?Case I: All arguments passedCase II: All arguments are not passedCase III: No argument is not passed$$$Example: Default Argument$$$Kotlin named argument$$$Example: Kotlin named argument$$$Case I: All arguments passed$$$Case II: All arguments are not passed$$$Case III: No argument is not passed,,
