Links,Main Heading,Chapter Headings,Description,Contents,Unordered Lists,Ordered Lists,Table Data
https://www.programiz.com/kotlin-programming/recursion,Kotlin Recursion and Tail Recursive Function (With Examples),How does recursion work in programming?$$$Example: Find factorial of a Number using Recursion$$$How this program works?$$$Kotlin Tail Recursion$$$What is tail recursion?$$$Condition for tail recursion$$$Example: Tail Recursion$$$Example: Factorial Using Tail Recursion$$$Table of Contents,,"In this article, you will learn to create recursive functions; a function that calls itself. Also, you will learn about tail recursive function.|||A function that calls itself is known as recursive function. And, this technique is known as recursion.|||A physical world example would be to place two parallel mirrors facing each other. Any object in between them would be reflected recursively.|||Here, the recurse() function is called from the body of recurse() function itself. Here's how this program works:|||Here, the recursive call continues forever causing infinite recursion.|||To avoid infinite recursion, if...else (or similar approach) can be used where one branch makes the recursive call and other doesn't.|||When you run the program, the output will be:|||The recursive call of the factorial() function can be explained in the following figure:|||Here are the steps involved:|||Tail recursion is a generic concept rather than the feature of Kotlin language. Some programming languages including Kotlin use it to optimize recursive calls, whereas other languages (eg. Python) do not support them.|||In normal recursion, you perform all recursive calls first, and calculate the result from return values at last (as show in the above example). Hence, you don't get result until all recursive calls are made.|||In tail recursion, calculations are performed first, then recursive calls are executed (the recursive call passes the result of your current step to the next recursive call). This makes the recursive call equivalent to looping, and avoids the risk of stack overflow.||||||A recursive function is eligible for tail recursion if the function call to itself is the last operation it performs. For example,|||Example 1: Not eligible for tail recursion because the function call to itself n*factorial(n-1) is not the last operation.|||Example 2: Eligible for tail recursion because function call to itself fibonacci(n-1, a+b, a) is the last operation.|||To tell compiler to perform tail recursion in Kotlin, you need to mark the function with tailrec modifier.|||When you run the program, the output will be:|||This program computes the 100th term of the Fibonacci series. Since, the output can be a very large integer, we have imported BigInteger class from Java standard library.|||Here, the function fibonacci() is marked with tailrec modifier and the function is eligible for tail recursive call. Hence, the compiler optimizes the recursion in this case.|||If you try to find the 20000th term (or any other big integer) of the Fibonacci series without using tail recursion, the compiler will throw java.lang.StackOverflowError exception. However, our program above works just fine. It's because we have used tail recursion which uses efficient loop based version instead of traditional recursion.|||The example to compute factorial of a number in the above example (first example) cannot be optimized for tail recursion. Here's a different program to perform the same task.|||When you run the program, the output will be:|||The compiler can optimize the recursion in this program as the recursive function is eligible for tail recursion, and we have used tailrec modifier that tells compiler to optimize the recursion.",Recursion Introduction$$$How recursion works?$$$Example: Factorial of a Number Using Recursion$$$How factorial program works?$$$Kotlin Tail Recursion$$$Condition for Tail Recursion$$$Example: Fibonacci Term Using Tail Recursion$$$Example: Factorial Using Tail Recursion,,
https://www.programiz.com/kotlin-programming/class-objects,Kotlin Class and Objects (With Examples),Object-oriented Programming (OOP)$$$Kotlin Class$$$How to define a class in Kotlin?$$$Kotlin Objects$$$How to access members?$$$Example: Kotlin Class and Object$$$Table of Contents,,"In this article, you'll be introduced to Object-oriented programming in Kotlin. You'll learn what a class is, how to create objects and use it in your program.|||Kotlin supports both functional and object-oriented programming.|||Kotlin supports features such as higher-order functions, function types and lambdas which makes it a great choice for working in functional programming style. You will learn about these concept in later chapters. This article will focus on object-oriented style of programming in Kotlin.|||In object-oriented style of programming, you can divide a complex problem into smaller sets by creating objects.|||These objects share two characteristics:|||Let's take few examples:|||You will learn about detail features of an object-oriented programming like: data encapsulation, inheritance and polymorphism as we go on. This article will focus on the basics to keep things simple.|||Recommended reading: What is an object?|||Before you create objects in Kotlin, you need to define a class.|||A class is a blueprint for the object.|||We can think of class as a sketch (prototype) of a house. It contains all the details about the floors, doors, windows etc. Based on these descriptions we build the house. House is the object.|||Since, many houses can be made from the same description, we can create many objects from a class.|||To define a class in Kotlin, class keyword is used:|||Here's an example:|||Here, we defined a class named Lamp.|||The class has one property isOn (defined in same way as variable), and two member functions turnOn() and turnOff().|||Recommended Reading: Kotlin functions|||In Kotlin, either the property must be initialized or must be declared abstract (Visit: Kotlin Abstract Class to learn more). In the above example, isOn property is initialized to false.|||Classes, objects, properties, member function etc. can have visibility modifiers. For example, the isOn property is private. This means, the isOn property can be changed from only inside the Lamp class.||||||Other visibility modifiers are:|||You will learn about protected and internal modifiers later in Kotlin visibility modifiers article.|||If you do not specify the visibility modifier, it will be public by default.|||In the above program, turnOn() and turnOff() member functions are public whereas, isOn property is private.|||When class is defined, only the specification for the object is defined; no memory or storage is allocated.|||To access members defined within the class, you need to create objects. Let's create objects of Lamp class.|||This program creates two objects l1 and l2 of class Lamp. The isOn property for both lamps l1 and l2 will be false.|||You can access properties and member functions of a class by using . notation. For example,|||This statement calls turnOn() function for l1 object.|||Let's take another example:|||Here, we tried to assign true to isOn property of l2 object. Note that, isOn property is private, and if you try to access isOn from outside the class, an exception is thrown.|||When you run the program, the output will be:|||In the above program,|||Notice that, the isOn property is initialized to false inside the class. When an object of the class is created, isOn property for the object is initialized to false automatically. So, it's not necessary for l2 object to call turnOff() to set isOn property to false.|||For example:|||When you run the program, the output will be:|||This article is just an introduction to object-oriented programming in Kotlin. Check these chapters in sequence to learn more:","state$$$behavior$$$It can be in on or off state.$$$You can turn on and turn off lamp (behavior).$$$It has current gear, two wheels, number of gear etc. states.$$$It has braking, accelerating, changing gears etc. behavior.$$$private - visible (can be accessed) from inside the class only.$$$public - visible everywhere.$$$protected - visible to the class and its subclass.$$$internal - any client inside the module can access them.$$$Lamp class is created.$$$The class has a property isOn and three member functions turnOn(), turnOff() and displayLightStatus().$$$Two objects l1 and l2 of Lamp class are created in the main() function.$$$Here, turnOn() function is called using l1 object: l1.turnOn(). This method sets isOn instance variable of l1 object to true.$$$And, turnOff() function is called using l2 object: l1.turnOff(). This method sets isOff instance variable of l2 object to false.$$$Then, displayLightStatus() function is called for l1 and l2 objects which prints appropriate message depending on whether isOn property is true or false.$$$Kotlin Constructors and Initializers$$$Kotlin this Keyword$$$Kotlin Nested Class$$$Introduction to OOP$$$Kotlin Class$$$How to define a class in Kotlin?$$$Access Modifiers$$$Kotlin Objects$$$How to access members?$$$Example: Kotlin Class and Objects","Lamp is an objectIt can be in on or off state.You can turn on and turn off lamp (behavior).$$$Bicycle is an objectIt has current gear, two wheels, number of gear etc. states.It has braking, accelerating, changing gears etc. behavior.",
https://www.programiz.com/kotlin-programming/constructors,Kotlin Constructors and Initializers (With Examples),Primary Constructor$$$Kotlin Secondary Constructor$$$Example: Primary Constructor$$$Primary Constructor and Initializer Blocks$$$Default Value in Primary Constructor$$$Example: Kotlin Secondary Constructor$$$Table of Contents,,"In this article, you will learn about constructors in Kotlin (both primary and secondary constructors) as well as initializer blocks with the help of examples.|||A constructor is a concise way to initialize class properties.|||It is a special member function that is called when an object is instantiated (created). However, how they work in Kotlin is slightly different.|||In Kotlin, there are two constructors:|||The primary constructor is part of the class header. Here's an example:|||The block of code surrounded by parentheses is the primary constructor: (val firstName: String, var age: Int).|||The constructor declared two properties: firstName (read-only property as it's declared using keyword val) and age (read-write property as it is declared with keyword var).|||When you run the program, the output will be:|||When the object of Person class is created, ""Joe"" and 25 values are passed as if Person is a function.|||This initializes firstName and age properties of person1 object to ""Joe"" and 25 respectively.|||There are other ways of using primary constructors.|||The primary constructor has a constrained syntax, and cannot contain any code.|||To put the initilization code (not only code to initialize properties), initializer block is used. It is prefixed with init keyword. Let's modify the above example with initializer block:|||When you run the program, the output will be:|||Here, parameters fName and personAge inside the parenthesis accepts values ""Joe"" and 25 respectively when person1 object is created. However, fName and personAge are used without using var or val, and are not properties of the Person class.|||The Person class has two properties firstName, and age are declared.||||||When person1 object is created, code inside initializer block is executed. The initializer block not only initializes its properties but also prints them.|||Here is another way to perform the same task:|||To distinguish the constructor parameter and property, different names are used (fName and firstName, and personAge and age). It's more common to use _firstName and _age instead of completely different name for constructor parameters. For example:|||You can provide default value to constructor parameters (similar to providing default arguments to functions). For example:|||When you run the program, the output will be:|||In Kotlin, a class can also contain one or more secondary constructors. They are created using constructor keyword.|||Secondary constructors are not that common in Kotlin. The most common use of secondary constructor comes up when you need to extend a class that provides multiple constructors that initialize the class in different ways. Be sure to check Kotlin Inheritance before you learn it.|||Here's how you can create a secondary constructor in Kotlin:|||Here, the Log class has two secondary constructors, but no primary constructor.|||You can extend the class as:|||Here, constructors of the derived class AuthLog calls the corresponding constructor of the base class Log. For that, super() is used.|||In Kotlin, you can also call a constructor from another constructor of the same class (like in Java) using this().|||When you run the program, the output will be:|||Note: The secondary constructor must initialize the base class or delegate to another constructor (like in above example) if the class has no primary constructor.",Primary constructor - concise way to initialize a class$$$Secondary constructor - allows you to put additional initialization logic$$$Kotlin Primary ConstructorExample: Primary ConstructorInitializer Blocks Using initDefault Value in Primary Constructor$$$Kotlin Secondary ConstructorExample: Secondary Constructor$$$Example: Primary Constructor$$$Initializer Blocks Using init$$$Default Value in Primary Constructor$$$Example: Secondary Constructor,,
https://www.programiz.com/kotlin-programming/getters-setters,Kotlin Getters and Setters (With Example),How getters and setters work?$$$Example: Changing value of the property$$$Table of Contents,,"In this article, you will learn to use getters and setters in Kotlin with the help of an example.|||Before you learn about getters and setter, be sure to check Kotlin class and objects.|||In programming, getters are used for getting value of the property. Similarly, setters are used for setting value of the property.|||In Kotlin, getters and setters are optional and are auto-generated if you do not create them in your program.|||The following code in Kotlin|||is equivalent to|||When you instantiate object of the Person class and initialize the name property, it is passed to the setters parameter value and sets field to value.|||Now, when you access name property of the object, you will get field because of the code get() = field.||||||Here's an working example:|||When you run the program, the output will be:|||This is how getters and setters work by default. However, you can change value of the property (modify value) using getters and setters.|||When you run the program, the output will be:|||Here, the actualAge property works as expected.|||However, there is additional logic is setters to modify value of the age property.",Kotlin getters and setters Introduction$$$How getters and setters work in Kotlin?$$$Changing value of the property using getters and setters,,
https://www.programiz.com/kotlin-programming/inheritance,Kotlin Inheritance (With Examples),Why inheritance?$$$Kotlin inheritance$$$Example: Kotlin Inheritance$$$Important Notes: Kotlin Inheritance$$$Overriding Member Functions and Properties$$$Example: Overriding Member Function$$$Calling Members of Base Class from Derived Class$$$Table of Contents,,"In this article, you'll learn about inheritance. More specifically, what is inheritance and how to implement it in Kotlin (with the help of examples).|||Inheritance is one of the key features of object-oriented programming. It allows user to create a new class (derived class) from an existing class (base class).|||The derived class inherits all the features from the base class and can have additional features of its own.|||Before going into details about Kotlin inheritance, we recommend you to check these two articles:|||Suppose, in your application, you want three characters - a math teacher, a footballer and a businessman.|||Since, all of the characters are persons, they can walk and talk. However, they also have some special skills. A math teacher can teach math, a footballer can play football and a businessman can run a business.|||You can individually create three classes who can walk, talk and perform their special skill.|||In each of the classes, you would be copying the same code to walk and talk for each character.|||If you want to add a new feature - eat, you need to implement the same code for each character. This can easily become error-prone (when copying) and duplicate codes.|||It would be a lot easier if we had a Person class with basic features like talk, walk, eat, sleep, and add special skills to those features as per our characters. This is done using inheritance.|||Using inheritance, now you don't implement the same code for walk(), talk() and eat() for each class. You just need to inherit them.|||So, for MathTeacher (derived class), you inherit all features of a Person (base class) and add a new feature teachMath(). Likewise, for the Footballer class, you inherit all the features of the Person class and add a new feature playFootball() and so on.|||This makes your code cleaner, understandable and extendable.|||It is important to remember: When working with inheritance, each derived class should satisfy the condition whether it ""is a"" base class or not. In the example above, MathTeacher is a Person, Footballer is a Person. You cannot have something like, Businessman is a Business.|||Let's try to implement the above discussion in code:|||Here, Person is a base class, and classes MathTeacher, Footballer, and Businessman are derived from the Person class.|||Notice, the keyword open before the base class, Person. It's important.|||By default, classes in Kotlin are final. If you are familiar with Java, you know that a final class cannot be subclassed. By using the open annotation on a class, compiler allows you to derive new classes from it.||||||When you run the program, the output will be:|||Here, two classes MathTeacher and Footballer are derived from the Person class.|||The primary constructor of the Person class declared two properties: age and name, and it has an initializer block. The initilizer block (and member functions) of the base class Person can be accessed by the objects of derived classes (MathTeacher and Footballer).|||Derived classes MathTeacher and Footballer have their own member functions teachMaths() and playFootball() respectively. These functions are accessible only from the objects of their respective class.|||When the object t1 of MathTeacher class is created,|||The parameters are passed to the primary constructor. In Kotlin, init block is called when the object is created. Since, MathTeacher is derived from Person class, it looks for initializer block in the base class (Person) and executes it. If the MathTeacher had init block, the compiler would have also executed the init block of the derived class.|||Next, the teachMaths() function for object t1 is called using t1.teachMaths() statement.|||The program works similarly when object f1 of Footballer class is created. It executes the init block of the base class. Then, the playFootball() method of Footballer class is called using statement f1.playFootball().|||If the base class and the derived class contains a member function (or property) with the same name, you can need to override the member function of the derived class using override keyword, and use open keyword for the member function of the base class.|||When you run the program, the output will be:|||Here, girl.displayAge(31) calls the displayAge() method of the derived class Girl.|||You can override property of the base class in similar way.|||Visit how Kotlin getters and setters work in Kotlin before you check the example below.|||When you run the program, the output will be:|||As you can see, we have used override and open keywords for age property in derived class and base class respectively.|||You can call functions (and access properties) of the base class from a derived class using super keyword. Here's how:|||When you run the program, the output will be:","Kotlin Class and Objects$$$Kotlin Primary Constructor$$$If the class has a primary constructor, the base must be initialized using the parameters of the primary constructor. In the above program, both derived classes have two parameters age and name, and both these parameters are initialized in primary constructor in the base class.Here's another example:open class Person(age: Int, name: String) {    // some code}class Footballer(age: Int, name: String, club: String): Person(age, name) {    init {        println(""Football player $name of age $age and plays for $club."")    }    fun playFootball() {        println(""I am playing football."")    }}fun main(args: Array<String>) {    val f1 = Footballer(29, ""Cristiano"", ""LA Galaxy"")}Here the primary constructor of the derived class has 3 parameters, and the base class has 2 parameters. Note that, both parameters of the base class are initialized. $$$In case of no primary constructor, each base class has to initialize the base (using super keyword), or delegate to another constructor which does that. For example,fun main(args: Array<String>) {    val p1 = AuthLog(""Bad Password"")}open class Log {    var data: String = """"    var numberOfData = 0    constructor(_data: String) {    }    constructor(_data: String, _numberOfData: Int) {        data = _data        numberOfData = _numberOfData        println(""$data: $numberOfData times"")    }}class AuthLog: Log {    constructor(_data: String): this(""From AuthLog -> + $_data"", 10) {    }    constructor(_data: String, _numberOfData: Int): super(_data, _numberOfData) {    }}To learn more on how this program works, visit Kotlin Secondary Constructor.$$$Inheritance Definition$$$Why Inheritance?$$$Kotlin Inheritance$$$Example: Kotlin Inheritance$$$Important Notes$$$Overriding Member Function and Properties$$$Calling Members of Base from Derived Class",,
https://www.programiz.com/kotlin-programming/visibility-modifiers,Kotlin Visibility Modifiers,Visibility Modifiers Inside Package$$$Visibility Modifiers Inside Classes and Interfaces$$$Changing Visibility of a Constructor$$$Table of Contents,,"In this article, you will learn about all 4 visibility modifiers in Kotlin and how they work in different scenarios.|||Visibility modifiers are keywords that set the visibility (accessibility) of classes, objects, interface, constructors, functions, properties and their setters. (You cannot set visibility modifier of getters as they always take the same visibility as that of the property.)|||In Kotlin Class and Objects article, you learned about visibility modifiers public and private in brief. You will learn about two more visibility modifiers protected and internal (as well as public and private) in detail.|||A package organizes a set of related functions, properties and classes, objects, and interfaces. Recommended reading: Kotlin Packages|||Note: If visibility modifier is not specified, it is public by default.|||Let's take an example:|||Here's how visibility modifiers works for members (functions, properties) declared inside a class:|||Note: If you override a protected member in the derived class without specifying its visibility, its visibility will also be protected.||||||Let's take an example:|||By default, the visibility of a constructor is public. However, you can change it. For that, you need to explicitly add constructor keyword.|||The constructor is public by default in the example below:|||Here's how you can change its visibility.|||Here the constructor is private.|||Note: In Kotlin, local functions, variables and classes cannot have visibility modifiers.",What is a visibility modifier?$$$Visibility Modifiers Inside a Package$$$Visibility Modifiers Inside Class and Interfaces$$$Changing Visibility of a Constructor,,Modifier|||Description$$$public|||declarations are visible everywhere$$$private|||visible inside the file containing the declaration$$$internal|||visible inside the same module (a set of Kotlin files compiled together)$$$protected|||not available for packages (used for subclasses)$$$Modifier|||Description$$$public|||visible to any client who can see the declaring class$$$private|||visible inside the class only$$$protected|||visible inside the class and its subclasses$$$internal|||visible to any client inside the module that can see the declaring class
