Links,Main Heading,Chapter Headings,Description,Contents,Unordered Lists,Ordered Lists,Table Data
https://www.programiz.com/python-programming/string,Python Strings (With Examples),Video: Python Strings$$$What is String in Python?$$$How to create a string in Python?$$$How to access characters in a string?$$$How to change or delete a string?$$$Python String Operations$$$Python String Formatting$$$Common Python String Methods$$$Concatenation of Two or More Strings$$$Iterating Through a string$$$String Membership Test$$$Built-in functions to Work with Python$$$Escape Sequence$$$Raw String to ignore escape sequence$$$The format() Method for Formatting Strings$$$Old style formatting$$$Table of Contents,,"In this tutorial you will learn to create, format, modify and delete strings in Python. Also, you will be introduced to various string operations and functions.|||A string is a sequence of characters.|||A character is simply a symbol. For example, the English language has 26 characters.|||Computers do not deal with characters, they deal with numbers (binary). Even though you may see characters on your screen, internally it is stored and manipulated as a combination of 0s and 1s.|||This conversion of character to a number is called encoding, and the reverse process is decoding. ASCII and Unicode are some of the popular encodings used.|||In Python, a string is a sequence of Unicode characters. Unicode was introduced to include every character in all languages and bring uniformity in encoding. You can learn about Unicode from Python Unicode.|||Strings can be created by enclosing characters inside a single quote or double-quotes. Even triple quotes can be used in Python but generally used to represent multiline strings and docstrings.|||When you run the program, the output will be:|||We can access individual characters using indexing and a range of characters using slicing. Index starts from 0. Trying to access a character out of index range will raise an IndexError. The index must be an integer. We can't use floats or other types, this will result into TypeError.|||Python allows negative indexing for its sequences.|||The index of -1 refers to the last item, -2 to the second last item and so on. We can access a range of items in a string by using the slicing operator :(colon).|||When we run the above program, we get the following output:|||If we try to access an index out of the range or use numbers other than an integer, we will get errors.|||Slicing can be best visualized by considering the index to be between the elements as shown below.|||If we want to access a range, we need the index that will slice the portion from the string.||||||Strings are immutable. This means that elements of a string cannot be changed once they have been assigned. We can simply reassign different strings to the same name.|||We cannot delete or remove characters from a string. But deleting the string entirely is possible using the del keyword.|||There are many operations that can be performed with strings which makes it one of the most used data types in Python.|||To learn more about the data types available in Python visit: Python Data Types|||Joining of two or more strings into a single one is called concatenation.|||The + operator does this in Python. Simply writing two string literals together also concatenates them.|||The * operator can be used to repeat the string for a given number of times.|||When we run the above program, we get the following output:|||Writing two string literals together also concatenates them like + operator.|||If we want to concatenate strings in different lines, we can use parentheses.|||We can iterate through a string using a for loop. Here is an example to count the number of 'l's in a string.|||When we run the above program, we get the following output:|||We can test if a substring exists within a string or not, using the keyword in.|||Various built-in functions that work with sequence work with strings as well.|||Some of the commonly used ones are enumerate() and len(). The enumerate() function returns an enumerate object. It contains the index and value of all the items in the string as pairs. This can be useful for iteration.|||Similarly, len() returns the length (number of characters) of the string.|||When we run the above program, we get the following output:|||If we want to print a text like He said, ""What's there?"", we can neither use single quotes nor double quotes. This will result in a SyntaxError as the text itself contains both single and double quotes.|||One way to get around this problem is to use triple quotes. Alternatively, we can use escape sequences.|||An escape sequence starts with a backslash and is interpreted differently. If we use a single quote to represent a string, all the single quotes inside the string must be escaped. Similar is the case with double quotes. Here is how it can be done to represent the above text.|||When we run the above program, we get the following output:|||Here is a list of all the escape sequences supported by Python.|||Here are some examples|||Sometimes we may wish to ignore the escape sequences inside a string. To do this we can place r or R in front of the string. This will imply that it is a raw string and any escape sequence inside it will be ignored.|||The format() method that is available with the string object is very versatile and powerful in formatting strings. Format strings contain curly braces {} as placeholders or replacement fields which get replaced.|||We can use positional arguments or keyword arguments to specify the order.|||When we run the above program, we get the following output:|||The format() method can have optional format specifications. They are separated from the field name using colon. For example, we can left-justify <, right-justify > or center ^ a string in the given space.|||We can also format integers as binary, hexadecimal, etc. and floats can be rounded or displayed in the exponent format. There are tons of formatting you can use. Visit here for all the string formatting available with the format() method.|||We can even format strings like the old sprintf() style used in C programming language. We use the % operator to accomplish this.|||There are numerous methods available with the string object. The format() method that we mentioned above is one of them. Some of the commonly used methods are lower(), upper(), join(), split(), find(), replace() etc. Here is a complete list of all the built-in methods to work with strings in Python.",What is String in Python?$$$How to create a string in Python?$$$How to access characters in a string?$$$How to change or delete a string?$$$Python String OperationsConcatenation of Two or More StringsIterating Through StringString Membership TestBuilt-in functions to Work with Python$$$Python String FormattingEscape SequenceRaw String to ignore escape sequenceThe format() Method for Formatting StringsOld style formatting$$$Common Python String Methods$$$Concatenation of Two or More Strings$$$Iterating Through String$$$String Membership Test$$$Built-in functions to Work with Python$$$Escape Sequence$$$Raw String to ignore escape sequence$$$The format() Method for Formatting Strings$$$Old style formatting,,"Escape Sequence|||Description$$$\newline|||Backslash and newline ignored$$$\\|||Backslash$$$\'|||Single quote$$$\""|||Double quote$$$\a|||ASCII Bell$$$\b|||ASCII Backspace$$$\f|||ASCII Formfeed$$$\n|||ASCII Linefeed$$$\r|||ASCII Carriage Return$$$\t|||ASCII Horizontal Tab$$$\v|||ASCII Vertical Tab$$$\ooo|||Character with octal value ooo$$$\xHH|||Character with hexadecimal value HH"
https://www.programiz.com/python-programming/set,Python Set (With Examples),Video: Sets in Python$$$Creating Python Sets$$$Modifying a set in Python$$$Removing elements from a set$$$Python Set Operations$$$Other Python Set Methods$$$Other Set Operations$$$Python Frozenset$$$Set Union$$$Set Intersection$$$Set Difference$$$Set Symmetric Difference$$$Set Membership Test$$$Iterating Through a Set$$$Built-in Functions with Set$$$Table of Contents,,"In this tutorial, you'll learn everything about Python sets; how they are created, adding or removing elements from them, and all operations performed on sets in Python.|||A set is an unordered collection of items. Every set element is unique (no duplicates) and must be immutable (cannot be changed).|||However, a set itself is mutable. We can add or remove items from it.|||Sets can also be used to perform mathematical set operations like union, intersection, symmetric difference, etc.|||A set is created by placing all the items (elements) inside curly braces {}, separated by comma, or by using the built-in set() function.|||It can have any number of items and they may be of different types (integer, float, tuple, string etc.). But a set cannot have mutable elements like lists, sets or dictionaries as its elements.|||Output|||Try the following examples as well.|||Output|||Creating an empty set is a bit tricky.|||Empty curly braces {} will make an empty dictionary in Python. To make a set without any elements, we use the set() function without any argument.|||Output|||Sets are mutable. However, since they are unordered, indexing has no meaning.|||We cannot access or change an element of a set using indexing or slicing. Set data type does not support it.|||We can add a single element using the add() method, and multiple elements using the update() method. The update() method can take tuples, lists, strings or other sets as its argument. In all cases, duplicates are avoided.|||Output||||||A particular item can be removed from a set using the methods discard() and remove().|||The only difference between the two is that the discard() function leaves a set unchanged if the element is not present in the set. On the other hand, the remove() function will raise an error in such a condition (if element is not present in the set).|||The following example will illustrate this.|||Output|||Similarly, we can remove and return an item using the pop() method.|||Since set is an unordered data type, there is no way of determining which item will be popped. It is completely arbitrary.|||We can also remove all the items from a set using the clear() method.|||Output|||Sets can be used to carry out mathematical set operations like union, intersection, difference and symmetric difference. We can do this with operators or methods.|||Let us consider the following two sets for the following operations.|||Union of A and B is a set of all elements from both sets.|||Union is performed using | operator. Same can be accomplished using the union() method.|||Output|||Try the following examples on Python shell.|||Intersection of A and B is a set of elements that are common in both the sets.|||Intersection is performed using & operator. Same can be accomplished using the intersection() method.|||Output|||Try the following examples on Python shell.|||Difference of the set B from set A(A - B) is a set of elements that are only in A but not in B. Similarly, B - A is a set of elements in B but not in A.|||Difference is performed using - operator. Same can be accomplished using the difference() method.|||Output|||Try the following examples on Python shell.|||Symmetric Difference of A and B is a set of elements in A and B but not in both (excluding the intersection).|||Symmetric difference is performed using ^ operator. Same can be accomplished using the method symmetric_difference().|||Output|||Try the following examples on Python shell.|||There are many set methods, some of which we have already used above. Here is a list of all the methods that are available with the set objects:|||We can test if an item exists in a set or not, using the in keyword.|||Output|||We can iterate through each item in a set using a for loop.|||Built-in functions like all(), any(), enumerate(), len(), max(), min(), sorted(), sum() etc. are commonly used with sets to perform different tasks.|||Frozenset is a new class that has the characteristics of a set, but its elements cannot be changed once assigned. While tuples are immutable lists, frozensets are immutable sets.|||Sets being mutable are unhashable, so they can't be used as dictionary keys. On the other hand, frozensets are hashable and can be used as keys to a dictionary.|||Frozensets can be created using the frozenset() function.|||This data type supports methods like copy(), difference(), intersection(), isdisjoint(), issubset(), issuperset(), symmetric_difference() and union(). Being immutable, it does not have methods that add or remove elements.|||Try these examples on Python shell.",Introduction$$$Creating Python Sets$$$Modifying Python Sets$$$Removing elements Sets$$$Python Set Operations$$$Set Union$$$Set Intersection$$$Set Difference$$$Set Symmetric Difference$$$Other Python Set Methods$$$Set Membership Test$$$Iterating Through a Set$$$Built-in Functions with Set$$$Python Frozenset,,"Method|||Description$$$add()|||Adds an element to the set$$$clear()|||Removes all elements from the set$$$copy()|||Returns a copy of the set$$$difference()|||Returns the difference of two or more sets as a new set$$$difference_update()|||Removes all elements of another set from this set$$$discard()|||Removes an element from the set if it is a member. (Do nothing if the element is not in set)$$$intersection()|||Returns the intersection of two sets as a new set$$$intersection_update()|||Updates the set with the intersection of itself and another$$$isdisjoint()|||Returns True if two sets have a null intersection$$$issubset()|||Returns True if another set contains this set$$$issuperset()|||Returns True if this set contains another set$$$pop()|||Removes and returns an arbitrary set element. Raises KeyError if the set is empty$$$remove()|||Removes an element from the set. If the element is not a member, raises a KeyError$$$symmetric_difference()|||Returns the symmetric difference of two sets as a new set$$$symmetric_difference_update()|||Updates a set with the symmetric difference of itself and another$$$union()|||Returns the union of sets in a new set$$$update()|||Updates the set with the union of itself and others$$$Function|||Description$$$all()|||Returns True if all elements of the set are true (or if the set is empty).$$$any()|||Returns True if any element of the set is true. If the set is empty, returns False.$$$enumerate()|||Returns an enumerate object. It contains the index and value for all the items of the set as a pair.$$$len()|||Returns the length (the number of items) in the set.$$$max()|||Returns the largest item in the set.$$$min()|||Returns the smallest item in the set.$$$sorted()|||Returns a new sorted list from elements in the set(does not sort the set itself).$$$sum()|||Returns the sum of all elements in the set."
https://www.programiz.com/python-programming/dictionary,Python Dictionary (With Examples),Video: Python Dictionaries to Store key/value Pairs$$$Creating Python Dictionary$$$Accessing Elements from Dictionary$$$Changing and Adding Dictionary elements$$$Removing elements from Dictionary$$$Python Dictionary Methods$$$Python Dictionary Comprehension$$$Other Dictionary Operations$$$Dictionary Membership Test$$$Iterating Through a Dictionary$$$Dictionary Built-in Functions$$$Table of Contents,,"In this tutorial, you'll learn everything about Python dictionaries; how they are created, accessing, adding, removing elements from them and various built-in methods.|||Python dictionary is an unordered collection of items. Each item of a dictionary has a key/value pair.|||Dictionaries are optimized to retrieve values when the key is known.|||Creating a dictionary is as simple as placing items inside curly braces {} separated by commas.|||An item has a key and a corresponding value that is expressed as a pair (key: value).|||While the values can be of any data type and can repeat, keys must be of immutable type (string, number or tuple with immutable elements) and must be unique.|||As you can see from above, we can also create a dictionary using the built-in dict() function.|||While indexing is used with other data types to access values, a dictionary uses keys. Keys can be used either inside square brackets [] or with the get() method.|||If we use the square brackets [], KeyError is raised in case a key is not found in the dictionary. On the other hand, the get() method returns None if the key is not found.|||Output|||Dictionaries are mutable. We can add new items or change the value of existing items using an assignment operator.|||If the key is already present, then the existing value gets updated. In case the key is not present, a new (key: value) pair is added to the dictionary.|||Output|||We can remove a particular item in a dictionary by using the pop() method. This method removes an item with the provided key and returns the value.|||The popitem() method can be used to remove and return an arbitrary (key, value) item pair from the dictionary. All the items can be removed at once, using the clear() method.|||We can also use the del keyword to remove individual items or the entire dictionary itself.||||||Output|||Methods that are available with a dictionary are tabulated below. Some of them have already been used in the above examples.|||Here are a few example use cases of these methods.|||Output|||Dictionary comprehension is an elegant and concise way to create a new dictionary from an iterable in Python.|||Dictionary comprehension consists of an expression pair (key: value) followed by a for statement inside curly braces {}.|||Here is an example to make a dictionary with each item being a pair of a number and its square.|||Output|||This code is equivalent to|||Output|||A dictionary comprehension can optionally contain more for or if statements.|||An optional if statement can filter out items to form the new dictionary.|||Here are some examples to make a dictionary with only odd items.|||Output|||To learn more dictionary comprehensions, visit Python Dictionary Comprehension.|||We can test if a key is in a dictionary or not using the keyword in. Notice that the membership test is only for the keys and not for the values.|||Output|||We can iterate through each key in a dictionary using a for loop.|||Output|||Built-in functions like all(), any(), len(), cmp(), sorted(), etc. are commonly used with dictionaries to perform different tasks.|||Here are some examples that use built-in functions to work with a dictionary.|||Output",Introduction$$$Creating Python Dictionary$$$Accessing Elements from Dictionary$$$Changing Dictionary Values$$$Removing Dictionary Items$$$Python Dictionary Methods$$$Python Dictionary Comprehension$$$Other Dictionary Operations$$$Dictionary Membership Test$$$Iterating Through Dictionary$$$Dictionary Built-in Functions,,"Method|||Description$$$clear()|||Removes all items from the dictionary.$$$copy()|||Returns a shallow copy of the dictionary.$$$fromkeys(seq[, v])|||Returns a new dictionary with keys from seq and value equal to v (defaults to None).$$$get(key[,d])|||Returns the value of the key. If the key does not exist, returns d (defaults to None).$$$items()|||Return a new object of the dictionary's items in (key, value) format.$$$keys()|||Returns a new object of the dictionary's keys.$$$pop(key[,d])|||Removes the item with the key and returns its value or d if key is not found. If d is not provided and the key is not found, it raises KeyError.$$$popitem()|||Removes and returns an arbitrary item (key, value). Raises KeyError if the dictionary is empty.$$$setdefault(key[,d])|||Returns the corresponding value if the key is in the dictionary. If not, inserts the key with a value of d and returns d (defaults to None).$$$update([other])|||Updates the dictionary with the key/value pairs from other, overwriting existing keys.$$$values()|||Returns a new object of the dictionary's values$$$Function|||Description$$$all()|||Return True if all keys of the dictionary are True (or if the dictionary is empty).$$$any()|||Return True if any key of the dictionary is true. If the dictionary is empty, return False.$$$len()|||Return the length (the number of items) in the dictionary.$$$cmp()|||Compares items of two dictionaries. (Not available in Python 3)$$$sorted()|||Return a new sorted list of keys in the dictionary."
