Links,Main Heading,Chapter Headings,Description,Contents,Unordered Lists,Ordered Lists,Table Data
https://www.programiz.com/python-programming/while-loop,Python while Loop,Video: Python while Loop$$$What is while loop in Python?$$$While loop with else$$$Syntax of while Loop in Python$$$Flowchart of while Loop$$$Example: Python while Loop$$$Table of Contents,,"Loops are used in programming to repeat a specific block of code. In this article, you will learn to create a while loop in Python.|||The while loop in Python is used to iterate over a block of code as long as the test expression (condition) is true.|||We generally use this loop when we don't know the number of times to iterate beforehand.|||In the while loop, test expression is checked first. The body of the loop is entered only if the test_expression evaluates to True. After one iteration, the test expression is checked again. This process continues until the test_expression evaluates to False.|||In Python, the body of the while loop is determined through indentation.|||The body starts with indentation and the first unindented line marks the end.|||Python interprets any non-zero value as True. None and 0 are interpreted as False.|||When you run the program, the output will be:||||||In the above program, the test expression will be True as long as our counter variable i is less than or equal to n (10 in our program).|||We need to increase the value of the counter variable in the body of the loop. This is very important (and mostly forgotten). Failing to do so will result in an infinite loop (never-ending loop).|||Finally, the result is displayed.|||Same as with for loops, while loops can also have an optional else block.|||The else part is executed if the condition in the while loop evaluates to False.|||The while loop can be terminated with a break statement. In such cases, the else part is ignored. Hence, a while loop's else part runs if no break occurs and the condition is false.|||Here is an example to illustrate this.|||Output|||Here, we use a counter variable to print the string Inside loop three times.|||On the fourth iteration, the condition in while becomes False. Hence, the else part is executed.",What is while loop in Python?Syntax of while Loop in PythonFlowchart of while loopExample: Python while Loop$$$While loop with else$$$Syntax of while Loop in Python$$$Flowchart of while loop$$$Example: Python while Loop,,
https://www.programiz.com/python-programming/break-continue,Python break and continue,Video: Python break and continue Statement$$$What is the use of break and continue in Python?$$$Python break statement$$$Python continue statement$$$Syntax of break$$$Flowchart of break$$$Example: Python break$$$Syntax of Continue$$$Flowchart of continue $$$Example: Python continue$$$Table of Contents,,"In this article, you will learn to use break and continue statements to alter the flow of a loop.|||In Python, break and continue statements can alter the flow of a normal loop.|||Loops iterate over a block of code until the test expression is false, but sometimes we wish to terminate the current iteration or even the whole loop without checking test expression.|||The break and continue statements are used in these cases.|||The break statement terminates the loop containing it. Control of the program flows to the statement immediately after the body of the loop.|||If the break statement is inside a nested loop (loop inside another loop), the break statement will terminate the innermost loop.|||The working of break statement in for loop and while loop is shown below.|||Output||||||In this program, we iterate through the ""string"" sequence. We check if the letter is i, upon which we break from the loop. Hence, we see in our output that all the letters up till i gets printed. After that, the loop terminates.|||The continue statement is used to skip the rest of the code inside a loop for the current iteration only. Loop does not terminate but continues on with the next iteration.|||The working of the continue statement in for and while loop is shown below.|||Output|||This program is same as the above example except the break statement has been replaced with continue.|||We continue with the loop, if the string is i, not executing the rest of the block. Hence, we see in our output that all the letters except i gets printed.",What is the use of break and continue in Python?$$$Python break statementSyntax of breakFlowchart of breakExample of break$$$Python continue statementSyntax of ContinueFlowchart of continueExample: Python continue$$$Syntax of break$$$Flowchart of break$$$Example of break$$$Syntax of Continue$$$Flowchart of continue$$$Example: Python continue,,
https://www.programiz.com/python-programming/pass-statement,Python pass statement,Video: Python pass Statement$$$What is pass statement in Python?$$$Syntax of pass$$$Example: pass Statement$$$Table of Contents,,"In this article, you'll learn about pass statement. It is used as a placeholder for future implementation of functions, loops, etc.|||In Python programming, the pass statement is a null statement. The difference between a comment and a pass statement in Python is that while the interpreter ignores a comment entirely, pass is not ignored.|||However, nothing happens when the pass is executed. It results in no operation (NOP).|||We generally use it as a placeholder.||||||Suppose we have a loop or a function that is not implemented yet, but we want to implement it in the future. They cannot have an empty body. The interpreter would give an error. So, we use the pass statement to construct a body that does nothing.|||We can do the same thing in an empty function or class as well.",What is pass statement in Python?Syntax of passExample: pass Statement$$$Syntax of pass$$$Example: pass Statement,,
https://www.programiz.com/python-programming/function,Python Functions (def): Definition with Examples,Video: Introduction to Python Functions$$$What is a function in Python?$$$Docstrings$$$The return statement$$$How Function works in Python?$$$Scope and Lifetime of variables$$$Types of Functions$$$Syntax of Function$$$Example of a function$$$How to call a function in python?$$$Syntax of return$$$Example of return$$$Table of Contents,,"In this article, you'll learn about functions, what a function is, the syntax, components, and types of functions. Also, you'll learn to create a function in Python.|||In Python, a function is a group of related statements that performs a specific task.|||Functions help break our program into smaller and modular chunks. As our program grows larger and larger, functions make it more organized and manageable.|||Furthermore, it avoids repetition and makes the code reusable.|||Above shown is a function definition that consists of the following components.|||Once we have defined a function, we can call it from another function, program, or even the Python prompt. To call a function we simply type the function name with appropriate parameters.|||Try running the above code in the Python program with the function definition to see the output.|||Note: In python, the function definition should always be present before the function call. Otherwise, we will get an error. For example,||||||The first string after the function header is called the docstring and is short for documentation string. It is briefly used to explain what a function does.|||Although optional, documentation is a good programming practice. Unless you can remember what you had for dinner last week, always document your code.|||In the above example, we have a docstring immediately below the function header. We generally use triple quotes so that docstring can extend up to multiple lines. This string is available to us as the __doc__ attribute of the function.|||For example:|||Try running the following into the Python shell to see the output.||| |||To learn more about docstrings in Python, visit Python Docstrings.|||The return statement is used to exit a function and go back to the place from where it was called.|||This statement can contain an expression that gets evaluated and the value is returned. If there is no expression in the statement or the return statement itself is not present inside a function, then the function will return the None object.|||For example:|||Here, None is the returned value since greet() directly prints the name and no return statement is used.|||Output|||Scope of a variable is the portion of a program where the variable is recognized. Parameters and variables defined inside a function are not visible from outside the function. Hence, they have a local scope.|||The lifetime of a variable is the period throughout which the variable exists in the memory. The lifetime of variables inside a function is as long as the function executes.|||They are destroyed once we return from the function. Hence, a function does not remember the value of a variable from its previous calls.|||Here is an example to illustrate the scope of a variable inside a function.|||Output|||Here, we can see that the value of x is 20 initially. Even though the function my_func() changed the value of x to 10, it did not affect the value outside the function.|||This is because the variable x inside the function is different (local to the function) from the one outside. Although they have the same names, they are two different variables with different scopes.|||On the other hand, variables outside of the function are visible from inside. They have a global scope.|||We can read these values from inside the function but cannot change (write) them. In order to modify the value of variables outside the function, they must be declared as global variables using the keyword global.|||Basically, we can divide functions into the following two types:",What is a function in Python?$$$Syntax of Function$$$Example of a function$$$How to call functions?$$$Docstrings$$$The return statement$$$Syntax of return$$$Example of return$$$How Function works in Python?$$$Scope and Lifetime of variables$$$Types of Functions,Keyword def that marks the start of the function header.$$$A function name to uniquely identify the function. Function naming follows the same rules of writing identifiers in Python.$$$Parameters (arguments) through which we pass values to a function. They are optional.$$$A colon (:) to mark the end of the function header.$$$Optional documentation string (docstring) to describe what the function does.$$$One or more valid python statements that make up the function body. Statements must have the same indentation level (usually 4 spaces).$$$An optional return statement to return a value from the function.$$$Built-in functions - Functions that are built into Python.$$$User-defined functions - Functions defined by the users themselves.,
https://www.programiz.com/python-programming/function-argument,"Python Function Arguments (Default, Keyword and Arbitrary)","Video: Python Function Arguments: Positional, Keywords and Default$$$Arguments$$$Variable Function Arguments$$$Python Default Arguments$$$Python Keyword Arguments$$$Python Arbitrary Arguments$$$Table of Contents",,"In Python, you can define a function that takes variable number of arguments. In this article, you will learn to define such functions using default, keyword and arbitrary arguments.|||In the user-defined function topic, we learned about defining a function and calling it. Otherwise, the function call will result in an error. Here is an example.|||Output|||Here, the function greet() has two parameters.|||Since we have called this function with two arguments, it runs smoothly and we do not get any error.|||If we call it with a different number of arguments, the interpreter will show an error message. Below is a call to this function with one and no arguments along with their respective error messages.|||Up until now, functions had a fixed number of arguments. In Python, there are other ways to define a function that can take variable number of arguments.|||Three different forms of this type are described below.|||Function arguments can have default values in Python.|||We can provide a default value to an argument by using the assignment operator (=). Here is an example.|||Output||||||In this function, the parameter name does not have a default value and is required (mandatory) during a call.|||On the other hand, the parameter msg has a default value of ""Good morning!"". So, it is optional during a call. If a value is provided, it will overwrite the default value.|||Any number of arguments in a function can have a default value. But once we have a default argument, all the arguments to its right must also have default values.|||This means to say, non-default arguments cannot follow default arguments. For example, if we had defined the function header above as:|||We would get an error as:|||When we call a function with some values, these values get assigned to the arguments according to their position.|||For example, in the above function greet(), when we called it as greet(""Bruce"", ""How do you do?""), the value ""Bruce"" gets assigned to the argument name and similarly ""How do you do?"" to msg.|||Python allows functions to be called using keyword arguments. When we call functions in this way, the order (position) of the arguments can be changed. Following calls to the above function are all valid and produce the same result.|||As we can see, we can mix positional arguments with keyword arguments during a function call. But we must keep in mind that keyword arguments must follow positional arguments.|||Having a positional argument after keyword arguments will result in errors. For example, the function call as follows:|||Will result in an error:|||Sometimes, we do not know in advance the number of arguments that will be passed into a function. Python allows us to handle this kind of situation through function calls with an arbitrary number of arguments.|||In the function definition, we use an asterisk (*) before the parameter name to denote this kind of argument. Here is an example.|||Output|||Here, we have called the function with multiple arguments. These arguments get wrapped up into a tuple before being passed into the function. Inside the function, we use a for loop to retrieve all the arguments back.",Arguments$$$Variable Function ArgumentsPython Default ArgumentsPython Keyword ArgumentsPython Arbitrary Arguments$$$Python Default Arguments$$$Python Keyword Arguments$$$Python Arbitrary Arguments,,
https://www.programiz.com/python-programming/recursion,Python Recursion (Recursive Function),What is recursion?$$$Python Recursive Function$$$Advantages of Recursion$$$Disadvantages of Recursion$$$Example of a recursive function$$$Table of Contents,," In this tutorial, you will learn to create a recursive function (a function that calls itself).|||Recursion is the process of defining something in terms of itself.|||A physical world example would be to place two parallel mirrors facing each other. Any object in between them would be reflected recursively.|||In Python, we know that a function can call other functions. It is even possible for the function to call itself. These types of construct are termed as recursive functions.|||The following image shows the working of a recursive function called recurse.|||Following is an example of a recursive function to find the factorial of an integer.|||Factorial of a number is the product of all the integers from 1 to that number. For example, the factorial of 6 (denoted as 6!) is 1*2*3*4*5*6 = 720.|||Output|||In the above example, factorial() is a recursive function as it calls itself.||||||When we call this function with a positive integer, it will recursively call itself by decreasing the number.|||Each function multiplies the number with the factorial of the number below it until it is equal to one. This recursive call can be explained in the following steps.|||Let's look at an image that shows a step-by-step process of what is going on:|||Our recursion ends when the number reduces to 1. This is called the base condition.|||Every recursive function must have a base condition that stops the recursion or else the function calls itself infinitely.|||The Python interpreter limits the depths of recursion to help avoid infinite recursions, resulting in stack overflows.|||By default, the maximum depth of recursion is 1000. If the limit is crossed, it results in RecursionError. Let's look at one such condition.|||Output",What is recursion?$$$Python Recursive Function$$$Advantages of Recursion$$$Disadvantages of Recursion,Recursive functions make the code look clean and elegant.$$$A complex task can be broken down into simpler sub-problems using recursion.$$$Sequence generation is easier with recursion than using some nested iteration.$$$Sometimes the logic behind recursion is hard to follow through.$$$Recursive calls are expensive (inefficient) as they take up a lot of memory and time.$$$Recursive functions are hard to debug.,
https://www.programiz.com/python-programming/anonymous-function,Python Lambda (Anonymous) Function,Video: Python Lambda$$$What are lambda functions in Python?$$$How to use lambda Functions in Python?$$$Use of Lambda Function in python$$$Syntax of Lambda Function in python$$$Example of Lambda Function in python$$$Example use with filter()$$$Example use with map()$$$Table of Contents,,"In this article, you'll learn about the anonymous function, also known as lambda functions. You'll learn what they are, their syntax and how to use them (with examples).|||In Python, an anonymous function is a function that is defined without a name.|||While normal functions are defined using the def keyword in Python, anonymous functions are defined using the lambda keyword.|||Hence, anonymous functions are also called lambda functions.|||A lambda function in python has the following syntax.|||Lambda functions can have any number of arguments but only one expression. The expression is evaluated and returned. Lambda functions can be used wherever function objects are required.|||Here is an example of lambda function that doubles the input value.|||Output||||||In the above program, lambda x: x * 2 is the lambda function. Here x is the argument and x * 2 is the expression that gets evaluated and returned.|||This function has no name. It returns a function object which is assigned to the identifier double. We can now call it as a normal function. The statement|||is nearly the same as:|||We use lambda functions when we require a nameless function for a short period of time.|||In Python, we generally use it as an argument to a higher-order function (a function that takes in other functions as arguments). Lambda functions are used along with built-in functions like filter(), map() etc.|||The filter() function in Python takes in a function and a list as arguments.|||The function is called with all the items in the list and a new list is returned which contains items for which the function evaluates to True.|||Here is an example use of filter() function to filter out only even numbers from a list.|||Output|||The map() function in Python takes in a function and a list.|||The function is called with all the items in the list and a new list is returned which contains items returned by that function for each item.|||Here is an example use of map() function to double all the items in a list.|||Output",What are lambda functions in Python?$$$How to use lambda Functions in Python?Syntax of Lambda Function in pythonExample of Lambda Function in pythonUse of Lambda Function in python$$$Syntax of Lambda Function in python$$$Example of Lambda Function in python$$$Use of Lambda Function in python,,
https://www.programiz.com/python-programming/global-local-nonlocal-variables,"Python Global, Local and Nonlocal variables (With Examples)",Video: Python Local and Global Variables$$$Global Variables$$$Local Variables$$$Global and local variables$$$Nonlocal Variables$$$Example 1: Create a Global Variable$$$Example 2: Accessing local variable outside the scope$$$Example 3: Create a Local Variable$$$Example 4: Using Global and Local variables in the same code$$$Example 5: Global variable and Local variable with same name$$$Example 6: Create a nonlocal variable$$$Table of Contents,,"In this tutorial, you’ll learn about Python Global variables, Local variables, Nonlocal variables and where to use them.|||In Python, a variable declared outside of the function or in global scope is known as a global variable. This means that a global variable can be accessed inside or outside of the function.|||Let's see an example of how a global variable is created in Python.|||Output|||In the above code, we created x as a global variable and defined a foo() to print the global variable x. Finally, we call the foo() which will print the value of x.|||What if you want to change the value of x inside a function?|||Output|||The output shows an error because Python treats x as a local variable and x is also not defined inside foo().|||To make this work, we use the global keyword. Visit Python Global Keyword to learn more.|||A variable declared inside the function's body or in the local scope is known as a local variable.|||Output|||The output shows an error because we are trying to access a local variable y in a global scope whereas the local variable only works inside foo() or local scope.|||Let's see an example on how a local variable is created in Python.|||Normally, we declare a variable inside the function to create a local variable.|||Output|||Let's take a look at the earlier problem where x was a global variable and we wanted to modify x inside foo().||||||Here, we will show how to use global variables and local variables in the same code.|||Output|||In the above code, we declare x as a global and y as a local variable in the foo(). Then, we use multiplication operator * to modify the global variable x and we print both x and y.|||After calling the foo(), the value of x becomes global global because we used the x * 2 to print two times global. After that, we print the value of local variable y i.e local.|||Output|||In the above code, we used the same name x for both global variable and local variable. We get a different result when we print the same variable because the variable is declared in both scopes, i.e. the local scope inside foo() and global scope outside foo().|||When we print the variable inside foo() it outputs local x: 10. This is called the local scope of the variable.|||Similarly, when we print the variable outside the foo(), it outputs global x: 5. This is called the global scope of the variable.|||Nonlocal variables are used in nested functions whose local scope is not defined. This means that the variable can be neither in the local nor the global scope.|||Let's see an example of how a nonlocal variable is used in Python.|||We use nonlocal keywords to create nonlocal variables.|||Output|||In the above code, there is a nested inner() function. We use nonlocal keywords to create a nonlocal variable. The inner() function is defined in the scope of another function outer().|||Note : If we change the value of a nonlocal variable, the changes appear in the local variable.",Global Variables in Python$$$Local Variables in Python$$$Global and Local Variables Together$$$Nonlocal Variables in Python,,
