Links,Main Heading,Chapter Headings,Description,Contents,Unordered Lists,Ordered Lists,Table Data
https://www.programiz.com/python-programming/generator,"Python yield, Generators and Generator Expressions",Video: Python Generators$$$Generators in Python$$$Create Generators in Python$$$Differences between Generator function and Normal function$$$Python Generators with a Loop$$$Python Generator Expression$$$Use of Python Generators$$$1. Easy to Implement$$$2. Memory Efficient$$$3. Represent Infinite Stream$$$4. Pipelining Generators$$$Table of Contents,,"In this tutorial, you'll learn how to create iterations easily using Python generators, how it is different from iterators and normal functions, and why you should use it.|||There is a lot of work in building an iterator in Python. We have to implement a class with __iter__() and __next__() method, keep track of internal states, and raise StopIteration when there are no values to be returned.|||This is both lengthy and counterintuitive. Generator comes to the rescue in such situations.|||Python generators are a simple way of creating iterators. All the work we mentioned above are automatically handled by generators in Python.|||Simply speaking, a generator is a function that returns an object (iterator) which we can iterate over (one value at a time).|||It is fairly simple to create a generator in Python. It is as easy as defining a normal function, but with a yield statement instead of a return statement.|||If a function contains at least one yield statement (it may contain other yield or return statements), it becomes a generator function. Both yield and return will return some value from a function.|||The difference is that while a return statement terminates a function entirely, yield statement pauses the function saving all its states and later continues from there on successive calls.|||Here is how a generator function differs from a normal function.|||Here is an example to illustrate all of the points stated above. We have a generator function named my_gen() with several yield statements.|||An interactive run in the interpreter is given below. Run these in the Python shell to see the output.|||One interesting thing to note in the above example is that the value of variable n is remembered between each call.|||Unlike normal functions, the local variables are not destroyed when the function yields. Furthermore, the generator object can be iterated only once.|||To restart the process we need to create another generator object using something like a = my_gen().|||One final thing to note is that we can use generators with for loops directly.|||This is because a for loop takes an iterator and iterates over it using next() function. It automatically ends when StopIteration is raised. Check here to know how a for loop is actually implemented in Python.|||When you run the program, the output will be:|||The above example is of less use and we studied it just to get an idea of what was happening in the background.||||||Normally, generator functions are implemented with a loop having a suitable terminating condition.|||Let's take an example of a generator that reverses a string.|||Output|||In this example, we have used the range() function to get the index in reverse order using the for loop.|||Note: This generator function not only works with strings, but also with other kinds of iterables like list, tuple, etc.|||Simple generators can be easily created on the fly using generator expressions. It makes building generators easy.|||Similar to the lambda functions which create anonymous functions, generator expressions create anonymous generator functions.|||The syntax for generator expression is similar to that of a list comprehension in Python. But the square brackets are replaced with round parentheses.|||The major difference between a list comprehension and a generator expression is that a list comprehension produces the entire list while the generator expression produces one item at a time.|||They have lazy execution ( producing items only when asked for ). For this reason, a generator expression is much more memory efficient than an equivalent list comprehension.|||Output|||We can see above that the generator expression did not produce the required result immediately. Instead, it returned a generator object, which produces items only on demand.|||Here is how we can start getting items from the generator:|||When we run the above program, we get the following output:|||Generator expressions can be used as function arguments. When used in such a way, the round parentheses can be dropped.|||There are several reasons that make generators a powerful implementation.|||Generators can be implemented in a clear and concise way as compared to their iterator class counterpart. Following is an example to implement a sequence of power of 2 using an iterator class.|||The above program was lengthy and confusing. Now, let's do the same using a generator function.|||Since generators keep track of details automatically, the implementation was concise and much cleaner.|||A normal function to return a sequence will create the entire sequence in memory before returning the result. This is an overkill, if the number of items in the sequence is very large.|||Generator implementation of such sequences is memory friendly and is preferred since it only produces one item at a time.|||Generators are excellent mediums to represent an infinite stream of data. Infinite streams cannot be stored in memory, and since generators produce only one item at a time, they can represent an infinite stream of data.|||The following generator function can generate all the even numbers (at least in theory).|||Multiple generators can be used to pipeline a series of operations. This is best illustrated using an example.|||Suppose we have a generator that produces the numbers in the Fibonacci series. And we have another generator for squaring numbers.|||If we want to find out the sum of squares of numbers in the Fibonacci series, we can do it in the following way by pipelining the output of generator functions together.|||Output|||This pipelining is efficient and easy to read (and yes, a lot cooler!).","Generator function contains one or more yield statements.$$$When called, it returns an object (iterator) but does not start execution immediately.$$$Methods like __iter__() and __next__() are implemented automatically. So we can iterate through the items using next().$$$Once the function yields, the function is paused and the control is transferred to the caller.$$$Local variables and their states are remembered between successive calls.$$$Finally, when the function terminates, StopIteration is raised automatically on further calls.$$$Generators in Python$$$Create Generators in Python$$$Generator function vs Normal function$$$Python Generators with a Loop$$$Python Generator Expression$$$Use of Python Generators",,
https://www.programiz.com/python-programming/closure,Python Closures: How to use it and Why?,Nonlocal variable in a nested function$$$Defining a Closure Function$$$When do we have closures?$$$When to use closures?$$$Table of Contents,,"In this tutorial, you'll learn about Python closure, how to define a closure, and the reasons you should use it.|||Before getting into what a closure is, we have to first understand what a nested function and nonlocal variable is.|||A function defined inside another function is called a nested function. Nested functions can access variables of the enclosing scope.|||In Python, these non-local variables are read-only by default and we must declare them explicitly as non-local (using nonlocal keyword) in order to modify them.|||Following is an example of a nested function accessing a non-local variable.|||Output|||We can see that the nested printer() function was able to access the non-local msg variable of the enclosing function.|||In the example above, what would happen if the last line of the function print_msg() returned the printer() function instead of calling it? This means the function was defined as follows:|||Output|||That's unusual.||||||The print_msg() function was called with the string ""Hello"" and the returned function was bound to the name another. On calling another(), the message was still remembered although we had already finished executing the print_msg() function.|||This technique by which some data (""Hello in this case) gets attached to the code is called closure in Python.|||This value in the enclosing scope is remembered even when the variable goes out of scope or the function itself is removed from the current namespace.|||Try running the following in the Python shell to see the output.|||Here, the returned function still works even when the original function was deleted.|||As seen from the above example, we have a closure in Python when a nested function references a value in its enclosing scope.|||The criteria that must be met to create closure in Python are summarized in the following points.|||So what are closures good for?|||Closures can avoid the use of global values and provides some form of data hiding. It can also provide an object oriented solution to the problem.|||When there are few methods (one method in most cases) to be implemented in a class, closures can provide an alternate and more elegant solution. But when the number of attributes and methods get larger, it's better to implement a class.|||Here is a simple example where a closure might be more preferable than defining a class and making objects. But the preference is all yours.|||Output|||Python Decorators make an extensive use of closures as well.|||On a concluding note, it is good to point out that the values that get enclosed in the closure function can be found out.|||All function objects have a __closure__ attribute that returns a tuple of cell objects if it is a closure function. Referring to the example above, we know times3 and times5 are closure functions.|||The cell object has the attribute cell_contents which stores the closed value.",We must have a nested function (function inside a function).$$$The nested function must refer to a value defined in the enclosing function.$$$The enclosing function must return the nested function.$$$Nonlocal variable in a nested function$$$Defining a Closure Function$$$When do we have closures?$$$When to use closures?,,
https://www.programiz.com/python-programming/decorator,Python Decorators: How to Use it and Why?,Video: @Decorators in Python$$$Decorators in Python$$$Prerequisites for learning decorators$$$Getting back to Decorators$$$Decorating Functions with Parameters$$$Chaining Decorators in Python$$$Table of Contents,,"A decorator takes in a function, adds some functionality and returns it. In this tutorial, you will learn how you can create a decorator and why you should use it.|||Python has an interesting feature called decorators to add functionality to an existing code.|||This is also called metaprogramming because a part of the program tries to modify another part of the program at compile time.|||In order to understand about decorators, we must first know a few basic things in Python.|||We must be comfortable with the fact that everything in Python (Yes! Even classes), are objects. Names that we define are simply identifiers bound to these objects. Functions are no exceptions, they are objects too (with attributes). Various different names can be bound to the same function object.|||Here is an example.|||Output|||When you run the code, both functions first and second give the same output. Here, the names first and second refer to the same function object.|||Now things start getting weirder.|||Functions can be passed as arguments to another function.|||If you have used functions like map, filter and reduce in Python, then you already know about this.|||Such functions that take other functions as arguments are also called higher order functions. Here is an example of such a function.|||We invoke the function as follows.|||Furthermore, a function can return another function.||||||Output|||Here, is_returned() is a nested function which is defined and returned each time we call is_called().|||Finally, we must know about Closures in Python.|||Functions and methods are called callable as they can be called.|||In fact, any object which implements the special __call__() method is termed callable. So, in the most basic sense, a decorator is a callable that returns a callable.|||Basically, a decorator takes in a function, adds some functionality and returns it.|||When you run the following codes in shell,|||In the example shown above, make_pretty() is a decorator. In the assignment step:|||The function ordinary() got decorated and the returned function was given the name pretty.|||We can see that the decorator function added some new functionality to the original function. This is similar to packing a gift. The decorator acts as a wrapper. The nature of the object that got decorated (actual gift inside) does not alter. But now, it looks pretty (since it got decorated).|||Generally, we decorate a function and reassign it as,|||This is a common construct and for this reason, Python has a syntax to simplify this.|||We can use the @ symbol along with the name of the decorator function and place it above the definition of the function to be decorated. For example,|||is equivalent to|||This is just a syntactic sugar to implement decorators.|||The above decorator was simple and it only worked with functions that did not have any parameters. What if we had functions that took in parameters like:|||This function has two parameters, a and b. We know it will give an error if we pass in b as 0.|||Now let's make a decorator to check for this case that will cause the error.|||This new implementation will return None if the error condition arises.|||In this manner, we can decorate functions that take parameters.|||A keen observer will notice that parameters of the nested inner() function inside the decorator is the same as the parameters of functions it decorates. Taking this into account, now we can make general decorators that work with any number of parameters.|||In Python, this magic is done as function(*args, **kwargs). In this way, args will be the tuple of positional arguments and kwargs will be the dictionary of keyword arguments. An example of such a decorator will be:|||Multiple decorators can be chained in Python.|||This is to say, a function can be decorated multiple times with different (or same) decorators. We simply place the decorators above the desired function.|||Output|||The above syntax of,|||is equivalent to|||The order in which we chain decorators matter. If we had reversed the order as,|||The output would be:",Decorators in Python$$$Prerequisites for learning decorators$$$Getting back to Decorators$$$Decorating Functions with Parameters$$$Chaining Decorators in Python,,
https://www.programiz.com/python-programming/property,Python @property: How to Use it and Why? - Programiz,Class Without Getters and Setters$$$Using Getters and Setters$$$The property Class$$$The @property Decorator$$$Table of Contents,,"In this tutorial, you will learn about Python @property decorator; a pythonic way to use getters and setters in object-oriented programming.|||Python programming provides us with a built-in @property decorator which makes usage of getter and setters much easier in Object-Oriented Programming.|||Before going into details on what @property decorator is, let us first build an intuition on why it would be needed in the first place.|||Let us assume that we decide to make a class that stores the temperature in degrees Celsius. It would also implement a method to convert the temperature into degrees Fahrenheit. One way of doing this is as follows:|||We can make objects out of this class and manipulate the temperature attribute as we wish:|||Output|||The extra decimal places when converting into Fahrenheit is due to the floating point arithmetic error. To learn more, visit Python Floating Point Arithmetic Error.|||Whenever we assign or retrieve any object attribute like temperature as shown above, Python searches it in the object's built-in __dict__ dictionary attribute.|||Therefore, man.temperature internally becomes man.__dict__['temperature'].|||Suppose we want to extend the usability of the Celsius class defined above. We know that the temperature of any object cannot reach below -273.15 degrees Celsius (Absolute Zero in Thermodynamics)|||Let's update our code to implement this value constraint.|||An obvious solution to the above restriction will be to hide the attribute temperature (make it private) and define new getter and setter methods to manipulate it. This can be done as follows:|||As we can see, the above method introduces two new get_temperature() and set_temperature() methods.|||Furthermore, temperature was replaced with _temperature. An underscore _ at the beginning is used to denote private variables in Python.|||Now, let's use this implementation:||||||Output|||This update successfully implemented the new restriction. We are no longer allowed to set the temperature below -273.15 degrees Celsius.|||Note: The private variables don't actually exist in Python. There are simply norms to be followed. The language itself doesn't apply any restrictions.|||However, the bigger problem with the above update is that all the programs that implemented our previous class have to modify their code from obj.temperature to obj.get_temperature() and all expressions like obj.temperature = val to obj.set_temperature(val).|||This refactoring can cause problems while dealing with hundreds of thousands of lines of codes.|||All in all, our new update was not backwards compatible. This is where @property comes to rescue.|||A pythonic way to deal with the above problem is to use the property class. Here is how we can update our code:|||We added a print() function inside get_temperature() and set_temperature() to clearly observe that they are being executed.|||The last line of the code makes a property object temperature. Simply put, property attaches some code (get_temperature and set_temperature) to the member attribute accesses (temperature).|||Let's use this update code:|||Output|||As we can see, any code that retrieves the value of temperature will automatically call get_temperature() instead of a dictionary (__dict__) look-up. Similarly, any code that assigns a value to temperature will automatically call set_temperature().|||We can even see above that set_temperature() was called even when we created an object.|||Can you guess why?|||The reason is that when an object is created, the __init__() method gets called. This method has the line self.temperature = temperature. This expression automatically calls set_temperature().|||Similarly, any access like c.temperature automatically calls get_temperature(). This is what property does. Here are a few more examples.|||By using property, we can see that no modification is required in the implementation of the value constraint. Thus, our implementation is backward compatible.|||Note: The actual temperature value is stored in the private _temperature variable. The temperature attribute is a property object which provides an interface to this private variable.|||In Python, property() is a built-in function that creates and returns a property object. The syntax of this function is:|||where,|||As seen from the implementation, these function arguments are optional. So, a property object can simply be created as follows.|||A property object has three methods, getter(), setter(), and deleter() to specify fget, fset and fdel at a later point. This means, the line:|||can be broken down as:|||These two pieces of codes are equivalent.|||Programmers familiar with Python Decorators can recognize that the above construct can be implemented as decorators.|||We can even not define the names get_temperature and set_temperature as they are unnecessary and pollute the class namespace.|||For this, we reuse the temperature name while defining our getter and setter functions. Let's look at how to implement this as a decorator:|||Output|||The above implementation is simple and efficient. It is the recommended way to use property.",fget is function to get value of the attribute$$$fset is function to set value of the attribute$$$fdel is function to delete the attribute$$$doc is a string (like a comment)$$$Introduction$$$Class Without Getters and Setters$$$Using Getters and Setters$$$The property Class$$$The @property Decorator,,
