Links,Main Heading,Chapter Headings,Description,Contents,Unordered Lists,Ordered Lists,Table Data
https://www.programiz.com/python-programming,Learn Python Programming,About Python Programming$$$Why Learn Python?$$$How to learn Python?$$$Python Resources,"Python is a powerful general-purpose programming language. It is used in web development, data science, creating software prototypes, and so on. Fortunately for beginners, Python has simple easy-to-use syntax. This makes Python an excellent language to learn to program for beginners. Our Python tutorial will guide you to learn Python one step at a time. If you prefer videos, watch our Python for beginners playlist on Youtube.",,"Free and open-source - You can freely use and distribute Python, even for commercial use.$$$Easy to learn - Python has a very simple and elegant syntax. It's much easier to read and write Python programs compared to other languages like C++, Java, C#.$$$Portable - You can move Python programs from one platform to another, and run it without any changes.$$$Python is easy to learn. Its syntax is easy and code is very readable.$$$Python has a lot of applications. It's used for developing web applications, data science, rapid application development, and so on.$$$Python allows you to write programs in fewer lines of code than most of the programming languages.$$$The popularity of Python is growing rapidly. Now it's one of the most popular programming languages.$$$Python tutorial from Programiz - We provide step by step Python tutorials, examples, and references. Get started with Python.$$$Official Python tutorial - Might be hard to follow and understand for beginners. Visit the official Python tutorial.$$$Get Learn Python App - The beginner-friendly app contains byte-size lessons and an integrated Python interpreter. To learn more, visit: Learn Python app$$$Write a lot of Python code- The only way you can learn programming is by writing a lot of code.$$$Python Examples$$$Python References$$$Python Online Compiler$$$Python Guide$$$Python Tutorial Videos",,
https://www.programiz.com/python-programming/first-program,How to Get Started With Python?,Video: Introduction to Python$$$The Easiest Way to Run Python$$$Install Python Separately$$$Your first Python Program$$$1. Run Python in Immediate mode$$$2. Run Python in the Integrated Development Environment (IDE)$$$Table of Contents,,"In this tutorial, you will learn to install and run Python on your computer. Once we do that, we will also write our first Python program.|||Python is a cross-platform programming language, which means that it can run on multiple platforms like Windows, macOS, Linux, and has even been ported to the Java and .NET virtual machines. It is free and open-source.|||Even though most of today's Linux and Mac have Python pre-installed in it, the version might be out-of-date. So, it is always a good idea to install the most current version.|||The easiest way to run Python is by using Thonny IDE.|||The Thonny IDE comes with the latest version of Python bundled in it. So you don't have to install Python separately.|||Follow the following steps to run Python on your computer.|||If you don't want to use Thonny, here's how you can install and run Python on your computer.|||Once you finish the installation process, you can run Python.||||||Once Python is installed, typing python in the command line will invoke the interpreter in immediate mode. We can directly type in Python code, and press Enter to get the output.|||Try typing in 1 + 1 and press enter. We get 2 as the output. This prompt can be used as a calculator. To exit this mode, type quit() and press enter.|||We can use any text editing software to write a Python script file.|||We just need to save it with the .py extension. But using an IDE can make our life a lot easier. IDE is a piece of software that provides useful features like code hinting, syntax highlighting and checking, file explorers, etc. to the programmer for application development.|||By the way, when you install Python, an IDE named IDLE is also installed. You can use it to run Python on your computer. It's a decent IDE for beginners.|||When you open IDLE, an interactive Python Shell is opened.|||Now you can create a new file and save it with .py extension. For example, hello.py|||Write Python code in the file and save it. To run the file, go to Run > Run Module or simply click F5.|||Now that we have Python up and running, we can write our first Python program.|||Let's create a very simple program called Hello World. A ""Hello, World!"" is a simple program that outputs Hello, World! on the screen. Since it's a very simple program, it's often used to introduce a new programming language to beginners.|||Type the following code in any text editor or an IDE and save it as hello_world.py|||Then, run the file. You will get the following output.|||Congratulations! You just wrote your first program in Python.|||As you can see, this was a pretty easy task. This is the beauty of the Python programming language.",Run Python using Thonny IDE$$$Install Python Separately$$$Run Python in Immediate mode$$$Run Python in the IDLE$$$Your first Python Program,"Download Thonny IDE.$$$Run the installer to install Thonny on your computer.$$$Go to: File > New. Then save the file with .py extension. For example, hello.py, example.py, etc.You can give any name to the file. However, the file name should end with .py$$$Write Python code in the file and save it.Running Python using Thonny IDE$$$Then Go to Run > Run current script or simply click F5 to run it.$$$Download the latest version of Python.$$$Run the installer file and follow the steps to install PythonDuring the install process, check Add Python to environment variables. This will add Python to environment variables, and you can run Python from any part of the computer.Also, you can choose the path where Python is installed.Installing Python on the computer",
https://www.programiz.com/python-programming/keywords-identifier,Python Keywords and Identifiers (Variable names),Python Keywords$$$Python Identifiers$$$Rules for writing identifiers$$$Things to Remember$$$Table of Contents,,"In this tutorial, you will learn about keywords (reserved words in Python) and identifiers (names given to variables, functions, etc.).|||Keywords are the reserved words in Python.|||We cannot use a keyword as a variable name, function name or any other identifier. They are used to define the syntax and structure of the Python language.|||In Python, keywords are case sensitive.|||There are 33 keywords in Python 3.7. This number can vary slightly over the course of time.|||All the keywords except True, False and None are in lowercase and they must be written as they are. The list of all the keywords is given below.||||||Looking at all the keywords at once and trying to figure out what they mean might be overwhelming.|||If you want to have an overview, here is the complete list of all the keywords with examples.|||An identifier is a name given to entities like class, functions, variables, etc. It helps to differentiate one entity from another.|||Python is a case-sensitive language. This means, Variable and variable are not the same.|||Always give the identifiers a name that makes sense. While c = 10 is a valid name, writing count = 10 would make more sense, and it would be easier to figure out what it represents when you look at your code after a long gap.|||Multiple words can be separated using an underscore, like this_is_a_long_variable.",Python Keywords$$$Python IdentifiersRules for writing identifiersThings to Remember$$$Rules for writing identifiers$$$Things to Remember,"Identifiers can be a combination of letters in lowercase (a to z) or uppercase (A to Z) or digits (0 to 9) or an underscore _. Names like myClass, var_1 and print_this_to_screen, all are valid example.$$$An identifier cannot start with a digit. 1variable is invalid, but variable1 is a valid name.$$$Keywords cannot be used as identifiers.global = 1Output  File ""<interactive input>"", line 1    global = 1           ^SyntaxError: invalid syntax$$$We cannot use special symbols like !, @, #, $, % etc. in our identifier.a@ = 0Output  File ""<interactive input>"", line 1    a@ = 0     ^SyntaxError: invalid syntax$$$An identifier can be of any length.",False|||await|||else|||import|||pass$$$None|||break|||except|||in|||raise$$$True|||class|||finally|||is|||return$$$and|||continue|||for|||lambda|||try$$$as|||def|||from|||nonlocal|||while$$$assert|||del|||global|||not|||with$$$async|||elif|||if|||or|||yield
https://www.programiz.com/python-programming/statement-indentation-comments,"Python Statement, Indentation and Comments",Python Statement$$$Python Indentation$$$Python Comments$$$Multi-line statement$$$Multi-line comments$$$Docstrings in Python$$$Table of Contents,,"In this tutorial, you will learn about Python statements, why indentation is important and use of comments in programming.|||Instructions that a Python interpreter can execute are called statements. For example, a = 1 is an assignment statement. if statement, for statement, while statement, etc. are other kinds of statements which will be discussed later.|||In Python, the end of a statement is marked by a newline character. But we can make a statement extend over multiple lines with the line continuation character (\). For example:|||This is an explicit line continuation. In Python, line continuation is implied inside parentheses ( ), brackets [ ], and braces { }. For instance, we can implement the above multi-line statement as:|||Here, the surrounding parentheses ( ) do the line continuation implicitly. Same is the case with [ ] and { }. For example:|||We can also put multiple statements in a single line using semicolons, as follows:|||Most of the programming languages like C, C++, and Java use braces { } to define a block of code. Python, however, uses indentation.|||A code block (body of a function, loop, etc.) starts with indentation and ends with the first unindented line. The amount of indentation is up to you, but it must be consistent throughout that block.|||Generally, four whitespaces are used for indentation and are preferred over tabs. Here is an example.|||The enforcement of indentation in Python makes the code look neat and clean. This results in Python programs that look similar and consistent.|||Indentation can be ignored in line continuation, but it's always a good idea to indent. It makes the code more readable. For example:|||and|||both are valid and do the same thing, but the former style is clearer.||||||Incorrect indentation will result in IndentationError.|||Comments are very important while writing a program. They describe what is going on inside a program, so that a person looking at the source code does not have a hard time figuring it out.|||You might forget the key details of the program you just wrote in a month's time. So taking the time to explain these concepts in the form of comments is always fruitful.|||In Python, we use the hash (#) symbol to start writing a comment.|||It extends up to the newline character. Comments are for programmers to better understand a program. Python Interpreter ignores comments.|||We can have comments that extend up to multiple lines. One way is to use the hash(#) symbol at the beginning of each line. For example:|||Another way of doing this is to use triple quotes, either ''' or """""".|||These triple quotes are generally used for multi-line strings. But they can be used as a multi-line comment as well. Unless they are not docstrings, they do not generate any extra code.|||To learn more about comments, visit Python Comments.|||A docstring is short for documentation string.|||Python docstrings (documentation strings) are the string literals that appear right after the definition of a function, method, class, or module.|||Triple quotes are used while writing docstrings. For example:|||Docstrings appear right after the definition of a function, class, or a module. This separates docstrings from multiline comments using triple quotes.|||The docstrings are associated with the object as their __doc__ attribute.|||So, we can access the docstrings of the above function with the following lines of code:|||Output|||To learn more about docstrings in Python, visit Python Docstrings.",Python StatementMulti-line statement$$$Python Indentation$$$Python CommentsMulti-line CommentsDocstring in Python$$$Multi-line statement$$$Multi-line Comments$$$Docstring in Python,,
https://www.programiz.com/python-programming/variables-constants-literals,"Python Variables, Constants and Literals",Video: Python Variables and print()$$$Python Variables$$$Assigning values to Variables in Python$$$Constants$$$Assigning value to constant in Python$$$Rules and Naming Convention for Variables and constants$$$Literals$$$Numeric Literals$$$String literals$$$Boolean literals$$$Special literals$$$Literal Collections$$$Example 1: Declaring and assigning value to a variable$$$Example 2: Changing the value of a variable$$$Example 3: Assigning multiple values to multiple variables$$$Example 3: Declaring and assigning value to a constant$$$Example 4: How to use Numeric literals in Python?$$$Example 7: How to use string literals in Python?$$$Example 8: How to use boolean literals in Python?$$$Example 9: How to use special literals in Python?$$$Example 10: How to use literals collections in Python?$$$Table of Contents,,"In this tutorial, you will learn about Python variables, constants, literals and their use cases.|||A variable is a named location used to store data in the memory. It is helpful to think of variables as a container that holds data that can be changed later in the program. For example,|||Here, we have created a variable named number. We have assigned the value 10 to the variable.|||You can think of variables as a bag to store books in it and that book can be replaced at any time.|||Initially, the value of number was 10. Later, it was changed to 1.1.|||Note: In Python, we don't actually assign values to the variables. Instead, Python gives the reference of the object(value) to the variable.|||As you can see from the above example, you can use the assignment operator = to assign a value to a variable.|||Output|||In the above program, we assigned a value apple.com to the variable website. Then, we printed out the value assigned to website i.e. apple.com|||Note: Python is a type-inferred language, so you don't have to explicitly define the variable type. It automatically knows that apple.com is a string and declares the website variable as a string.|||Output|||In the above program, we have assigned apple.com to the website variable initially. Then, the value is changed to programiz.com.|||If we want to assign the same value to multiple variables at once, we can do this as:|||The second program assigns the same string to all the three variables x, y and z.|||A constant is a type of variable whose value cannot be changed. It is helpful to think of constants as containers that hold information which cannot be changed later.|||You can think of constants as a bag to store some books which cannot be replaced once placed inside the bag.|||In Python, constants are usually declared and assigned in a module. Here, the module is a new file containing variables, functions, etc which is imported to the main file. Inside the module, constants are written in all capital letters and underscores separating the words.|||Create a constant.py:|||Create a main.py:|||Output|||In the above program, we create a constant.py module file. Then, we assign the constant value to PI and GRAVITY. After that, we create a main.py file and import the constant module. Finally, we print the constant value.|||Note: In reality, we don't use constants in Python. Naming them in all capital letters is a convention to separate them from variables, however, it does not actually prevent reassignment.|||Literal is a raw data given in a variable or constant. In Python, there are various types of literals they are as follows:|||Numeric Literals are immutable (unchangeable). Numeric literals can belong to 3 different numerical types: Integer, Float, and Complex.||||||Output|||In the above program,|||To learn more about Numeric Literals, refer to Python Numbers.|||A string literal is a sequence of characters surrounded by quotes. We can use both single, double, or triple quotes for a string. And, a character literal is a single character surrounded by single or double quotes.|||Output|||In the above program, This is Python is a string literal and C is a character literal.|||The value in triple-quotes """""" assigned to the multiline_str is a multi-line string literal.|||The string u""\u00dcnic\u00f6de"" is a Unicode literal which supports characters other than English. In this case, \u00dc represents Ü and \u00f6 represents ö.|||r""raw \n string"" is a raw string literal.|||A Boolean literal can have any of the two values: True or False.|||Output|||In the above program, we use boolean literal True and False. In Python, True represents the value as 1 and False as 0. The value of x is True because 1 is equal to True. And, the value of y is False because 1 is not equal to False.|||Similarly, we can use the True and False in numeric expressions as the value. The value of a is 5 because we add True which has a value of 1 with 4. Similarly, b is 10 because we add the False having value of 0 with 10.|||Python contains one special literal i.e. None. We use it to specify that the field has not been created.|||Output|||In the above program, we define a menu function. Inside menu, when we set the argument as drink then, it displays Available. And, when the argument is food, it displays None.|||There are four different literal collections List literals, Tuple literals, Dict literals, and Set literals.|||Output|||In the above program, we created a list of fruits, a tuple of numbers, a dictionary dict having values with keys designated to each value and a set of vowels.|||To learn more about literal collections, refer to Python Data Types.","We assigned integer literals into different variables. Here, a is binary literal, b is a decimal literal, c is an octal literal and d is a hexadecimal literal.$$$When we print the variables, all the literals are converted into decimal values.$$$10.5 and 1.5e2 are floating-point literals. 1.5e2 is expressed with exponential and is equivalent to 1.5 * 102.$$$We assigned a complex literal i.e 3.14j in variable x. Then we use imaginary literal (x.imag) and real literal (x.real) to create imaginary and real parts of complex numbers.$$$Python Variables$$$Assigning values to Variables in Python$$$Constants$$$Assigning value to constant in Python$$$Naming Convention for Variables and constants$$$Literals$$$Numeric Literals$$$String literals$$$Boolean literals$$$Special literals$$$Literal Collections","Constant and variable names should have a combination of letters in lowercase (a to z) or uppercase (A to Z) or digits (0 to 9) or an underscore (_). For example:snake_caseMACRO_CASEcamelCaseCapWords$$$Create a name that makes sense. For example, vowel makes more sense than v.$$$If you want to create a variable name having two words, use underscore to separate them. For example:my_namecurrent_salary$$$Use capital letters possible to declare a constant. For example:PIGMASSSPEED_OF_LIGHTTEMP$$$Never use special symbols like !, @, #, $, %, etc.$$$Don't start a variable name with a digit.",
https://www.programiz.com/python-programming/variables-datatypes,Python Data Types,Data types in Python$$$Python Numbers$$$Python List$$$Python Tuple$$$Python Strings$$$Python Set$$$Python Dictionary$$$Conversion between data types$$$Table of Contents,,"In this tutorial, you will learn about different data types you can use in Python.|||Every value in Python has a datatype. Since everything is an object in Python programming, data types are actually classes and variables are instance (object) of these classes.|||There are various data types in Python. Some of the important types are listed below.|||Integers, floating point numbers and complex numbers fall under Python numbers category. They are defined as int, float and complex classes in Python.|||We can use the type() function to know which class a variable or a value belongs to. Similarly, the isinstance() function is used to check if an object belongs to a particular class.|||Output|||Integers can be of any length, it is only limited by the memory available.|||A floating-point number is accurate up to 15 decimal places. Integer and floating points are separated by decimal points. 1 is an integer, 1.0 is a floating-point number.|||Complex numbers are written in the form, x + yj, where x is the real part and y is the imaginary part. Here are some examples.|||Notice that the float variable b got truncated.|||List is an ordered sequence of items. It is one of the most used datatype in Python and is very flexible. All the items in a list do not need to be of the same type.|||Declaring a list is pretty straight forward. Items separated by commas are enclosed within brackets [ ].|||We can use the slicing operator [ ] to extract an item or a range of items from a list. The index starts from 0 in Python.|||Output|||Lists are mutable, meaning, the value of elements of a list can be altered.||||||Output|||Tuple is an ordered sequence of items same as a list. The only difference is that tuples are immutable. Tuples once created cannot be modified.|||Tuples are used to write-protect data and are usually faster than lists as they cannot change dynamically.|||It is defined within parentheses () where items are separated by commas.|||We can use the slicing operator [] to extract items but we cannot change its value.|||Output|||String is sequence of Unicode characters. We can use single quotes or double quotes to represent strings. Multi-line strings can be denoted using triple quotes, ''' or """""".|||Output|||Just like a list and tuple, the slicing operator [ ] can be used with strings. Strings, however, are immutable.|||Output|||Set is an unordered collection of unique items. Set is defined by values separated by comma inside braces { }. Items in a set are not ordered.|||Output|||We can perform set operations like union, intersection on two sets. Sets have unique values. They eliminate duplicates.|||Output|||Since, set are unordered collection, indexing has no meaning. Hence, the slicing operator [] does not work.|||Dictionary is an unordered collection of key-value pairs.|||It is generally used when we have a huge amount of data. Dictionaries are optimized for retrieving data. We must know the key to retrieve the value.|||In Python, dictionaries are defined within braces {} with each item being a pair in the form key:value. Key and value can be of any type.|||We use key to retrieve the respective value. But not the other way around.|||Output|||We can convert between different data types by using different type conversion functions like int(), float(), str(), etc.|||Conversion from float to int will truncate the value (make it closer to zero).|||Conversion to and from string must contain compatible values.|||We can even convert one sequence to another.|||To convert to dictionary, each element must be a pair:",Data types in Python$$$Python Numbers$$$Python List$$$Python Tuple$$$Python Strings$$$Python Set$$$Python Dictionary$$$Conversion between data types,,
