Course,Chapters,ALL Headings,Paragraphs,Unordered List Items,Ordered List Items,Tables,Code Examples
can be referenced by the Colon (:) notation.|||Apex security refers to the process of applying security settings and enforcing the sharing rules on running code. Apex classes have security setting that can be controlled via two keywords.|||Apex generally runs in system context, that is, the current user's permissions. Field-level security, and sharing rules are not taken into account during code execution. Only the anonymous block code executes with the permission of the user who is executing the code.|||Our Apex code should not expose the sensitive data to User which is hidden via security and sharing settings. Hence, Apex security and enforcing the sharing rule is most important.|||If you use this keyword, then the Apex code will enforce the Sharing settings of current user to Apex code. This does not enforce the Profile permission, only the data level sharing settings.|||Let us consider an example wherein, our User has access to 5 records, but the total number of records is 10. So when the Apex class will be declared with the ""With Sharing"" Keyword, it will return only 5 records on which the user has access to.|||Example|||First, make sure that you have created at least 10 records in the Customer object with 'Name' of 5 records as 'ABC Customer' and rest 5 records as 'XYZ Customer'. Then, create a sharing rule which will share the 'ABC Customer' with all Users. We also need to make sure that we have set the OWD of Customer object as Private.|||Paste the code given below to Anonymous block in the Developer Console.|||As the name suggests, class declared with this keyword executes in System mode, i.e., irrespective of the User's access to the record, query will fetch all the records.|||You can enable or disable an Apex class for particular profile. The steps for the same are given below. You can determine which profile should have access to which class.|||Step 1 − From Setup, click Develop → Apex Classes.|||Step 2 − Click the name of the class that you want to restrict. We have clicked on CustomerOperationClass.|||Step 3 − Click on Security.|||Step 4 − Select the profiles that you want to enable from the Available Profiles list and click Add, or select the profiles that you want to disable from the Enabled Profiles list and click on Remove.|||Step 5 − Click on Save.|||Step 1 − From Setup, click Manage Users → Permission Sets.|||Step 2 − Select a permission set.|||Step 3 − Click on Apex Class Access.|||Step 4 − Click on Edit.|||Step 5 − Select the Apex classes that you want to enable from the Available Apex Classes list and click Add, or select the Apex classes that you want to disable from the Enabled Apex Classes list and click remove.|||Step 6 − Click the Save button.|||Apex invoking refers to the process of executing the Apex class. Apex class can only be executed when it is invoked via one of the ways listed below −|||Triggers and Anonymous block|||A trigger invoked for specified events|||Asynchronous Apex|||Scheduling an Apex class to run at specified intervals, or running a batch job|||Web Services class|||Apex Email Service class|||Apex Web Services, which allow exposing your methods via SOAP and REST Web services|||Visualforce Controllers|||Apex Email Service to process inbound email|||Invoking Apex Using JavaScript|||The Ajax toolkit to invoke Web service methods implemented in Apex|||We will now understand a few common ways to invoke Apex.|||You can invoke the Apex class via execute anonymous in the Developer Console as shown below −|||Step 1 − Open the Developer Console.|||Step 2 − Click on Debug.|||Step 3 − Execute anonymous window will open as shown below. Now, click on the Execute
button −|||Step 4 − Open the Debug Log when it will appear in the Logs pane.|||You can call an Apex class from Trigger as well. Triggers are called when a specified event occurs and triggers can call the Apex class when executing.|||Following is the sample code that shows how a class gets executed when a Trigger is called.|||Apex class can be called from the Visualforce page as well. We can specify the controller or the controller extension and the specified Apex class gets called.|||VF Page Code|||Apex Class Code (Controller Extension)|||Apex triggers are like stored procedures which execute when a particular event occurs. A trigger executes before and after an event occurs on record.|||Following are the events on which we can fir the trigger −|||Suppose we received a business requirement that we need to create an Invoice Record when Customer's 'Customer Status' field changes to Active from Inactive. For this, we will create a trigger on APEX_Customer__c object by following these steps −|||Step 1 − Go to sObject|||Step 2 − Click on Customer|||Step 3 − Click on 'New' button in the Trigger related list and add the trigger code as give below.|||Trigger.new − This is the context variable which stores the records currently in the trigger context, either being inserted or updated. In this case, this variable has Customer object's records which have been updated.|||There are other context variables which are available in the context – trigger.old, trigger.newMap, trigger.OldMap.|||The above trigger will execute when there is an update operation on the Customer records. Suppose, the invoice record needs to be inserted only when the Customer Status changes from Inactive to Active and not every time; for this, we can use another context variable trigger.oldMap which will store the key as record id and the value as old record values.|||We have used the Trigger.oldMap variable which as explained earlier, is a context variable which stores the Id and old value of records which are being updated.|||Design patterns are used to make our code more efficient and to avoid hitting the governor limits. Often developers can write inefficient code that can cause repeated instantiation of objects. This can result in inefficient, poorly performing code, and potentially the breaching of governor limits. This most commonly occurs in triggers, as they can operate against a set of records.|||We will see some important design pattern strategies in this chapter.|||In real business case, it will be possible that you may need to process thousands of records in one go. If your trigger is not designed to handle such situations, then it may fail while
processing the records. There are some best practices which you need to follow while implementing the triggers. All triggers are bulk triggers by default, and can process multiple records at a time. You should always plan to process more than one record at a time.|||Consider a business case, wherein, you need to process large number of records and you have written the trigger as given below. This is the same example which we had taken for inserting the invoice record when the Customer Status changes from Inactive to Active.|||You can now see that the DML Statement has been written in for the loop block which will work when processing only few records but when you are processing some hundreds of records, it will reach the DML Statement limit per transaction which is the governor limit. We will have a detailed look on Governor Limits in a subsequent chapter.|||To avoid this, we have to make the trigger efficient for processing multiple records at a time.|||The following example will help you understand the same −|||This trigger will only fire 1 DML statement as it will be operating over a List and the List has all the records which need to be modified.|||By this way, you can avoid the DML statement governor limits.|||Writing the whole code in trigger is also not a good practice. Hence you should call the Apex class and delegate the processing from Trigger to Apex class as shown below. Trigger Helper class is the class which does all the processing for trigger.|||Let us consider our invoice record creation example again.|||In this, all the processing has been delegated to the helper class and when we need a new functionality we can simply add the code to the helper class without modifying the trigger.|||Always create a single trigger on each object. Multiple triggers on the same object can cause the conflict and errors if it reaches the governor limits.|||You can use the context variable to call the different methods from helper class as per the requirement. Consider our previous example. Suppose that our createInvoice method should be called only when the record is updated and on multiple events. Then we can control the execution as below −|||Governor execution limits ensure the efficient use of resources on the Force.com multitenant platform. It is the limit specified by the Salesforce.com on code execution for efficient processing.|||As we know, Apex runs in multi-tenant environment, i.e., a single resource is shared by all the customers and organizations. So, it is necessary to make sure that no one monopolizes the resources and hence Salesforce.com has created the set of limits which governs and limits the code execution. Whenever any of the governor limits are crossed, it will throw error and will halt the execution of program.|||From a Developer's perspective, it is important to ensure that our code should be scalable and should not hit the limits.|||All these limits are applied on per transaction basis. A single trigger execution is one transaction.|||As we have seen, the trigger design pattern helps avoid the limit error. We will now see other important limits.|||You can issue only 100 queries per transaction, that is, when your code will issue more than 100 SOQL queries then it will throw error.|||This example shows how SOQL query limit can be reached −|||The following trigger iterates over a list of customers and updates the child record's (Invoice) description with string 'Ok to Pay'.|||When the 'updateCustomerDescription' method is called and the number of customer records are more than 100, then it will hit the SOQL limit. To avoid this, never write the SOQL query in the For Loop. In this case, the SOQL query has been written in the For loop.|||Following is an example which will show how to avoid the DML as well as the SOQL limit. We have used the nested relationship query to fetch the invoice records and used the context variable trigger.newMap to get the map of id and Customer records.|||This example shows the Bulk trigger along with the trigger helper class pattern. You must save the helper class first and then save the trigger.|||Note − Paste the below code in 'CustomerTriggerHelper' class which we have created earlier.|||Following table lists down the important governor limits.|||In this chapter, we will understand Batch Processing in Apex. Consider a scenario wherein, we will process large number of records on daily basis, probably the cleaning of data or maybe deleting some unused data.|||Batch Apex is asynchronous execution of Apex code, specially designed for processing the large number of records and has greater flexibility in governor limits than the synchronous code.|||When you want to process large number of records on daily basis or even on specific time of interval then you can go for Batch Apex.|||Also, when you want an operation to be asynchronous then you can implement the Batch Apex. Batch Apex is exposed as an interface that must be implemented by the developer. Batch jobs can be programmatically invoked at runtime using Apex. Batch Apex operates over small batches of records, covering your entire record set and breaking the processing down to manageable chunks of data.|||When we are using the Batch Apex, we must implement the Salesforce-provided interface Database.Batchable, and then invoke the class programmatically.|||You can monitor the class by following these steps −|||To monitor or stop the execution of the batch Apex Batch job, go to Setup → Monitoring → Apex Jobs or Jobs → Apex Jobs.||||||Database.Batchable interface has the following three methods that need to be implemented −|||Let us now understand each method in detail.|||The Start method is one of the three methods of the Database.Batchable interface.|||Syntax|||This method will be called at the starting of the Batch Job and collects the data on which the Batch job will be operating.|||Consider the following points to understand the method −|||Use the Database.QueryLocator object when you are using a simple query to generate the scope of objects used in the batch job. In this case, the SOQL data row limit will be bypassed.|||Use the iterable object when you have complex criteria to process the records. Database.QueryLocator determines the scope of records which should be processed.|||Let us now understand the Execute method of the Database.Batchable interface.|||Syntax|||where, list<sObject< is returned by the Database.QueryLocator method.|||This method gets called after the Start method and does all the processing required for Batch Job.|||We will now discuss the Finish method of the Database.Batchable interface.|||Syntax|||This method gets called at the end and you can do some finishing activities like sending an email with information about the batch job records processed and status.|||Let us consider an example of our existing Chemical Company and assume that we have requirement to update the Customer Status and Customer Description field of Customer Records which have been marked as Active and which have created Date as today. This should be done on daily basis and an email should be sent to a User about the status of the Batch Processing. Update the Customer Status as 'Processed' and Customer Description as 'Updated Via Batch Job'.|||To execute this code, first save it and then paste the following code in Execute anonymous. This will create the object of class and Database.execute method will execute the Batch job. Once the job is completed then an email will be sent to the specified email address. Make sure that you have a customer record which has Active as checked.|||Once this class is executed, then check the email address you have provided where you will receive the email with information. Also, you can check the status of the batch job via the Monitoring page and steps as provided above.|||If you check the debug logs, then you can find the List size which indicates how many records have been processed.|||Limitations|||We can only have 5 batch job processing at a time. This is one of the limitations of Batch Apex.|||You can schedule the Apex class via Apex detail page as given below −|||Step 1 − Go to Setup ⇒ Apex Classes, Click on Apex Classes.|||Step 2 − Click on the Schedule Apex button.|||Step 3 − Provide details.|||You can schedule the Apex Batch Job using Schedulable Interface as given below −|||Debugging is an important part in any programming development. In Apex, we have certain tools that can be used for debugging. One of them is the system.debug() method which prints the value and output of variable in the debug logs.|||We can use the following two tools for debugging −|||You can use the Developer console and execute anonymous functionality for debugging the Apex as below −|||Example|||Consider our existing example of fetching the customer records which have been created today. We just want to know if the query is returning the results or not and if yes, then we will check the value of List.|||Paste the code given below in execute anonymous window and follow the steps which we have done for opening execute anonymous window.|||Step 1 − Open the Developer console|||Step 2 − Open the Execute anonymous from 'Debug' as shown below.|||Step 3 − Open the Execute Anonymous window and paste the following code and click on execute.|||Step 4 − Open the Logs as shown below.|||Step 5 − Enter 'USER' in filter condition as shown below.|||Step 6 − Open the USER DEBUG Statement as shown below.|||You can debug the same class via debug logs as well. Suppose, you have a trigger in Customer object and it needs to be debugged for some variable values, then you can do this via the debug logs as shown below −|||This is the Trigger Code which updates the Description field if the modified customer is active and you want to check the values of variables and records currently in scope −|||Follow the steps given below to generate the Debug logs.|||Step 1 − Set the Debug logs for your user. Go to Setup and type 'Debug Log' in search
setup window and then click on Link.|||Step 2 − Set the debug logs as following.||||||Step 3 − Enter the name of User which requires setup. Enter your name here.|||Step 4 − Modify the customer records as event should occur to generate the debug log.|||Step 5 − Now go to the debug logs section again. Open the debug logs and click on Reset.|||Step 6 − Click on the view link of the first debug log.|||Step 7 − Search for the string 'USER' by using the browser search as shown below.|||The debug statement will show the value of the field at which we have set the point.|||Testing is the integrated part of Apex or any other application development. In Apex, we have separate test classes to develop for all the unit testing.|||In SFDC, the code must have 75% code coverage in order to be deployed to Production. This code coverage is performed by the test classes. Test classes are the code snippets which test the functionality of other Apex class.|||Let us write a test class for one of our codes which we have written previously. We will write test class to cover our Trigger and Helper class code. Below is the trigger and helper class which needs to be covered.|||In this section, we will understand how to create a Test Class.|||We need to create data for test class in our test class itself. Test class by default does not have access to organization data but if you set @isTest(seeAllData = true), then it will have the access to organization's data as well.|||By using this annotation, you declared that this is a test class and it will not be counted against the organization's total code limit.|||Unit test methods are the methods which do not take arguments, commit no data to the database, send no emails, and are declared with the testMethod keyword or the isTest annotation in the method definition. Also, test methods must be defined in test classes, that is, classes annotated with isTest.|||We have used the 'myUnitTest' test method in our examples.|||These are the standard test methods which are available for test classes. These methods contain the event or action for which we will be simulating our test. Like in this example, we will test our trigger and helper class to simulate the fire trigger by updating the records as we have done to start and stop block. This also provides separate governor limit to the code which is in start and stop block.|||This method checks the desired output with the actual. In this case, we are expecting an Invoice record to be inserted so we added assert to check the same.|||Example|||Follow the steps given below to run the test class −|||Step 1 − Go to Apex classes ⇒ click on the class name 'CustomerTriggerTestClass'.|||Step 2 − Click on Run Test button as shown.|||Step 3 − Check status|||Step 4 − Now check the class and trigger for which we have written the test|||Our testing is successful and completed.|||Till now we have developed code in Developer Edition, but in real life scenario, you have to do this development in Sandbox and then you might need to deploy this to another sandbox or production environment and this is called the deployment. In short, this is the movement of metadata from one organization to another. The reason behind this is that you cannot develop Apex in your Salesforce production organization. Live users accessing the system while you are developing can destabilize your data or corrupt your application.|||Tools available for deployment −|||As we are using the Developer Edition for our development and learning purpose, we cannot use the Change Set or other tools which need the SFDC enterprise or other paid edition. Hence, we will be elaborating the Force.com IDE deployment method in this tutorial.|||Step 1 − Open Eclipse and open the class trigger that needs to be deployed.|||Step 2 − Once you click on 'Deploy to server', then enter the username and password of the organization wherein, the Component needs to be deployed.|||By performing the above mentioned steps, your Apex components will be deployed to the target organization.|||You can deploy Validation rules, workflow rules, Apex classes and Trigger from one organization to other by connecting them via the deployment settings. In this case, organizations must be connected.|||To open the deployment setup, follow the steps given below. Remember that this feature is not available in the Developer Edition −|||Step 1 − Go to Setup and search for 'Deploy'.|||Step 2 − Click on 'Outbound Change Set' in order to create change set to deploy.|||Step 3 − Add components to change set using the 'Add' button and then Save and click on Upload.|||Step 4 − Go to the Target organization and click on the inbound change set and finally click on deploy.|||We will just have a small overview of this method as this is not a commonly-used method.|||You can use the method calls given below to deploy your metadata.|||This tool is used for the scripted deployment. You have to download the Force.com Migration tool and then you can perform the file based deployment. You can download the Force.com migration tool and then do the scripted deployment.","Create Web services with integrating other systems.@@@Create email services for email blast or email setup.@@@Perform complex validation over multiple objects at the same time and also custom validation implementation.@@@Create complex business processes that are not supported by existing workflow functionality or flows.@@@Create custom transactional logic (logic that occurs over the entire transaction, not just with a single record or object) like using the Database methods for updating the records.@@@Perform some logic when a record is modified or modify the related object's record when there is some event which has caused the trigger to fire.|||It cannot show the elements in User Interface.@@@You cannot change the standard SFDC provided functionality and also it is not possible to prevent the standard functionality execution.@@@Creating multiple threads is also not possible as we can do it in other languages.|||Force.com Developer Console@@@Force.com IDE@@@Code Editor in the Salesforce User Interface|||Writing and compiling code − You can write the code using the source code editor. When you save a trigger or class, the code is automatically compiled. Any compilation errors will be reported.@@@Debugging − You can write the code using the source code editor. When you save a trigger or class, the code is automatically compiled. Any compilation errors will be reported.@@@Testing − You can view debug logs and set checkpoints that aid in debugging.@@@Checking performance − You can execute tests of specific test classes or all classes in your organization, and you can view test results. Also, you can inspect code coverage.@@@SOQL queries − You can inspect debug logs to locate performance bottlenecks. @@@Color coding and autocomplete − The source code editor uses a color scheme for easier readability of code elements and provides auto completion for class and method names.|||Primitive (Integer, Double, Long, Date, Datetime, String, ID, or Boolean)@@@Collections (Lists, Sets and Maps) (To be covered in Chapter 6)@@@sObject@@@Enums@@@Classes, Objects and Interfaces (To be covered in Chapter 11, 12 and 13)|||size()@@@add()@@@get()@@@clear()@@@set()|||Variable data type and variable name are mandatory@@@Access modifiers and value are optional.|||return_data_type@@@method_name|||Triggers and Anonymous block@@@A trigger invoked for specified events@@@Asynchronous Apex@@@Scheduling an Apex class to run at specified intervals, or running a batch job@@@Web Services class@@@Apex Email Service class@@@Apex Web Services, which allow exposing your methods via SOAP and REST Web services@@@Visualforce Controllers@@@Apex Email Service to process inbound email@@@Invoking Apex Using JavaScript@@@The Ajax toolkit to invoke Web service methods implemented in Apex|||insert@@@update@@@delete@@@merge@@@upsert@@@undelete|||When you want to process large number of records on daily basis or even on specific time of interval then you can go for Batch Apex.@@@Also, when you want an operation to be asynchronous then you can implement the Batch Apex. Batch Apex is exposed as an interface that must be implemented by the developer. Batch jobs can be programmatically invoked at runtime using Apex. Batch Apex operates over small batches of records, covering your entire record set and breaking the processing down to manageable chunks of data.|||Start@@@Execute@@@Finish|||Use the Database.QueryLocator object when you are using a simple query to generate the scope of objects used in the batch job. In this case, the SOQL data row limit will be bypassed.@@@Use the iterable object when you have complex criteria to process the records. Database.QueryLocator determines the scope of records which should be processed.|||Developer Console@@@Debug Logs|||Force.com IDE@@@Change Sets@@@SOAP API@@@Force.com Migration Tool|||compileAndTest()@@@compileClasses()@@@compileTriggers()",,"Sr.No.@@@Statement & Description|||1@@@if statement
An if statement consists of a Boolean expression followed by one or more statements.|||2@@@if...else statement
An if statement can be followed by an optional else statement, which executes when the Boolean expression is false.|||3@@@if...elseif...else statement
