Course,Chapters,ALL Headings,Paragraphs,Unordered List Items,Ordered List Items,Tables,Code Examples

Numbers
The letter t, that stands for logical true.
The value nil, that stands for logical false, as well as an empty list.

@@@Numbers@@@The letter t, that stands for logical true.@@@The value nil, that stands for logical false, as well as an empty list.|||Numbers@@@The letter t, that stands for logical true.@@@The value nil, that stands for logical false, as well as an empty list.|||The reader translates the strings of characters to LISP objects or s-expressions.@@@The evaluator defines syntax of Lisp forms that are built from s-expressions. This second level of evaluation defines a syntax that determines which s-expressions are LISP forms.|||An Atom@@@An empty or non-list@@@Any list that has a symbol as its first element|||Scalar types − for example, number types, characters, symbols etc.@@@Data structures − for example, lists, vectors, bit-vectors, and strings.|||Arithmetic Operations@@@Comparison Operations@@@Logical Operations@@@Bitwise Operations|||Name of the function@@@Parameters of the function@@@Body of the function|||You can provide an empty list as parameters, which means the function takes no arguments, the list is empty, written as ().@@@LISP also allows optional, multiple, and keyword arguments.@@@The documentation string describes the purpose of the function. It is associated with the name of the function and can be obtained using the documentation function.@@@The body of the function may consist of any number of Lisp expressions.@@@The value of the last expression in the body is returned as the value of the function.@@@You can also return a value from the function using the return-from special operator.|||Optional Parameters@@@Rest Parameters@@@Keyword Parameters@@@Returning Values from a Function@@@Lambda Functions@@@Mapping Functions|||Integers@@@Ratios@@@Floating-point numbers@@@Complex numbers|||#\Backspace@@@#\Tab@@@#\Linefeed@@@#\Page@@@#\Return@@@#\Rubout|||The key argument provides the key.@@@The :test argument determines how keys are compared - it should have one of three values #'eq, #'eql, or #'equal, or one of the three symbols eq, eql, or equal. If not specified, eql is assumed.@@@The :size argument sets the initial size of the hash table. This should be an integer greater than zero.@@@The :rehash-size argument specifies how much to increase the size of the hash table when it becomes full. This can be an integer greater than zero, which is the number of entries to add, or it can be a floating-point number greater than 1, which is the ratio of the new size to the old size. The default value for this argument is implementation-dependent.@@@The :rehash-threshold argument specifies how full the hash table can get before it must grow. This can be an integer greater than zero and less than the :rehash-size (in which case it will be scaled whenever the table is grown), or it can be a floating-point number between zero and 1. The default value for this argument is implementation-dependent.|||key: is the associated key@@@hash-table: is the hash-table to be searched@@@default: is the value to be returned, if the entry is not found, which is nil, if not specified.|||prin1 returns the object as its value.@@@print prints the object with a preceding newline and followed by a space. It returns object.@@@pprint is just like print except that the trailing space is omitted.@@@princ is just like prin1 except that the output has no escape character|||The function finish-output attempts to ensure that all output sent to output-stream has reached its destination, and only then returns nil.@@@The function force-output initiates the emptying of any internal buffers but returns nil without waiting for completion or acknowledgment.@@@The function clear-output attempts to abort any outstanding output operation in progress in order to allow as little output as possible to continue to the destination.|||destination is standard output@@@control-string holds the characters to be output and the printing directive.|||The filename argument is the name of the file to be opened or created.@@@The keyword arguments specify the type of stream and error handling ways.@@@The :direction keyword specifies whether the stream should handle input, output, or both, it takes the following values −

:input - for input streams (default value)
:output - for output streams
:io - for bidirectional streams
:probe - for just checking a files existence; the stream is opened and then closed.

@@@:input - for input streams (default value)@@@:output - for output streams@@@:io - for bidirectional streams@@@:probe - for just checking a files existence; the stream is opened and then closed.@@@The :element-type specifies the type of the unit of transaction for the stream.@@@The :if-exists argument specifies the action to be taken if the :direction is :output or :io and a file of the specified name already exists. If the direction is :input or :probe, this argument is ignored. It takes the following values −

:error - it signals an error.
:new-version - it creates a new file with the same name but larger version number.
:rename - it renames the existing file.
:rename-and-delete - it renames the existing file and then deletes it.
:append - it appends to the existing file.
:supersede - it supersedes the existing file.
nil - it does not create a file or even a stream just returns nil to indicate failure.

@@@:error - it signals an error.@@@:new-version - it creates a new file with the same name but larger version number.@@@:rename - it renames the existing file.@@@:rename-and-delete - it renames the existing file and then deletes it.@@@:append - it appends to the existing file.@@@:supersede - it supersedes the existing file.@@@nil - it does not create a file or even a stream just returns nil to indicate failure.@@@The :if-does-not-exist argument specifies the action to be taken if a file of the specified name does not already exist. It takes the following values −

:error - it signals an error.
:create - it creates an empty file with the specified name and then uses it.
nil - it does not create a file or even a stream, but instead simply returns nil to indicate failure.

@@@:error - it signals an error.@@@:create - it creates an empty file with the specified name and then uses it.@@@nil - it does not create a file or even a stream, but instead simply returns nil to indicate failure.@@@The :external-format argument specifies an implementation-recognized scheme for representing characters in files.|||:input - for input streams (default value)@@@:output - for output streams@@@:io - for bidirectional streams@@@:probe - for just checking a files existence; the stream is opened and then closed.|||:error - it signals an error.@@@:new-version - it creates a new file with the same name but larger version number.@@@:rename - it renames the existing file.@@@:rename-and-delete - it renames the existing file and then deletes it.@@@:append - it appends to the existing file.@@@:supersede - it supersedes the existing file.@@@nil - it does not create a file or even a stream just returns nil to indicate failure.|||:error - it signals an error.@@@:create - it creates an empty file with the specified name and then uses it.@@@nil - it does not create a file or even a stream, but instead simply returns nil to indicate failure.|||filename is the name of the file to be opened; it may be a string, a pathname, or a stream.@@@The options are same as the keyword arguments to the function open.|||Title@@@Author@@@Subject@@@Book ID|||The above declaration creates a book structure with four named components. So every book created will be an object of this structure.@@@It defines four functions named book-title, book-author, book-subject and book-book-id, which will take one argument, a book structure, and will return the fields title, author, subject and book-id of the book object. These functions are called the access functions.@@@The symbol book becomes a data type and you can check it using the typep predicate.@@@There will also be an implicit function named book-p, which is a predicate and will be true if its argument is a book and is false otherwise.@@@Another implicit function named make-book will be created, which is a constructor, which, when invoked, will create a data structure with four components, suitable for use with the access functions.@@@The #S syntax refers to a structure, and you can use it to read or print instances of a book.@@@An implicit function named copy-book of one argument is also defined that. It takes a book object and creates another book object, which is a copy of the first one. This function is called the copier function.@@@You can use setf to alter the components of a book, for example|||common-lisp − it contains symbols for all the functions and variables defined.@@@common-lisp-user − it uses the common-lisp package and all other packages with editing and debugging tools; it is called cl-user in short|||package-name is the name of the package.@@@The :use keyword specifies the packages that this package needs, i.e., packages that define functions used by code in this package.@@@The :export keyword specifies the symbols that are external in this package.|||Signalling a condition@@@Handling the condition@@@Restart the process|||Define the Condition − ""A condition is an object whose class indicates the general nature of the condition and whose instance data carries information about the details of the particular circumstances that lead to the condition being signalled"".
The define-condition macro is used for defining a condition, which has the following syntax −

(define-condition condition-name (error)
   ((text :initarg :text :reader text))
)

New condition objects are created with MAKE-CONDITION macro, which initializes the slots of the new condition based on the :initargs argument.
In our example, the following code defines the condition −

(define-condition on-division-by-zero (error)
   ((message :initarg :message :reader message))
)

@@@Writing the Handlers − a condition handler is a code that are used for handling the condition signalled thereon. It is generally written in one of the higher level functions that call the erroring function. When a condition is signalled, the signalling mechanism searches for an appropriate handler based on the condition's class.
Each handler consists of −

Type specifier, that indicates the type of condition it can handle
A function that takes a single argument, the condition

When a condition is signalled, the signalling mechanism finds the most recently established handler that is compatible with the condition type and calls its function.
The macro handler-case establishes a condition handler. The basic form of a handler-case −

(handler-case expression error-clause*)

Where, each error clause is of the form −

condition-type ([var]) code)

@@@Type specifier, that indicates the type of condition it can handle@@@A function that takes a single argument, the condition@@@Restarting Phase
This is the code that actually recovers your program from errors, and condition handlers can then handle a condition by invoking an appropriate restart. The restart code is generally place in middle-level or low-level functions and the condition handlers are placed into the upper levels of the application.
The handler-bind macro allows you to provide a restart function, and allows you to continue at the lower level functions without unwinding the function call stack. In other words, the flow of control will still be in the lower level function.
The basic form of handler-bind is as follows −

(handler-bind (binding*) form*)

Where each binding is a list of the following −

a condition type
a handler function of one argument

The invoke-restart macro finds and invokes the most recently bound restart function with the specified name as argument.
You can have multiple restarts.
@@@a condition type@@@a handler function of one argument|||Type specifier, that indicates the type of condition it can handle@@@A function that takes a single argument, the condition|||a condition type@@@a handler function of one argument|||:accessor function-name@@@:initform expression@@@:initarg symbol",,"array@@@fixnum@@@package@@@simple-string|||atom@@@float@@@pathname@@@simple-vector|||bignum@@@function@@@random-state@@@single-float|||bit@@@hash-table@@@ratio@@@standard-char|||bit-vector@@@integer@@@rational@@@stream|||character@@@keyword@@@readtable@@@string|||[common]@@@list@@@sequence@@@[string-char]|||compiled-function@@@long-float@@@short-float@@@symbol|||complex@@@nill@@@signed-byte@@@t|||cons@@@null@@@simple-array@@@unsigned-byte|||double-float@@@number@@@simple-bit-vector@@@vector&&&Operator@@@Description@@@Example|||+@@@Adds two operands@@@(+A B) will give 30|||-@@@Subtracts second operand from the first@@@(- A B) will give -10|||*@@@Multiplies both operands@@@(* A B) will give 200|||/@@@Divides numerator by de-numerator@@@(/ B A) will give 2|||mod,rem@@@Modulus Operator and remainder of after an integer division@@@(mod B A )will give 0|||incf@@@Increments operator increases integer value by the second argument specified@@@(incf A 3) will give 13|||decf@@@Decrements operator decreases integer value by the second argument specified@@@(decf A 4) will give 9&&&Operator@@@Description@@@Example|||=@@@Checks if the values of the operands are all equal or not, if yes then condition becomes true.@@@(= A B) is not true.|||/=@@@Checks if the values of the operands are all different or not, if values are not equal then condition becomes true.@@@(/= A B) is true.|||>@@@Checks if the values of the operands are monotonically decreasing.@@@(> A  B) is not true.|||<@@@Checks if the values of the operands are monotonically increasing.@@@(< A B) is true.|||>=@@@Checks if the value of any left operand is greater than or equal to the value of next right operand, if yes then condition becomes true.@@@(>= A  B) is not true.|||<=@@@Checks if the value of any left operand is less than or equal to the value of its right operand, if yes then condition becomes true.@@@(<= A  B) is true.|||max@@@It compares two or more arguments and returns the maximum value.@@@(max A B) returns 20|||min@@@It compares two or more arguments and returns the minimum value.@@@(min A B) returns 10&&&Operator@@@Description@@@Example|||and@@@It takes any number of arguments. The arguments are evaluated left to right. If all arguments evaluate to non-nil, then the value of the last argument is returned. Otherwise nil is returned.@@@(and A  B) will return NIL.|||or@@@It takes any number of arguments. The arguments are evaluated left to right until one evaluates to non-nil, in such case the argument value is returned, otherwise it returns nil.@@@(or A  B) will return 5.|||not@@@It takes one argument and returns t if the argument evaluates to nil.@@@(not A) will return T.&&&p@@@q@@@p and q@@@p or q@@@p xor q|||0@@@0@@@0@@@0@@@0|||0@@@1@@@0@@@1@@@1|||1@@@1@@@1@@@1@@@0|||1@@@0@@@0@@@1@@@1&&&Operator@@@Description@@@Example|||logand@@@This returns the bit-wise logical AND of its arguments. If no argument is given, then the result is -1, which is an identity for this operation.@@@(logand a b)) will give 12|||logior@@@This returns the bit-wise logical INCLUSIVE OR of its arguments. If no argument is given, then the result is zero, which is an identity for this operation.@@@(logior a b) will give 61|||logxor@@@This returns the bit-wise logical EXCLUSIVE OR of its arguments. If no argument is given, then the result is zero, which is an identity for this operation.@@@(logxor a b) will give 49|||lognor@@@This returns the bit-wise NOT of its arguments. If no argument is given, then the result is -1, which is an identity for this operation.@@@(lognor a b) will give -62,|||logeqv@@@This returns the bit-wise logical EQUIVALENCE (also known as exclusive nor) of its arguments. If no argument is given, then the result is -1, which is an identity for this operation.@@@(logeqv a b) will give -50&&&Sr.No.@@@Construct & Description|||1@@@cond
This construct is used for used for checking multiple test-action clauses. It can be compared to the nested if statements in other programming languages.|||2@@@if
The if construct has various forms. In simplest form it is followed by a test clause, a test action and some other consequent action(s). If the test clause evaluates to true, then the test action is executed otherwise, the consequent clause is evaluated.|||3@@@when
In simplest form it is followed by a test clause, and a test action. If the test clause evaluates to true, then the test action is executed otherwise, the consequent clause is evaluated.|||4@@@case
This construct implements multiple test-action clauses like the cond construct. However, it evaluates a key form and allows multiple action clauses based on the evaluation of that key form.&&&Sr.No.@@@Construct & Description|||1@@@loop
The loop construct is the simplest form of iteration provided by LISP. In its simplest form, it allows you to execute some statement(s) repeatedly until it finds a return statement.|||2@@@loop for
The loop for construct allows you to implement a for-loop like iteration as most common in other languages.|||3@@@do
The do construct is also used for performing iteration using LISP. It provides a structured form of iteration.|||4@@@dotimes
The dotimes construct allows looping for some fixed number of iterations.|||5@@@dolist
The dolist construct allows iteration through each element of a list.&&&Sr.No.@@@Predicate & Description|||1@@@atom
It takes one argument and returns t if the argument is an atom or nil if otherwise.|||2@@@equal
It takes two arguments and returns t if they are structurally equal or nil otherwise.|||3@@@eq
It takes two arguments and returns t if they are same identical objects, sharing the same memory location or nil otherwise.|||4@@@eql
It takes two arguments and returns t if the arguments are eq, or if they are numbers of the same type with the same value, or if they are character objects that represent the same character, or nil otherwise.|||5@@@evenp
It takes one numeric argument and returns t if the argument is even number or nil if otherwise.|||6@@@oddp
It takes one numeric argument and returns t if the argument is odd number or nil if otherwise.|||7@@@zerop
It takes one numeric argument and returns t if the argument is zero or nil if otherwise.|||8@@@null
It takes one argument and returns t if the argument evaluates to nil, otherwise it returns nil.|||9@@@listp
It takes one argument and returns t if the argument evaluates to a list otherwise it returns nil.|||10@@@greaterp
It takes one or more argument and returns t if either there is a single argument or the arguments are successively larger from left to right, or nil if otherwise.|||11@@@lessp
It takes one or more argument and returns t if either there is a single argument or the arguments are successively smaller from left to right, or nil if otherwise.|||12@@@numberp
It takes one argument and returns t if the argument is a number or nil if otherwise.|||13@@@symbolp
It takes one argument and returns t if the argument is a symbol otherwise it returns nil.|||14@@@integerp
It takes one argument and returns t if the argument is an integer otherwise it returns nil.|||15@@@rationalp
It takes one argument and returns t if the argument is rational number, either a ratio or a number, otherwise it returns nil.|||16@@@floatp
It takes one argument and returns t if the argument is a floating point number otherwise it returns nil.|||17@@@realp
It takes one argument and returns t if the argument is a real number otherwise it returns nil.|||18@@@complexp
It takes one argument and returns t if the argument is a complex number otherwise it returns nil.|||19@@@characterp
It takes one argument and returns t if the argument is a character otherwise it returns nil.|||20@@@stringp
It takes one argument and returns t if the argument is a string object otherwise it returns nil.|||21@@@arrayp
It takes one argument and returns t if the argument is an array object otherwise it returns nil.|||22@@@packagep
It takes one argument and returns t if the argument is a package otherwise it returns nil.&&&Sr.No.@@@Data type & Description|||1@@@fixnum
This data type represents integers which are not too large and mostly in the range  -215  to 215-1 (it is machine-dependent)|||2@@@bignum
These are very large numbers with size limited by the amount of memory allocated for LISP, they are not fixnum numbers.|||3@@@ratio
Represents the ratio of two numbers in the numerator/denominator form. The / function always produce the result in ratios, when its arguments are integers.|||4@@@float
It represents non-integer numbers. There are four float data types with increasing precision.|||5@@@complex
It represents complex numbers, which are denoted by #c. The real and imaginary parts could be both either rational or floating point numbers.
&&&Sr.No.@@@Function & Description|||1@@@+, -, *, /
Respective arithmetic operations|||2@@@sin, cos, tan, acos, asin, atan
Respective trigonometric functions.|||3@@@sinh, cosh, tanh, acosh, asinh, atanh
Respective hyperbolic functions.|||4@@@exp
Exponentiation function. Calculates ex|||5@@@expt
Exponentiation function, takes base and power both.|||6@@@sqrt
It calculates the square root of a number.|||7@@@log
Logarithmic function. It one parameter is given, then it calculates its natural logarithm, otherwise the second parameter is used as base.|||8@@@conjugate
It calculates the complex conjugate of a number. In case of a real number, it returns the number itself.|||9@@@abs
It returns the absolute value (or magnitude) of a number.|||10@@@gcd
It calculates the greatest common divisor of the given numbers.|||11@@@lcm
It calculates the least common multiple of the given numbers.|||12@@@isqrt
It gives the greatest integer less than or equal to the exact square root of a given natural number.|||13@@@floor, ceiling, truncate, round
All these functions take two arguments as a number and returns the quotient; floor returns the largest integer that is not greater than ratio, ceiling chooses the smaller integer that is larger than ratio, truncate chooses the integer of the same sign as ratio with the largest absolute value that is less than absolute value of ratio, and round chooses an integer that is closest to ratio.|||14@@@ffloor, fceiling, ftruncate, fround
Does the same as above, but returns the quotient as a floating point number.|||15@@@mod, rem
Returns the remainder in a division operation.|||16@@@float
Converts a real number to a floating point number.|||17@@@rational, rationalize
Converts a real number to rational number.|||18@@@numerator, denominator
Returns the respective parts of a rational number.|||19@@@realpart, imagpart
Returns the real and imaginary part of a complex number.&&&Case Sensitive Functions@@@Case-insensitive Functions@@@Description|||char=@@@char-equal@@@Checks if the values of the operands are all equal or not, if yes then condition becomes true.|||char/=@@@char-not-equal@@@Checks if the values of the operands are all different or not, if values are not equal then condition becomes true.|||char<@@@char-lessp@@@Checks if the values of the operands are monotonically decreasing.|||char>@@@char-greaterp@@@Checks if the values of the operands are monotonically increasing.|||char<=@@@char-not-greaterp@@@Checks if the value of any left operand is greater than or equal to the value of next right operand, if yes then condition becomes true.|||char>=@@@char-not-lessp@@@Checks if the value of any left operand is less than or equal to the value of its right operand, if yes then condition becomes true.&&&Sr.No.@@@Argument & Description|||1@@@dimensions
It gives the dimensions of the array. It is a number for one-dimensional array, and a list for multi-dimensional array.|||2@@@:element-type
It is the type specifier, default value is T, i.e. any type|||3@@@:initial-element
Initial elements value. It will make an array with all the elements initialized to a particular value.|||4@@@:initial-content
Initial content as object.|||5@@@:adjustable
It helps in creating a resizeable (or adjustable) vector whose underlying memory can be resized. The argument is a Boolean value indicating whether the array is adjustable or not, default value being NIL.|||6@@@:fill-pointer
It keeps track of the number of elements actually stored in a resizeable vector.|||7@@@:displaced-to
It helps in creating a displaced array or shared array that shares its contents with the specified array. Both the arrays should have same element type. The :displaced-to option may not be used with the :initial-element or :initial-contents option. This argument defaults to nil.|||8@@@:displaced-index-offset
It gives the index-offset of the created shared array.&&&Case Sensitive Functions@@@Case-insensitive Functions@@@Description|||string=@@@string-equal@@@Checks if the values of the operands are all equal or not, if yes then condition becomes true.|||string/=@@@string-not-equal@@@Checks if the values of the operands are all different or not, if values are not equal then condition becomes true.|||string<@@@string-lessp@@@Checks if the values of the operands are monotonically decreasing.|||string>@@@string-greaterp@@@Checks if the values of the operands are monotonically increasing.|||string<=@@@string-not-greaterp@@@Checks if the value of any left operand is greater than or equal to the value of next right operand, if yes then condition becomes true.|||string>=@@@string-not-lessp@@@Checks if the value of any left operand is less than or equal to the value of its right operand, if yes then condition becomes true.&&&Sr.No.@@@Function & Description|||1@@@string-upcase
Converts the string to upper case|||2@@@string-downcase
