Course,Chapters,ALL Headings,Paragraphs,Unordered List Items,Ordered List Items,Tables,Code Examples
Draws a line.|||2@@@Arc
Draws an arc.|||3@@@Rectangle
Draws a rectangle.|||4@@@Oval
Draws an oval.|||5@@@Polygon
Draws a polygon.|||6@@@Text
Draws a text.|||7@@@Bitmap
Draws a bitmap.|||8@@@Image
Draws an image.","#!/usr/bin/wishcanvas .myCanvas -background red -width 100 -height 100 pack .myCanvas|||#!/usr/bin/wishcanvas .myCanvas -background red -width 200 -height 200 pack .myCanvas.myCanvas create arc 10 10 50 50 -fill yellow.myCanvas create line 10 30 50 50 100 10 -arrow both -fill yellow -smooth true   -splinesteps 2.myCanvas create oval 50 50 100 80 -fill yellow.myCanvas create polygon 50 150 100 80 120 120 100 190 -fill yellow -outline green.myCanvas create rectangle 150 150 170 170  -fill yellow.myCanvas create text 170 20 -fill yellow -text ""Hello"" -font {Helvetica -18 bold}.myCanvas create bitmap 180 50 -bitmap info"
Learn Tcl/Tk,Tk - Mega Widgets,Tk - Mega Widgets,"Mega widgets include many complex widgets which is often required in some large scale Tk applications. The list of available mega widgets are as shown below −|||Widget for displaying dialog boxes.|||Widget that allows users to choose numbers.|||Widget that combines an entry with a list of choices available to the use.|||Tabbed widget that helps to switch between one of several pages, using an index tab.|||Widget to provide visual feedback to the  progress of a long operation like file upload.|||Widget to display and allow browsing through a hierarchy of items more in form of tree.|||Scrolling widgets without a text or canvas widgets.|||Scale widget to choose a numeric value through sliders.|||A simple Tk example is shown below using some mega widgets.|||When we run the above program, we will get the following output −",,,"Sr.No.@@@Widget & Description|||1@@@Dialog
Widget for displaying dialog boxes.|||2@@@Spinbox
Widget that allows users to choose numbers.|||3@@@Combobox
Widget that combines an entry with a list of choices available to the use.|||4@@@Notebook
Tabbed widget that helps to switch between one of several pages, using an index tab.|||5@@@Progressbar
Widget to provide visual feedback to the  progress of a long operation like file upload.|||6@@@Treeview
Widget to display and allow browsing through a hierarchy of items more in form of tree.|||7@@@Scrollbar
Scrolling widgets without a text or canvas widgets.|||8@@@Scale
Scale widget to choose a numeric value through sliders.","#!/usr/bin/wishttk::treeview .tree -columns ""Creator Year"" -displaycolumns ""Year Creator"" .tree heading Creator -text ""Creator"" -anchor center.tree heading Year -text ""Year"" -anchor centerpack .tree.tree insert {} end -id Languages -text ""Languages"".tree insert Languages end -text C -values [list ""Dennis Ritchie"" ""1990""]proc scaleMe {mywidget scaleValue} {   $mywidget configure -length $scaleValue} pack [scale .s2  -from 100.0 -to 200.0 -length 100 -background yellow -borderwidth 5   -font{Helvetica -18 bold} -foreground red -width 40 -relief ridge -orien horizontal   -variable a -command ""scaleMe .s2"" ]pack [ttk::progressbar .p1 -orient horizontal -length 200 -mode indeterminate -value 90]pack [ttk::progressbar .p2 -orient horizontal -length 200 -mode determinate -variable a   -maximum 75 -value 20]"
Learn Tcl/Tk,Tk - Fonts,Tk - Fonts|||Options,"There are a number of widgets that supports displaying text. Most of these provides the option of font attribute. The syntax for creating a font is shown below −|||The options available for the font create are listed below in the following table −|||-family familyName|||The name of font family.|||-size number|||The size of font.|||-weight level|||The weight for font.|||A simple example for a font creation is shown below −|||When we run the above program, we will get the following output −|||To get all the fonts available, we can use the following command −|||When we run the above command, we will get the following output −",,,"Sr.No.@@@Syntax & Description|||1@@@-family familyName
The name of font family.|||2@@@-size number
The size of font.|||3@@@-weight level
The weight for font.","#!/usr/bin/wishfont create myFont -family Helvetica -size 18 -weight bold pack [label .myLabel -font myFont -text ""Hello World""]|||#!/usr/bin/wishputs [font families]"
Learn Tcl/Tk,Tk - Images,Tk - Images|||Options,"The image widget is used to create and manipulate images. The syntax for creating image is as follows −|||In the above syntax type is photo or bitmap and name is the image identifier.|||The options available for image create are listed below in the following table −|||-file fileName|||The name of the image file name.|||-height number|||Used to set height for widget.|||-width number|||Sets the width for widget.|||-data string|||Image in base 64 encoded string.|||A simple example for image widget is shown below −|||When we run the above program, we will get the following output −|||The available function for image are listed below in the following table −|||image delete imageName|||Deletes the image from memory and related widgets visually.|||image height imageName|||Returns the height for image.|||image width imageName|||Returns the width for image.|||image type imageName|||Returns the type for image.|||image names|||Returns the list of images live in memory.|||A simple example for using the above image widget commands is shown below −|||The image will be deleted visually and from memory once ""image delete imgobj"" command executes. In console, the output will be like the following −",,,"Sr.No.@@@Syntax & Description|||1@@@-file fileName
The name of the image file name.|||2@@@-height number
Used to set height for widget.|||3@@@-width number
Sets the width for widget.|||4@@@-data string
Image in base 64 encoded string.&&&Sr.No.@@@Syntax & Description|||1@@@image delete imageName
Deletes the image from memory and related widgets visually.|||2@@@image height imageName
Returns the height for image.|||3@@@image width imageName
Returns the width for image.|||4@@@image type imageName
Returns the type for image.|||5@@@image names
Returns the list of images live in memory.","#!/usr/bin/wishimage create photo imgobj -file ""/Users/rajkumar/Desktop/F Drive/pictur/vb/Forests/   680049.png"" -width 400 -height 400 pack [label .myLabel].myLabel configure -image imgobj |||#!/usr/bin/wishimage create photo imgobj -file ""/Users/rajkumar/images/680049.png""   -width 400 -height 400 pack [label .myLabel].myLabel configure -image imgobjputs [image height imgobj]puts [image width imgobj]puts [image type imgobj]puts [image names]image delete imgobj"
Learn Tcl/Tk,Tk - Events,Tk - Events|||Event Binding|||Event after delay@@@Keyboard Events Example@@@Mouse Events Example@@@Linking Events with Button Example,"Events in its simplest form is handled with the help of commands. A simple example for event handling is event handling with button and is shown below −|||When we run the above program, we will get the following output −|||A simple program to show delay text animation event is shown below −|||When we run the program, we will get the following output in animated way −|||The syntax for event after delay is shown below −|||A simple program to show after delay event is shown below −|||When we run the program, we will get the following output after one second −|||You can cancel an event using the after cancel command as shown below −|||The syntax for event binding is as shown below −|||When we run the program and press a letter X, we will get the following output −|||When we run the program and press the left mouse button, we will get an output similar to the following −|||When we run the program and press enter, we will get the following output −",,,,"#!/usr/bin/wishproc myEvent { } {   puts ""Event triggered""}pack [button .myButton1  -text ""Button 1""   -command myEvent]|||#!/usr/bin/wishproc delay {} {   for {set j 0} {$j < 100000} {incr j} {} }label .myLabel -text ""Hello................"" -width 25pack .myLabelset str ""Hello................""for {set i [string length $str]} {$i > -2} {set i [expr $i-1]} {   .myLabel configure -text [string range $str 0 $i]   update   delay}|||#!/usr/bin/wishproc addText {} {   label .myLabel -text ""Hello................"" -width 25   pack .myLabel}after 1000 addText|||#!/usr/bin/wishproc addText {} {   label .myLabel -text ""Hello................"" -width 25   pack .myLabel}after 1000 addTextafter cancel addText|||#!/usr/bin/wishbind .  {puts ""Key Pressed: %K ""}|||#!/usr/bin/wishbind .  {puts ""Button %b Pressed : %x %y ""}|||#!/usr/bin/wishproc myEvent { } {   puts ""Event triggered""}pack [button .myButton1  -text ""Button 1""   -command myEvent]bind .  "".myButton1 invoke"""
Learn Tcl/Tk,Tk - Windows Manager,Tk - Windows Manager|||Creating Window@@@Destroying Window,"Window manager is used to handle the top level window. It helps in controlling the size, position, and other attributes of the window. In Tk, . is used to refer the main window. The syntax for window command is shown below −|||The list of options available for Tk wm command is shown in the following table −|||aspect windowName a b c d|||Tries to maintain the ratio of width/height to be between a/b and c/d.|||geometry windowName geometryParams|||Use to set geometry for window.|||grid windowName w h dx dy|||Sets the grid size.|||group windowName leaderName|||leaderName gives the leader of a group of related windows.|||deiconify windowName|||Brings the screen to normal if minimized.|||iconify windowName|||Minimizes the window.|||state windowName|||Returns the current state of window.|||withdraw windowName|||Unmaps the window and removes its details in memory.|||iconbitmap windowName image|||Sets or returns the icon bitmap.|||iconPhoto windowName image|||Sets or returns the icon photo.|||command windowName commandString|||Records the startup command in the WM_COMMAND property.|||protocol windowName arguments|||Register a command to handle the protocol request name, which can be WM_DELETE_WINDOW,|||WM_SAVE_YOURSELF,|||WM_TAKE_FOCUS. Eg: wm protocol.|||WM_DELETE_WINDOW Quit.|||minsize windowName size|||Determines the minimum window size.|||maxsize windowName size|||Determines the maximum window size.|||title windowName titleText|||Determines the title for window.|||attributes subOptions|||There are lots of attributes available like alpha, full screen and so on.|||Some of the above commands are used in the following example −|||When we run the above program, we will get the following output −|||As you can see alpha is one of the attributes available. The list of commonly used subcommands are listed below −|||-alpha number|||Sets the alpha for window.|||-fullscreen number|||Number can be 0 for normal screen or 1 for full screen.|||-topmost number|||Sets or returns whether window is topmost.Value can be 0 or 1.|||We can use toplevel command to create window and an example is shown below −|||When we run the above program, we will get the following output −|||We can use destroy command to destroy window and an example is shown below −|||The above command will destroy window named .t.",,,"Sr.No.@@@Syntax & Description|||1@@@aspect windowName a b c d
Tries to maintain the ratio of width/height to be between a/b and c/d.|||2@@@geometry windowName geometryParams
Use to set geometry for window.|||3@@@grid windowName w h dx dy
Sets the grid size.|||4@@@group windowName leaderName
leaderName gives the leader of a group of related windows.|||5@@@deiconify windowName
Brings the screen to normal if minimized.|||6@@@iconify windowName
Minimizes the window.|||7@@@state windowName
Returns the current state of window.|||8@@@withdraw windowName
Unmaps the window and removes its details in memory.|||9@@@iconbitmap windowName image
Sets or returns the icon bitmap.|||10@@@iconPhoto windowName image
Sets or returns the icon photo.|||11@@@command windowName commandString
Records the startup command in the WM_COMMAND property.|||12@@@protocol windowName arguments
Register a command to handle the protocol request name, which can be WM_DELETE_WINDOW,
WM_SAVE_YOURSELF,
WM_TAKE_FOCUS. Eg: wm protocol.
WM_DELETE_WINDOW Quit.|||13@@@minsize windowName size
Determines the minimum window size.|||14@@@maxsize windowName size
Determines the maximum window size.|||15@@@title windowName titleText
Determines the title for window.|||16@@@attributes subOptions
There are lots of attributes available like alpha, full screen and so on.&&&Sr.No.@@@Syntax & Description|||1@@@-alpha number
Sets the alpha for window.|||2@@@-fullscreen number
Number can be 0 for normal screen or 1 for full screen.|||3@@@-topmost number
Sets or returns whether window is topmost.Value can be 0 or 1.","#!/usr/bin/wishwm maxsize . 800 800wm minsize . 300 300wm title . ""Hello""wm attributes . -alpha "".90"" wm geometry . 300x200+100+100|||#!/usr/bin/wishtoplevel .t|||#!/usr/bin/wishdestroy .t"
Learn Tcl/Tk,Tk - Geometry Manager,Tk - Geometry Manager|||Positioning and sizing@@@Grid Geometry,"The geometry manager is used to manage the geometry of the window and other frames. We can use it to handle the position and size of the window and frames. The layout widgets are used for this purpose.|||The syntax for positioning and sizing window is shown below −|||Here, w refers to width and h refers to height. It is followed by a '+' or '-' sign with number next referring to the x position on screen. Similarly the following '+' or '-' sign with number refers to the y position on screen|||A simple example is shown below for the above Statement −.|||When we run the above program, we will get the following output −|||The syntax for grid geometry is shown below −|||The column, row, columnspan, or rowspan helps in providing the grid geometry.|||A simple example is shown below for the above statement −|||When we run the above program, we will get the following output −",,,,#!/usr/bin/wishwm geometry . 300x200+100+100|||#!/usr/bin/wishframe .myFrame1 -background red  -height 100 -width 100frame .myFrame2 -background blue -height 100 -width 50grid .myFrame1 -columnspan 10 -rowspan 10 -sticky wgrid .myFrame2 -column 10 -row 2
