Course,Chapters,ALL Headings,Paragraphs,Unordered List Items,Ordered List Items,Tables,Code Examples
Learn Awk Programming,AWK - Arrays,AWK - Arrays|||Creating Array@@@Deleting Array Elements@@@Multi-Dimensional arrays|||Syntax@@@Example@@@Output@@@Syntax@@@Example@@@Syntax@@@Example@@@Output,"AWK has associative arrays and one of the best thing about it is – the indexes need not to be continuous set of number; you can use either string or number as an array index. Also, there is no need to declare the size of an array in advance – arrays can expand/shrink at runtime.|||Its syntax is as follows −|||Where array_name is the name of array, index is the array index, and value is any value assigning to the element of the array.|||To gain more insight on array, let us create and access the elements of an array.|||On executing this code, you get the following result −|||In the above example, we declare the array as fruits whose index is fruit name and the value is the color of the fruit. To access array elements, we use array_name[index] format.|||For insertion, we used assignment operator. Similarly, we can use delete statement to remove an element from the array. The syntax of delete statement is as follows −|||The following example deletes the element orange. Hence the command does not show any output.|||AWK only supports one-dimensional arrays. But you can easily simulate a multi-dimensional array using the one-dimensional array itself.|||For instance, given below is a 3x3 two-dimensional array −|||In the above example, array[0][0] stores 100, array[0][1] stores 200, and so on. To store 100 at array location [0][0], we can use the following syntax −|||Though we gave 0,0 as index, these are not two indexes. In reality, it is just one index with the string 0,0.|||The following example simulates a 2-D array −|||On executing this code, you get the following result −|||You can also perform a variety of operations on an array such as sorting its elements/indexes. For that purpose, you can use assort and asorti functions",,,,"[jerry]$ awk 'BEGIN {   fruits[""mango""] = ""yellow"";   fruits[""orange""] = ""orange""   print fruits[""orange""] ""\n"" fruits[""mango""]}'|||[jerry]$ awk 'BEGIN {   fruits[""mango""] = ""yellow"";   fruits[""orange""] = ""orange"";   delete fruits[""orange""];   print fruits[""orange""]}'|||[jerry]$ awk 'BEGIN {   array[""0,0""] = 100;   array[""0,1""] = 200;   array[""0,2""] = 300;   array[""1,0""] = 400;   array[""1,1""] = 500;   array[""1,2""] = 600;   # print array elements   print ""array[0,0] = "" array[""0,0""];   print ""array[0,1] = "" array[""0,1""];   print ""array[0,2] = "" array[""0,2""];   print ""array[1,0] = "" array[""1,0""];   print ""array[1,1] = "" array[""1,1""];   print ""array[1,2] = "" array[""1,2""];}'"
Learn Awk Programming,AWK - Control Flow,AWK - Control Flow|||If statement@@@If Else Statement@@@If-Else-If Ladder|||Syntax@@@Syntax@@@Example@@@Output@@@Syntax@@@Example@@@Output@@@Example@@@Output,"Like other programming languages, AWK provides conditional statements to control the flow of a program. This chapter explains AWK's control statements with suitable examples.|||It simply tests the condition and performs certain actions depending upon the condition. Given below is the syntax of if statement −|||We can also use a pair of curly braces as given below to execute multiple actions −|||For instance, the following example checks whether a number is even or not −|||On executing the above code, you get the following result −|||In if-else syntax, we can provide a list of actions to be performed when a condition becomes false.|||The syntax of if-else statement is as follows −|||In the above syntax, action-1 is performed when the condition evaluates to true and action-2 is performed when the condition evaluates to false. For instance, the following example checks whether a number is even or not −|||On executing this code, you get the following result −|||We can easily create an if-else-if ladder by using multiple if-else statements. The following example demonstrates this −|||On executing this code, you get the following result −",,,,"[jerry]$ awk 'BEGIN {num = 10; if (num % 2 == 0) printf ""%d is even number.\n"", num }'|||[jerry]$ awk 'BEGIN {   num = 11; if (num % 2 == 0) printf ""%d is even number.\n"", num;       else printf ""%d is odd number.\n"", num }'|||[jerry]$ awk 'BEGIN {   a = 30;      if (a==10)   print ""a = 10"";   else if (a == 20)   print ""a = 20"";   else if (a == 30)   print ""a = 30"";}'"
Learn Awk Programming,AWK - Loops,AWK - Loops|||For Loop@@@While Loop@@@Do-While Loop@@@Break Statement@@@Continue Statement@@@Exit Statement|||Syntax@@@Example@@@Output@@@Syntax@@@Example@@@Output@@@Syntax@@@Example@@@Output@@@Example@@@Output@@@Example@@@Output@@@Example@@@Output@@@Example@@@Output,"This chapter explains AWK's loops with suitable example. Loops are used to execute a set of actions in a repeated manner. The loop execution continues as long as the loop condition is true.|||The syntax of for loop is −|||Initially, the for statement performs initialization action, then it checks the condition. If the condition is true, it executes actions, thereafter it performs increment or decrement operation. The loop execution continues as long as the condition is true. For instance, the following example prints 1 to 5 using for loop −|||On executing this code, you get the following result −|||The while loop keeps executing the action until a particular logical condition evaluates to true. Here is the syntax of while loop −|||AWK first checks the condition; if the condition is true, it executes the action. This process repeats as long as the loop condition evaluates to true. For instance, the following example prints 1 to 5 using while loop −|||On executing this code, you get the following result −|||The do-while loop is similar to the while loop, except that the test condition is evaluated at the end of the loop. Here is the syntax of do-whileloop −|||In a do-while loop, the action statement gets executed at least once even when the condition statement evaluates to false. For instance, the following example prints 1 to 5 numbers using do-while loop −|||On executing this code, you get the following result −|||As its name suggests, it is used to end the loop execution. Here is an example which ends the loop when the sum becomes greater than 50.|||On executing this code, you get the following result −|||The continue statement is used inside a loop to skip to the next iteration of the loop. It is useful when you wish to skip the processing of some data inside the loop. For instance, the following example uses continue statement to print the even numbers between 1 to 20.|||On executing this code, you get the following result −|||It is used to stop the execution of the script. It accepts an integer as an argument which is the exit status code for AWK process. If no argument is supplied, exit returns status zero. Here is an example that stops the execution when the sum becomes greater than 50.|||On executing this code, you get the following result −|||Let us check the return status of the script.|||On executing this code, you get the following result −",,,,"[jerry]$ awk 'BEGIN { for (i = 1; i <= 5; ++i) print i }'|||[jerry]$ awk 'BEGIN {i = 1; while (i < 6) { print i; ++i } }'|||[jerry]$ awk 'BEGIN {i = 1; do { print i; ++i } while (i < 6) }'|||[jerry]$ awk 'BEGIN {   sum = 0; for (i = 0; i < 20; ++i) {       sum += i; if (sum > 50) break; else print ""Sum ="", sum    } }'|||[jerry]$ awk 'BEGIN {   for (i = 1; i <= 20; ++i) {      if (i % 2 == 0) print i ; else continue   } }'|||[jerry]$ awk 'BEGIN {   sum = 0; for (i = 0; i < 20; ++i) {      sum += i; if (sum > 50) exit(10); else print ""Sum ="", sum    } }'|||[jerry]$ echo $?"
Learn Awk Programming,AWK - Built-in Functions,AWK - Built-in Functions,"AWK has a number of functions built into it that are always available to the programmer. This chapter describes Arithmetic, String, Time, Bit manipulation, and other miscellaneous functions with suitable examples.|||AWK has the following built-in arithmetic functions.|||AWK has the following built-in String functions.|||AWK has the following built-in time functions.|||AWK has the following built-in bit manipulation functions.|||AWK has the following miscellaneous functions.",,,"S.No.@@@Built in functions & Description|||1@@@Arithmetic Functions
AWK has the following built-in arithmetic functions.|||2@@@String Functions
AWK has the following built-in String functions.|||3@@@Time Functions
AWK has the following built-in time functions.|||4@@@Bit Manipulation Functions
AWK has the following built-in bit manipulation functions.|||5@@@Miscellaneous Functions
AWK has the following miscellaneous functions.",
Learn Awk Programming,AWK - User Defined Functions,AWK - User Defined Functions|||Syntax@@@Example@@@Output,"Functions are basic building blocks of a program. AWK allows us to define our own functions. A large program can be divided into functions and each function can be written/tested independently. It provides re-usability of code.|||Given below is the general format of a user-defined function −|||In this syntax, the function_name is the name of the user-defined function. Function name should begin with a letter and the rest of the characters can be any combination of numbers, alphabetic characters, or underscore. AWK's reserve words cannot be used as function names.|||Functions can accept multiple arguments separated by comma. Arguments are not mandatory. You can also create a user-defined function without any argument.|||function body consists of one or more AWK statements.|||Let us write two functions that calculate the minimum and the maximum number and call these functions from another function called main. The functions.awk file contains −|||On executing this code, you get the following result −",,,,"# Returns minimum numberfunction find_min(num1, num2){   if (num1 < num2)   return num1   return num2}# Returns maximum numberfunction find_max(num1, num2){   if (num1 > num2)   return num1   return num2}# Main functionfunction main(num1, num2){   # Find minimum number   result = find_min(10, 20)   print ""Minimum ="", result     # Find maximum number   result = find_max(10, 20)   print ""Maximum ="", result}# Script execution starts hereBEGIN {   main(10, 20)}"
Learn Awk Programming,AWK - Output Redirection,AWK - Output Redirection|||Redirection Operator@@@Append Operator@@@Pipe@@@Two way communication|||Syntax@@@Example@@@Output@@@Example@@@Output@@@Syntax@@@Example@@@Output@@@Example@@@Output@@@Syntax@@@Example@@@Output@@@Example@@@Output,"So far, we displayed data on standard output stream. We can also redirect data to a file. A redirection appears after the print or printf statement. Redirections in AWK are written just like redirection in shell commands, except that they are written inside the AWK program. This chapter explains redirection with suitable examples.|||The syntax of the redirection operator is −|||It writes the data into the output-file. If the output-file does not exist, then it creates one. When this type of redirection is used, the output-file is erased before the first output is written to it. Subsequent write operations to the same output-file do not erase the output-file, but append to it. For instance, the following example writes Hello, World !!! to the file.|||Let us create a file with some text data.|||On executing this code, you get the following result −|||Now let us redirect some contents into it using AWK's redirection operator.|||On executing this code, you get the following result −|||The syntax of append operator is as follows −|||It appends the data into the output-file. If the output-file does not exist, then it creates one. When this type of redirection is used, new contents are appended at the end of file. For instance, the following example appends Hello, World !!! to the file.|||Let us create a file with some text data.|||On executing this code, you get the following result −|||Now let us append some contents to it using AWK's append operator.|||On executing this code, you get the following result −|||It is possible to send output to another program through a pipe instead of using a file. This redirection opens a pipe to command, and writes the values of items through this pipe to another process to execute the command. The redirection argument command is actually an AWK expression. Here is the syntax of pipe −|||Let us use tr command to convert lowercase letters to uppercase.|||On executing this code, you get the following result −|||AWK can communicate to an external process using |&, which is two-way communication. For instance, the following example uses tr command to convert lowercase letters to uppercase. Our command.awk file contains −|||On executing this code, you get the following result −|||Does the script look cryptic? Let us demystify it.|||The first statement, cmd = ""tr [a-z] [A-Z]"", is the command to which we establish the two-way communication from AWK.|||The next statement, i.e., the print command provides input to the tr command. Here &| indicates two-way communication.|||The third statement, i.e., close(cmd, ""to""), closes the to process after competing its execution.|||The next statement cmd |& getline out stores the output into out variable with the aid of getline function.|||The next print statement prints the output and finally the close function closes the command.","The first statement, cmd = ""tr [a-z] [A-Z]"", is the command to which we establish the two-way communication from AWK.@@@The next statement, i.e., the print command provides input to the tr command. Here &| indicates two-way communication.@@@The third statement, i.e., close(cmd, ""to""), closes the to process after competing its execution.@@@The next statement cmd |& getline out stores the output into out variable with the aid of getline function.@@@The next print statement prints the output and finally the close function closes the command.",,,"[jerry]$ echo ""Old data"" > /tmp/message.txt[jerry]$ cat /tmp/message.txt|||[jerry]$ awk 'BEGIN { print ""Hello, World !!!"" > ""/tmp/message.txt"" }'[jerry]$ cat /tmp/message.txt|||[jerry]$ echo ""Old data"" > /tmp/message.txt [jerry]$ cat /tmp/message.txt|||[jerry]$ awk 'BEGIN { print ""Hello, World !!!"" >> ""/tmp/message.txt"" }'[jerry]$ cat /tmp/message.txt|||[jerry]$ awk 'BEGIN { print ""hello, world !!!"" | ""tr [a-z] [A-Z]"" }'|||BEGIN {   cmd = ""tr [a-z] [A-Z]""   print ""hello, world !!!"" |& cmd   close(cmd, ""to"")      cmd |& getline out   print out;   close(cmd);}"
Learn Awk Programming,AWK - Pretty Printing,AWK - Pretty Printing|||Escape Sequences@@@Format Specifier@@@Optional Parameters with %|||Syntax@@@New Line@@@Horizontal Tab@@@Vertical Tab@@@Backspace@@@Carriage Return@@@Form Feed@@@%c@@@%d and %i@@@%e and %E@@@%f@@@%g and %G@@@%o@@@%u@@@%s@@@%x and %X@@@%%@@@Width@@@Leading Zeros@@@Left Justification@@@Prefix Sign@@@Hash,"So far we have used AWK's print and printf functions to display data on standard output. But printf is much more powerful than what we have seen before. This function is borrowed from the C language and is very helpful while producing formatted output. Below is the syntax of the printf statement −|||In the above syntax fmt is a string of format specifications and constants. expr-list is a list of arguments corresponding to format specifiers.|||Similar to any string, format can contain embedded escape sequences. Discussed below are the escape sequences supported by AWK −|||The following example prints Hello and World in separate lines using newline character −|||Example|||On executing this code, you get the following result −|||Output|||The following example uses horizontal tab to display different field −|||Example|||On executing the above code, you get the following result −|||Output|||The following example uses vertical tab after each filed −|||Example|||On executing this code, you get the following result −|||Output|||The following example prints a backspace after every field except the last one. It erases the last number from the first three fields. For instance, Field 1 is displayed as Field, because the last character is erased with backspace. However, the last field Field 4 is displayed as it is, as we did not have a \b after Field 4.|||Example|||On executing this code, you get the following result −|||Output|||In the following example, after printing every field, we do a Carriage Return and print the next value on top of the current printed value. It means, in the final output, you can see only Field 4, as it was the last thing to be printed on top of all the previous fields.|||Example|||On executing this code, you get the following result −|||Output|||The following example uses form feed after printing each field.|||Example|||On executing this code, you get the following result −|||Output|||As in C-language, AWK also has format specifiers. The AWK version of the printf statement accepts the following conversion specification formats −|||It prints a single character. If the argument used for %c is numeric, it is treated as a character and printed. Otherwise, the argument is assumed to be a string, and the only first character of that string is printed.|||Example|||Output|||On executing this code, you get the following result −|||It prints only the integer part of a decimal number.|||Example|||On executing this code, you get the following result −|||Output|||It prints a floating point number of the form [-]d.dddddde[+-]dd.|||Example|||On executing this code, you get the following result −|||Output|||The %E format uses E instead of e.|||Example|||On executing this code, you get the following result −|||Output|||It prints a floating point number of the form [-]ddd.dddddd.|||Example|||On executing this code, you get the following result −|||Output|||Uses %e or %f conversion, whichever is shorter, with non-significant zeros suppressed.|||Example|||Output|||On executing this code, you get the following result −|||The %G format uses %E instead of %e.|||Example|||On executing this code, you get the following result −|||Output|||It prints an unsigned octal number.|||Example|||On executing this code, you get the following result −|||Output|||It prints an unsigned decimal number.|||Example|||On executing this code, you get the following result −|||Output|||It prints a character string.|||Example|||On executing this code, you get the following result −|||Output|||It prints an unsigned hexadecimal number. The %X format uses uppercase letters instead of lowercase.|||Example|||On executing this code, you get the following result −|||Output|||Now let use %X and observe the result −|||Example|||On executing this code, you get the following result −|||Output|||It prints a single % character and no argument is converted.|||Example|||On executing this code, you get the following result −|||Output|||With % we can use following optional parameters −|||The field is padded to the width. By default, the field is padded with spaces but when 0 flag is used, it is padded with zeroes.|||Example|||On executing this code, you get the following result −|||Output|||A leading zero acts as a flag, which indicates that the output should be padded with zeroes instead of spaces. Please note that this flag only has an effect when the field is wider than the value to be printed. The following example describes this −|||Example|||On executing this code, you get the following result −|||Output|||The expression should be left-justified within its field. When the input-string is less than the number of characters specified, and you want it to be left justified, i.e., by adding spaces to the right, use a minus symbol (–) immediately after the % and before the number.|||In the following example, output of the AWK command is piped to the cat command to display the END OF LINE($) character.|||Example|||On executing this code, you get the following result −|||Output|||It always prefixes numeric values with a sign, even if the value is positive.|||Example|||On executing this code, you get the following result −|||Output|||For %o, it supplies a leading zero. For %x and %X, it supplies a leading 0x or 0X respectively, only if the result is non-zero. For %e, %E, %f, and %F, the result always contains a decimal point. For %g and %G, trailing zeros are not removed from the result. The following example describes this −|||Example|||On executing this code, you get the following result −|||Output",,,,"[jerry]$ awk 'BEGIN { printf ""Hello\nWorld\n"" }'|||[jerry]$ awk 'BEGIN { printf ""Sr No\tName\tSub\tMarks\n"" }'|||[jerry]$ awk 'BEGIN { printf ""Sr No\vName\vSub\vMarks\n"" }'|||[jerry]$ awk 'BEGIN { printf ""Field 1\bField 2\bField 3\bField 4\n"" }'|||[jerry]$ awk 'BEGIN { printf ""Field 1\rField 2\rField 3\rField 4\n"" }'|||[jerry]$ awk 'BEGIN { printf ""Sr No\fName\fSub\fMarks\n"" }'|||[jerry]$ awk 'BEGIN { printf ""ASCII value 65 = character %c\n"", 65 }'|||[jerry]$ awk 'BEGIN { printf ""Percentags = %d\n"", 80.66 }'|||[jerry]$ awk 'BEGIN { printf ""Percentags = %E\n"", 80.66 }'|||[jerry]$ awk 'BEGIN { printf ""Percentags = %e\n"", 80.66 }'|||[jerry]$ awk 'BEGIN { printf ""Percentags = %f\n"", 80.66 }'|||[jerry]$ awk 'BEGIN { printf ""Percentags = %g\n"", 80.66 }'|||[jerry]$ awk 'BEGIN { printf ""Percentags = %G\n"", 80.66 }'|||[jerry]$ awk 'BEGIN { printf ""Octal representation of decimal number 10 = %o\n"", 10}'|||[jerry]$ awk 'BEGIN { printf ""Unsigned 10 = %u\n"", 10 }'|||[jerry]$ awk 'BEGIN { printf ""Name = %s\n"", ""Sherlock Holmes"" }'|||[jerry]$ awk 'BEGIN {    printf ""Hexadecimal representation of decimal number 15 = %x\n"", 15}'|||[jerry]$ awk 'BEGIN {    printf ""Hexadecimal representation of decimal number 15 = %X\n"", 15}'|||[jerry]$ awk 'BEGIN { printf ""Percentags = %d%%\n"", 80.66 }'|||[jerry]$ awk 'BEGIN {    num1 = 10; num2 = 20; printf ""Num1 = %10d\nNum2 = %10d\n"", num1, num2 }'|||[jerry]$ awk 'BEGIN {    num1 = -10; num2 = 20; printf ""Num1 = %05d\nNum2 = %05d\n"", num1, num2 }'|||[jerry]$ awk 'BEGIN { num = 10; printf ""Num = %-5d\n"", num }' | cat -vte|||[jerry]$ awk 'BEGIN {    num1 = -10; num2 = 20; printf ""Num1 = %+d\nNum2 = %+d\n"", num1, num2 }'|||[jerry]$ awk 'BEGIN {    printf ""Octal representation = %#o\nHexadecimal representaion = %#X\n"", 10, 10}'"
