Course,Chapters,ALL Headings,Paragraphs,Unordered List Items,Ordered List Items,Tables,Code Examples
Learn Apex Programming,Apex - SOSL,Apex - SOSL|||SOSL@@@SOQL@@@Useful Video Courses|||SOSL Query Example|||Oracle Apex - Web App Development@@@Oracle Application Express APEX 20.1 Administration Training@@@Salesforce Apex Programming tutorial with practise exam,"Every business or application has search functionality as one of the basic requirements. For this, Salesforce.com provides two major approaches using SOSL and SOQL. Let us discuss the SOSL approach in detail in this chapter.|||Searching the text string across the object and across the field will be done by using SOSL. This is Salesforce Object Search Language. It has the capability of searching a particular string across multiple objects.|||SOSL statements evaluate to a list of sObjects, wherein, each list contains the search results for a particular sObject type. The result lists are always returned in the same order as they were specified in the SOSL query.|||Consider a business case wherein, we need to develop a program which can search a specified string. Suppose, we need to search for string 'ABC' in the Customer Name field of Invoice object. The code goes as follows −|||First, you have to create a single record in Invoice object with Customer name as 'ABC' so that we can get valid result when searched.|||This is almost the same as SOQL. You can use this to fetch the object records from one object only at a time. You can write nested queries and also fetch the records from parent or child object on which you are querying now.|||We will explore SOQL in the next chapter.",,,,"// Program To Search the given string in all Object// List to hold the returned results of sObject generic typeList<list<SObject>> invoiceSearchList = new List<List<SObject>>();// SOSL query which will search for 'ABC' string in Customer Name field of Invoice ObjectinvoiceSearchList = [FIND 'ABC*' IN ALL FIELDS RETURNING APEX_Invoice_c   (Id,APEX_Customer_r.Name)];// Returned result will be printedSystem.debug('Search Result '+invoiceSearchList);// Now suppose, you would like to search string 'ABC' in two objects,// that is Invoice and Account. Then for this query goes like this:// Program To Search the given string in Invoice and Account object,// you could specify more objects if you want, create an Account with Name as ABC.// List to hold the returned results of sObject generic typeList<List<SObject>> invoiceAndSearchList = new List<List<SObject>>();// SOSL query which will search for 'ABC' string in Invoice and in Account object's fieldsinvoiceAndSearchList = [FIND 'ABC*' IN ALL FIELDS RETURNING APEX_Invoice__c   (Id,APEX_Customer__r.Name), Account];// Returned result will be printedSystem.debug('Search Result '+invoiceAndSearchList);// This list will hold the returned results for Invoice ObjectAPEX_Invoice__c [] searchedInvoice = ((List<APEX_Invoice_c>)invoiceAndSearchList[0]);// This list will hold the returned results for Account ObjectAccount [] searchedAccount = ((List<Account>)invoiceAndSearchList[1]);System.debug('Value of searchedInvoice'+searchedInvoice+'Value of searchedAccount'   + searchedAccount);"
Learn Apex Programming,Apex - SOQL,Apex - SOQL|||SOQL Example@@@Traversing Relationship Fields@@@Fetching Child Records@@@Fetching Parent Record@@@Aggregate Functions@@@Binding Apex Variables@@@Useful Video Courses|||Example@@@Example@@@Example@@@Example|||Oracle Apex - Web App Development@@@Oracle Application Express APEX 20.1 Administration Training@@@Salesforce Apex Programming tutorial with practise exam,"This is Salesforce Object Query Language designed to work with SFDC Database. It can search a record on a given criterion only in single sObject.|||Like SOSL, it cannot search across multiple objects but it does support nested queries.|||Consider our ongoing example of Chemical Company. Suppose, we need a list of records which are created today and whose customer name is not 'test'. In this case, we will have to use the SOQL query as given below −|||You can run the SOQL query via the Query Editor in the Developer console as shown below.|||Run the query given below in the Developer Console. Search for the Invoice records created today.|||You must select the fields for which you need the values, otherwise, it can throw run time errors.|||This is one of the most important parts in SFDC as many times we need to traverse through the parent child object relationship|||Also, there may be cases when you need to insert two associated objects records in Database. For example, Invoice object has relationship with the Customer object and hence one Customer can have many invoices.|||Suppose, you are creating the invoice and then you need to relate this invoice to Customer. You can use the following code for this functionality −|||Execute this code snippet in the Developer Console. Once executed, copy the Id of invoice from the Developer console and then open the same in SFDC as shown below. You can see that the Parent record has already been assigned to Invoice record as shown below.|||Let us now consider an example wherein, all the invoices related to particular customer record need to be in one place. For this, you must know the child relationship name. To see the child relationship name, go to the field detail page on the child object and check the ""Child Relationship"" value. In our example, it is invoices appended by __r at the end.|||In this example, we will need to set up data, create a customer with name as 'ABC Customer' record and then add 3 invoices to that customer.|||Now, we will fetch the invoices the Customer 'ABC Customer' has. Following is the query for the same −|||You can see the Record values in the Debug logs.|||Suppose, you need to fetch the Customer Name of Invoice the creation date of which is today, then you can use the query given below for the same −|||Fetch the Parent record's value along with the child object.|||Here we have used the notation APEX_Customer__r.Name, where APEX_Customer__r is parent relationship name, here you have to append the __r at the end of the Parent field and then you can fetch the parent field value.|||SOQL does have aggregate function as we have in SQL. Aggregate functions allow us to roll up and summarize the data. Let us now understand the function in detail.|||Suppose, you wanted to know that what is the average revenue we are getting from Customer 'ABC Customer', then you can use this function to take up the average.|||Check the output in Debug logs. Note that any query that includes an aggregate function returns its results in an array of AggregateResult objects. AggregateResult is a readonly sObject and is only used for query results. It is useful when we need to generate the Report on Large data.|||There are other aggregate functions as well which you can be used to perform data
summary.|||MIN() − This can be used to find the minimum value|||MAX() − This can be used to find the maximum value.|||You can use the Apex variable in SOQL query to fetch the desired results. Apex variables
can be referenced by the Colon (:) notation.",,,,"// fetching the Records via SOQLList<apex_invoice__c> InvoiceList = new List<apex_invoice__c>();InvoiceList = [SELECT Id, Name, APEX_Customer__r.Name, APEX_Status__c FROM   APEX_Invoice__c WHERE createdDate = today AND APEX_Customer__r.Name != 'Test'];// SOQL query for given criteria// Printing the fetched recordsSystem.debug('We have total '+InvoiceList.size()+' Records in List');for (APEX_Invoice__c objInvoice: InvoiceList) {   System.debug('Record Value is '+objInvoice);    // Printing the Record fetched}|||SELECT Id, Name, APEX_Customer__r.Name, APEX_Status__c FROM APEX_Invoice__c   WHERE createdDate = today|||// Now create the invoice record and relate it with the Customer object// Before executing this, please create a Customer Records with Name 'Customer// Creation Test'APEX_Invoice__c objInvoice = new APEX_Invoice__c();// Relating Invoice to customer via id field of Customer objectobjInvoice.APEX_Customer__c = [SELECT id FROM APEX_Customer__c WHERE Name =   'Customer Creation Test' LIMIT 1].id;objInvoice.APEX_Status__c = 'Pending';insert objInvoice;  //Creating InvoiceSystem.debug('Newly Created Invoice'+objInvoice);  //Newly created invoice|||// Fetching Child Records using SOQLList<apex_customer__c> ListCustomers = [SELECT Name, Id,    (SELECT id, Name FROM Invoices__r) FROM APEX_Customer__c WHERE Name = 'ABC Customer'];// Query for fetching the Child records along with ParentSystem.debug('ListCustomers '+ListCustomers); // Parent RecordList<apex_invoice__c> ListOfInvoices = ListCustomers[0].Invoices__r;// By this notation, you could fetch the child records and save it in ListSystem.debug('ListOfInvoices values of Child '+ListOfInvoices);// Child records|||// Fetching Parent Record Field value using SOQLList<apex_invoice__c> ListOfInvoicesWithCustomerName = new List<apex_invoice__c>();ListOfInvoicesWithCustomerName = [SELECT Name, id, APEX_Customer__r.Name    FROM APEX_Invoice__c LIMIT 10];// Fetching the Parent record's valuesfor (APEX_Invoice__c objInv: ListOfInvoicesWithCustomerName) {   System.debug('Invoice Customer Name is '+objInv.APEX_Customer__r.Name);   // Will print the values, all the Customer Records will be printed}|||// Getting Average of all the invoices for a Perticular CustomerAggregateResult[] groupedResults = [SELECT   AVG(APEX_Amount_Paid__c)averageAmount FROM APEX_Invoice__c WHERE   APEX_Customer__r.Name = 'ABC Customer'];Object avgPaidAmount = groupedResults[0].get('averageAmount');System.debug('Total Average Amount Received From Customer ABC is '+avgPaidAmount);|||// Apex Variable ReferenceString CustomerName = 'ABC Customer';List<apex_customer__c> ListCustomer = [SELECT Id, Name FROM APEX_Customer__c   WHERE Name = :CustomerName];// Query Using Apex variableSystem.debug('ListCustomer Name'+ListCustomer); // Customer Name"
Learn Apex Programming,Apex - Security,Apex - Security|||Data Security and Sharing Rules@@@With Sharing Keyword@@@Without Sharing Keyword@@@Setting Security for Apex Class@@@Useful Video Courses|||Setting Apex class security from the class list page@@@Setting Apex Security from Permission Set|||Oracle Apex - Web App Development@@@Oracle Application Express APEX 20.1 Administration Training@@@Salesforce Apex Programming tutorial with practise exam,"Apex security refers to the process of applying security settings and enforcing the sharing rules on running code. Apex classes have security setting that can be controlled via two keywords.|||Apex generally runs in system context, that is, the current user's permissions. Field-level security, and sharing rules are not taken into account during code execution. Only the anonymous block code executes with the permission of the user who is executing the code.|||Our Apex code should not expose the sensitive data to User which is hidden via security and sharing settings. Hence, Apex security and enforcing the sharing rule is most important.|||If you use this keyword, then the Apex code will enforce the Sharing settings of current user to Apex code. This does not enforce the Profile permission, only the data level sharing settings.|||Let us consider an example wherein, our User has access to 5 records, but the total number of records is 10. So when the Apex class will be declared with the ""With Sharing"" Keyword, it will return only 5 records on which the user has access to.|||Example|||First, make sure that you have created at least 10 records in the Customer object with 'Name' of 5 records as 'ABC Customer' and rest 5 records as 'XYZ Customer'. Then, create a sharing rule which will share the 'ABC Customer' with all Users. We also need to make sure that we have set the OWD of Customer object as Private.|||Paste the code given below to Anonymous block in the Developer Console.|||As the name suggests, class declared with this keyword executes in System mode, i.e., irrespective of the User's access to the record, query will fetch all the records.|||You can enable or disable an Apex class for particular profile. The steps for the same are given below. You can determine which profile should have access to which class.|||Step 1 − From Setup, click Develop → Apex Classes.|||Step 2 − Click the name of the class that you want to restrict. We have clicked on CustomerOperationClass.|||Step 3 − Click on Security.|||Step 4 − Select the profiles that you want to enable from the Available Profiles list and click Add, or select the profiles that you want to disable from the Enabled Profiles list and click on Remove.|||Step 5 − Click on Save.|||Step 1 − From Setup, click Manage Users → Permission Sets.|||Step 2 − Select a permission set.|||Step 3 − Click on Apex Class Access.|||Step 4 − Click on Edit.|||Step 5 − Select the Apex classes that you want to enable from the Available Apex Classes list and click Add, or select the Apex classes that you want to disable from the Enabled Apex Classes list and click remove.|||Step 6 − Click the Save button.",,,,"// Class With Sharingpublic with sharing class MyClassWithSharing {   // Query To fetch 10 records   List<apex_customer__c> CustomerList = [SELECT id, Name FROM APEX_Customer__c LIMIT 10];      public Integer executeQuery () {      System.debug('List will have only 5 records and the actual records are'          + CustomerList.size()+' as user has access to'+CustomerList);      Integer ListSize = CustomerList.size();      return ListSize;   }}// Save the above class and then execute as below// Execute class using the object of classMyClassWithSharing obj = new MyClassWithSharing();Integer ListSize = obj.executeQuery();|||// Class Without Sharingpublic without sharing class MyClassWithoutSharing {   List<apex_customer__c> CustomerList = [SELECT id, Name FROM APEX_Customer__c LIMIT 10];      // Query To fetch 10 records, this will return all the records   public Integer executeQuery () {      System.debug('List will have only 5 records and the actula records are'         + CustomerList.size()+' as user has access to'+CustomerList);      Integer ListSize = CustomerList.size();      return ListSize;   }}// Output will be 10 records."
Learn Apex Programming,Apex - Invoking,Apex - Invoking|||From Execute Anonymous Block@@@From Trigger@@@From Visualforce Page Controller Code@@@Useful Video Courses|||Example@@@Example|||Oracle Apex - Web App Development@@@Oracle Application Express APEX 20.1 Administration Training@@@Salesforce Apex Programming tutorial with practise exam,"Apex invoking refers to the process of executing the Apex class. Apex class can only be executed when it is invoked via one of the ways listed below −|||Triggers and Anonymous block|||A trigger invoked for specified events|||Asynchronous Apex|||Scheduling an Apex class to run at specified intervals, or running a batch job|||Web Services class|||Apex Email Service class|||Apex Web Services, which allow exposing your methods via SOAP and REST Web services|||Visualforce Controllers|||Apex Email Service to process inbound email|||Invoking Apex Using JavaScript|||The Ajax toolkit to invoke Web service methods implemented in Apex|||We will now understand a few common ways to invoke Apex.|||You can invoke the Apex class via execute anonymous in the Developer Console as shown below −|||Step 1 − Open the Developer Console.|||Step 2 − Click on Debug.|||Step 3 − Execute anonymous window will open as shown below. Now, click on the Execute
button −|||Step 4 − Open the Debug Log when it will appear in the Logs pane.|||You can call an Apex class from Trigger as well. Triggers are called when a specified event occurs and triggers can call the Apex class when executing.|||Following is the sample code that shows how a class gets executed when a Trigger is called.|||Apex class can be called from the Visualforce page as well. We can specify the controller or the controller extension and the specified Apex class gets called.|||VF Page Code|||Apex Class Code (Controller Extension)","Triggers and Anonymous block@@@A trigger invoked for specified events@@@Asynchronous Apex@@@Scheduling an Apex class to run at specified intervals, or running a batch job@@@Web Services class@@@Apex Email Service class@@@Apex Web Services, which allow exposing your methods via SOAP and REST Web services@@@Visualforce Controllers@@@Apex Email Service to process inbound email@@@Invoking Apex Using JavaScript@@@The Ajax toolkit to invoke Web service methods implemented in Apex",,,"// Class which will gets called from triggerpublic without sharing class MyClassWithSharingTrigger {   public static Integer executeQuery (List<apex_customer__c> CustomerList) {      // perform some logic and operations here      Integer ListSize = CustomerList.size();      return ListSize;   }}// Trigger Codetrigger Customer_After_Insert_Example on APEX_Customer__c (after insert) {   System.debug('Trigger is Called and it will call Apex Class');   MyClassWithSharingTrigger.executeQuery(Trigger.new);  // Calling Apex class and                                                          // method of an Apex class}// This example is for reference, no need to execute and will have detail look on // triggers later chapters."
Learn Apex Programming,Apex - Triggers,Apex - Triggers|||Executing the Trigger@@@Trigger Example 1@@@Trigger Example 2@@@Useful Video Courses|||Syntax@@@Explanation@@@Explanation|||Oracle Apex - Web App Development@@@Oracle Application Express APEX 20.1 Administration Training@@@Salesforce Apex Programming tutorial with practise exam,"Apex triggers are like stored procedures which execute when a particular event occurs. A trigger executes before and after an event occurs on record.|||Following are the events on which we can fir the trigger −|||Suppose we received a business requirement that we need to create an Invoice Record when Customer's 'Customer Status' field changes to Active from Inactive. For this, we will create a trigger on APEX_Customer__c object by following these steps −|||Step 1 − Go to sObject|||Step 2 − Click on Customer|||Step 3 − Click on 'New' button in the Trigger related list and add the trigger code as give below.|||Trigger.new − This is the context variable which stores the records currently in the trigger context, either being inserted or updated. In this case, this variable has Customer object's records which have been updated.|||There are other context variables which are available in the context – trigger.old, trigger.newMap, trigger.OldMap.|||The above trigger will execute when there is an update operation on the Customer records. Suppose, the invoice record needs to be inserted only when the Customer Status changes from Inactive to Active and not every time; for this, we can use another context variable trigger.oldMap which will store the key as record id and the value as old record values.|||We have used the Trigger.oldMap variable which as explained earlier, is a context variable which stores the Id and old value of records which are being updated.",insert@@@update@@@delete@@@merge@@@upsert@@@undelete,,,// Trigger Codetrigger Customer_After_Insert on APEX_Customer__c (after update) {   List InvoiceList = new List();      for (APEX_Customer__c objCustomer: Trigger.new) {            if (objCustomer.APEX_Customer_Status__c == 'Active') {         APEX_Invoice__c objInvoice = new APEX_Invoice__c();         objInvoice.APEX_Status__c = 'Pending';         InvoiceList.add(objInvoice);      }   }      // DML to insert the Invoice List in SFDC   insert InvoiceList;}|||// Modified Trigger Codetrigger Customer_After_Insert on APEX_Customer__c (after update) {   List<apex_invoice__c> InvoiceList = new List<apex_invoice__c>();      for (APEX_Customer__c objCustomer: Trigger.new) {            // condition to check the old value and new value      if (objCustomer.APEX_Customer_Status__c == 'Active' &&            trigger.oldMap.get(objCustomer.id).APEX_Customer_Status__c == 'Inactive') {         APEX_Invoice__c objInvoice = new APEX_Invoice__c();         objInvoice.APEX_Status__c = 'Pending';         InvoiceList.add(objInvoice);      }   }      // DML to insert the Invoice List in SFDC   insert InvoiceList;}
Learn Apex Programming,Apex - Trigger Design Patterns,Apex - Trigger Design Patterns|||Bulk Triggers Design Patterns@@@Trigger Helper Class@@@Single Trigger on Each sObject@@@Useful Video Courses|||Helper Class|||Oracle Apex - Web App Development@@@Oracle Application Express APEX 20.1 Administration Training@@@Salesforce Apex Programming tutorial with practise exam,"Design patterns are used to make our code more efficient and to avoid hitting the governor limits. Often developers can write inefficient code that can cause repeated instantiation of objects. This can result in inefficient, poorly performing code, and potentially the breaching of governor limits. This most commonly occurs in triggers, as they can operate against a set of records.|||We will see some important design pattern strategies in this chapter.|||In real business case, it will be possible that you may need to process thousands of records in one go. If your trigger is not designed to handle such situations, then it may fail while
