Course,Chapters,ALL Headings,Paragraphs,Unordered List Items,Ordered List Items,Tables,Code Examples
","import std.stdio;  void main() {    int n[ 10 ]; // n is an array of 10 integers        // initialize elements of array n to 0    for ( int i = 0; i < 10; i++ ) {       n[ i ] = i + 100; // set element at location i to i + 100    }      writeln(""Element \t Value"");      // output each array element's value    for ( int j = 0; j < 10; j++ ) {       writeln(j,"" \t "",n[j]);    } }|||import std.stdio;void main() {   int n[ 5 ]; // n is an array of 5 integers       // initialize elements of array n to 0    for ( int i = 0; i < 5; i++ ) {       n[ i ] = i + 100; // set element at location i to i + 100    }      writeln(""Initialized value:"",n.init);       writeln(""Length: "",n.length);    writeln(""Size of: "",n.sizeof);    writeln(""Pointer:"",n.ptr);       writeln(""Duplicate Array: "",n.dup);    writeln(""iDuplicate Array: "",n.idup);      n = n.reverse.dup;    writeln(""Reversed Array: "",n);      writeln(""Sorted Array: "",n.sort); }|||int a[3][4] = [      [0, 1, 2, 3] ,   /*  initializers for row indexed by 0 */    [4, 5, 6, 7] ,   /*  initializers for row indexed by 1 */    [8, 9, 10, 11]   /*  initializers for row indexed by 2 */ ];|||import std.stdio;   void main () {    // an array with 5 rows and 2 columns.    int a[5][2] = [ [0,0], [1,2], [2,4], [3,6],[4,8]];        // output each array element's value                          for ( int i = 0; i < 5; i++ ) for ( int j = 0; j < 2; j++ ) {      writeln( ""a["" , i , ""]["" , j , ""]: "",a[i][j]);    }}|||import std.stdio;  void main () {    // an array with 5 elements.    double a[5] = [1000.0, 2.0, 3.4, 17.0, 50.0];    double[] b;      b = a[1..3];    writeln(b); }|||import std.stdio;void main () {    // an array with 5 elements.    double a[5] = [1000.0, 2.0, 3.4, 17.0, 50.0];    double b[5];    writeln(""Array a:"",a);    writeln(""Array b:"",b);        b[] = a;      // the 5 elements of a[5] are copied into b[5]    writeln(""Array b:"",b);        b[] = a[];   // the 5 elements of a[3] are copied into b[5]    writeln(""Array b:"",b);       b[1..2] = a[0..1]; // same as b[1] = a[0]    writeln(""Array b:"",b);       b[0..2] = a[1..3]; // same as b[0] = a[1], b[1] = a[2]   writeln(""Array b:"",b); }|||import std.stdio;void main () {    // an array with 5 elements.    double a[5];    a[] = 5;    writeln(""Array a:"",a); }|||import std.stdio;void main () {    // an array with 5 elements.    double a[5] = 5;    double b[5] = 10;    double [] c;    c = a~b;    writeln(""Array c: "",c); }"
Learn D Programming,D Programming - Associative Arrays,D Programming - Associative Arrays|||Initializing Associative Array@@@Properties of Associative Array@@@Useful Video Courses|||Example|||DB2 Online Training@@@Azure Data Lake Online Training@@@Android Online Training@@@Android Penetration Testing Online Training @@@Agile Methodology@@@3D Animation Online Training,"Associative arrays have an index that is not necessarily an integer, and can be sparsely populated. The index for an associative array is called the Key, and its type is called the KeyType.|||Associative arrays are declared by placing the KeyType within the [ ] of an array declaration. A simple example for associative array is shown below.|||When the above code is compiled and executed, it produces the following result −|||A simple initialization of associative array is shown below.|||When the above code is compiled and executed, it produces the following result −|||Here are the properties of an associative array −|||.sizeof|||Returns the size of the reference to the associative array; it is 4 in 32-bit builds and 8 on 64-bit builds.|||.length|||Returns number of values in the associative array. Unlike for dynamic arrays, it is read-only.|||.dup|||Create a new associative array of the same size and copy the contents of the associative array into it.|||.keys|||Returns dynamic array, the elements of which are the keys in the associative array.|||.values|||Returns dynamic array, the elements of which are the values in the associative array.|||.rehash|||Reorganizes the associative array in place so that lookups are more efficient. rehash is effective when, for example, the program is done loading up a symbol table and now needs fast lookups in it. Returns a reference to the reorganized array.|||.byKey()|||Returns a delegate suitable for use as an Aggregate to a ForeachStatement which will iterate over the keys of the associative array.|||.byValue()|||Returns a delegate suitable for use as an Aggregate to a ForeachStatement which will iterate over the values of the associative array.|||.get(Key key, lazy Value defVal)|||Looks up key; if it exists returns corresponding value else evaluates and returns defVal.|||.remove(Key key)|||Removes an object for key.|||An example for using the above properties is shown below.|||When the above code is compiled and executed, it produces the following result −",,,"Sr.No.@@@Property & Description|||1@@@.sizeof
Returns the size of the reference to the associative array; it is 4 in 32-bit builds and 8 on 64-bit builds.|||2@@@.length
Returns number of values in the associative array. Unlike for dynamic arrays, it is read-only.|||3@@@.dup
Create a new associative array of the same size and copy the contents of the associative array into it.|||4@@@.keys
Returns dynamic array, the elements of which are the keys in the associative array.|||5@@@.values
Returns dynamic array, the elements of which are the values in the associative array.|||6@@@.rehash
Reorganizes the associative array in place so that lookups are more efficient. rehash is effective when, for example, the program is done loading up a symbol table and now needs fast lookups in it. Returns a reference to the reorganized array.|||7@@@.byKey()
Returns a delegate suitable for use as an Aggregate to a ForeachStatement which will iterate over the keys of the associative array.|||8@@@.byValue()
Returns a delegate suitable for use as an Aggregate to a ForeachStatement which will iterate over the values of the associative array.|||9@@@.get(Key key, lazy Value defVal)
Looks up key; if it exists returns corresponding value else evaluates and returns defVal.|||10@@@.remove(Key key)
Removes an object for key.","import std.stdio;void main () {    int[string] e;      // associative array b of ints that are        e[""test""] = 3;    writeln(e[""test""]);       string[string] f;       f[""test""] = ""Tuts"";    writeln(f[""test""]);       writeln(f);        f.remove(""test"");    writeln(f); }|||import std.stdio;void main () {    int[string] days =       [ ""Monday"" : 0,          ""Tuesday"" : 1,          ""Wednesday"" : 2,          ""Thursday"" : 3,          ""Friday"" : 4,          ""Saturday"" : 5,          ""Sunday"" : 6 ];    writeln(days[""Tuesday""]);    }|||import std.stdio;void main () {    int[string] array1;   array1[""test""] = 3;    array1[""test2""] = 20;       writeln(""sizeof: "",array1.sizeof);    writeln(""length: "",array1.length);    writeln(""dup: "",array1.dup);     array1.rehash;       writeln(""rehashed: "",array1);     writeln(""keys: "",array1.keys);    writeln(""values: "",array1.values);      foreach (key; array1.byKey) {       writeln(""by key: "",key);    }   foreach (value; array1.byValue) {       writeln(""by value "",value);    }   writeln(""get value for key test: "",array1.get(""test"",10));    writeln(""get value for key test3: "",array1.get(""test3"",10));     array1.remove(""test"");    writeln(array1); } "
Learn D Programming,D Programming - Pointers,D Programming - Pointers|||What Are Pointers?@@@Using Pointers in D programming@@@Null Pointers@@@Pointer Arithmetic@@@Incrementing a Pointer@@@Pointers vs Array@@@Pointer to Pointer@@@Passing Pointer to Functions@@@Return Pointer from Functions@@@Pointer to an Array@@@Useful Video Courses|||DB2 Online Training@@@Azure Data Lake Online Training@@@Android Online Training@@@Android Penetration Testing Online Training @@@Agile Methodology@@@3D Animation Online Training,"D programming pointers are easy and fun to learn. Some D programming tasks are performed more easily with pointers, and other D programming tasks, such as dynamic memory allocation, cannot be performed without them. A simple pointer is shown below.|||Instead of directly pointing to the variable, pointer points to the address of the variable. As you know every variable is a memory location and every memory location has its address defined which can be accessed using ampersand (&) operator which denotes an address in memory. Consider the following which prints the address of the variables defined −|||When the above code is compiled and executed, it produces the following result −|||A pointer is a variable whose value is the address of another variable. Like any variable or constant, you must declare a pointer before you can work with it. The general form of a pointer variable declaration is −|||Here, type is the pointer's base type; it must be a valid programming type and var-name is the name of the pointer variable. The asterisk you used to declare a pointer is the same asterisk that you use for multiplication. However; in this statement the asterisk is being used to designate a variable as a pointer. Following are the valid pointer declaration −|||The actual data type of the value of all pointers, whether integer, float, character, or otherwise, is the same, a long hexadecimal number that represents a memory address. The only difference between pointers of different data types is the data type of the variable or constant that the pointer points to.|||There are few important operations, when we use the pointers very frequently.|||we define a pointer variables|||assign the address of a variable to a pointer|||finally access the value at the address available in the pointer variable.|||This is done by using unary operator * that returns the value of the variable located at the address specified by its operand. The following example makes use of these operations −|||When the above code is compiled and executed, it produces the following result −|||It is always a good practice to assign the pointer NULL to a pointer variable in case you do not have exact address to be assigned. This is done at the time of variable declaration. A pointer that is assigned null is called a null pointer.|||The null pointer is a constant with a value of zero defined in several standard libraries, including iostream. Consider the following program −|||When the above code is compiled and executed, it produces the following result −|||On most of the operating systems, programs are not permitted to access memory at address 0 because that memory is reserved by the operating system. However; the memory address 0 has special significance; it signals that the pointer is not intended to point to an accessible memory location.|||By convention, if a pointer contains the null (zero) value, it is assumed to point to nothing. To check for a null pointer you can use an if statement as follows −|||Thus, if all unused pointers are given the null value and you avoid the use of a null pointer, you can avoid the accidental misuse of an uninitialized pointer. Many times, uninitialized variables hold some junk values and it becomes difficult to debug the program.|||There are four arithmetic operators that can be used on pointers: ++, --, +, and -|||To understand pointer arithmetic, let us consider an integer pointer named ptr, which points to the address 1000. Assuming 32-bit integers, let us perform the following arithmatic operation on the pointer −|||then the ptr will point to the location 1004 because each time ptr is incremented, it points to the next integer. This operation will move the pointer to next memory location without impacting the actual value at the memory location.|||If ptr points to a character whose address is 1000, then the above operation points to the location 1001 because next character will be available at 1001.|||We prefer using a pointer in our program instead of an array because the variable pointer can be incremented, unlike the array name which cannot be incremented because it is a constant pointer. The following program increments the variable pointer to access each succeeding element of the array −|||When the above code is compiled and executed, it produces the following result −|||Pointers and arrays are strongly related. However, pointers and arrays are not completely interchangeable. For example, consider the following program −|||In the above program, you can see var.ptr[2] to set the second element and ptr[0] which is used to set the zeroth element. Increment operator can be used with ptr but not with var.|||When the above code is compiled and executed, it produces the following result −|||A pointer to a pointer is a form of multiple indirection or a chain of pointers. Normally, a pointer contains the address of a variable. When we define a pointer to a pointer, the first pointer contains the address of the second pointer, which points to the location that contains the actual value as shown below.|||A variable that is a pointer to a pointer must be declared as such. This is done by placing an additional asterisk in front of its name. For example, following is the syntax to declare a pointer to a pointer of type int −|||When a target value is indirectly pointed to by a pointer to a pointer, then accessing that value requires that the asterisk operator be applied twice, as is shown below in the example −|||When the above code is compiled and executed, it produces the following result −|||D allows you to pass a pointer to a function. To do so, it simply declares the function parameter as a pointer type.|||The following simple example passes a pointer to a function.|||When the above code is compiled together and executed, it produces the following result −|||Consider the following function, which returns 10 numbers using a pointer, means the address of first array element.|||When the above code is compiled and executed, it produces the following result −|||An array name is a constant pointer to the first element of the array. Therefore, in the declaration −|||balance is a pointer to &balance[0], which is the address of the first element of the array balance. Thus, the following program fragment assigns p the address of the first element of balance −|||It is legal to use array names as constant pointers, and vice versa. Therefore, *(balance + 4) is a legitimate way of accessing the data at balance[4].|||Once you store the address of first element in p, you can access array elements using *p, *(p+1), *(p+2) and so on. The following example shows all the concepts discussed above −|||When the above code is compiled and executed, it produces the following result −",we define a pointer variables@@@assign the address of a variable to a pointer@@@finally access the value at the address available in the pointer variable.,,,"import std.stdio; void main () {    int var1;    writeln(""Address of var1 variable: "",&var1);        char var2[10];    writeln(""Address of var2 variable: "",&var2); }|||import std.stdio; void main () {    int var = 20;   // actual variable declaration.    int *ip;        // pointer variable   ip = &var;   // store address of var in pointer variable        writeln(""Value of var variable: "",var);       writeln(""Address stored in ip variable: "",ip);       writeln(""Value of *ip variable: "",*ip); }|||import std.stdio;void main () {    int  *ptr = null;    writeln(""The value of ptr is "" , ptr) ;  }|||import std.stdio;  const int MAX = 3;  void main () {    int var[MAX] = [10, 100, 200];    int *ptr = &var[0];     for (int i = 0; i < MAX; i++, ptr++) {       writeln(""Address of var["" , i , ""] = "",ptr);       writeln(""Value of var["" , i , ""] = "",*ptr);    } }|||import std.stdio;  const int MAX = 3;  void main () {    int var[MAX] = [10, 100, 200];    int *ptr = &var[0];    var.ptr[2]  = 290;    ptr[0] = 220;        for (int i = 0; i < MAX; i++, ptr++) {       writeln(""Address of var["" , i , ""] = "",ptr);       writeln(""Value of var["" , i , ""] = "",*ptr);    } }|||import std.stdio;  const int MAX = 3;  void main () {    int var = 3000;    writeln(""Value of var :"" , var);       int *ptr = &var;    writeln(""Value available at *ptr :"" ,*ptr);       int **pptr = &ptr    writeln(""Value available at **pptr :"",**pptr); }|||import std.stdio;  void main () {    // an int array with 5 elements.    int balance[5] = [1000, 2, 3, 17, 50];    double avg;       avg = getAverage( &balance[0], 5 ) ;    writeln(""Average is :"" , avg); }  double getAverage(int *arr, int size) {    int    i;    double avg, sum = 0;       for (i = 0; i < size; ++i) {      sum += arr[i];    }       avg = sum/size;    return avg; }|||import std.stdio;  void main () {    int *p = getNumber();       for ( int i = 0; i < 10; i++ ) {       writeln(""*(p + "" , i , "") : "",*(p + i));    } }  int * getNumber( ) {    static int r [10];       for (int i = 0; i < 10; ++i) {      r[i] = i;    }      return &r[0]; }|||double *p; double balance[10];  p = balance;|||import std.stdio; void main () {    // an array with 5 elements.    double balance[5] = [1000.0, 2.0, 3.4, 17.0, 50.0];    double *p;        p = &balance[0];      // output each array element's value     writeln(""Array values using pointer "" );       for ( int i = 0; i < 5; i++ ) {       writeln( ""*(p + "", i, "") : "", *(p + i));    } }"
Learn D Programming,D Programming - Tuples,D Programming - Tuples|||Tuple Using tuple()@@@Tuple using Tuple Template@@@Expanding Property and Function Params@@@TypeTuple@@@Useful Video Courses|||Example@@@Example|||DB2 Online Training@@@Azure Data Lake Online Training@@@Android Online Training@@@Android Penetration Testing Online Training @@@Agile Methodology@@@3D Animation Online Training,"Tuples are used for combining multiple values as a single object. Tuples contains a sequence of elements. The elements can be types, expressions, or aliases. The number and elements of a tuple are fixed at compile time and they cannot be changed at run time.|||Tuples have characteristics of both structs and arrays. The tuple elements can be of different types like structs. The elements can be accessed via indexing like arrays. They are implemented as a library feature by the Tuple template from the std.typecons module. Tuple makes use of TypeTuple from the std.typetuple module for some of its operations.|||Tuples can be constructed by the function tuple(). The members of a tuple are accessed by index values. An example is shown below.|||When the above code is compiled and executed, it produces the following result −|||Tuple can also be constructed directly by the Tuple template instead of the tuple() function. The type and the name of each member are specified as two consecutive template parameters. It is possible to access the members by properties when created using templates.|||When the above code is compiled and executed, it produces the following result|||The members of Tuple can be expanded either by the .expand property or by slicing. This expanded/sliced value can be passed as function argument list. An example is shown below.|||When the above code is compiled and executed, it produces the following result −|||TypeTuple is defined in the std.typetuple module. A comma-separated list of values and types. A simple example using TypeTuple is given below. TypeTuple is used to create argument list, template list, and array literal list.|||When the above code is compiled and executed, it produces the following result −",,,,"import std.stdio; import std.typecons;  void main() {    auto myTuple = tuple(1, ""Tuts"");    writeln(myTuple);    writeln(myTuple[0]);    writeln(myTuple[1]); }|||import std.stdio; import std.typecons; void main() {    auto myTuple = Tuple!(int, ""id"",string, ""value"")(1, ""Tuts"");    writeln(myTuple);        writeln(""by index 0 : "", myTuple[0]);    writeln(""by .id : "", myTuple.id);       writeln(""by index 1 : "", myTuple[1]);    writeln(""by .value "", myTuple.value); }|||import std.stdio; import std.typecons; void method1(int a, string b, float c, char d) {    writeln(""method 1 "",a,""\t"",b,""\t"",c,""\t"",d); } void method2(int a, float b, char c) {    writeln(""method 2 "",a,""\t"",b,""\t"",c); } void main() {    auto myTuple = tuple(5, ""my string"", 3.3, 'r');       writeln(""method1 call 1"");    method1(myTuple[]);       writeln(""method1 call 2"");    method1(myTuple.expand);       writeln(""method2 call 1"");    method2(myTuple[0], myTuple[$-2..$]); } |||import std.stdio; import std.typecons; import std.typetuple;  alias TypeTuple!(int, long) TL;  void method1(int a, string b, float c, char d) {    writeln(""method 1 "",a,""\t"",b,""\t"",c,""\t"",d); } void method2(TL tl) {    writeln(tl[0],""\t"", tl[1] ); }  void main() {    auto arguments = TypeTuple!(5, ""my string"", 3.3,'r');     method1(arguments);    method2(5, 6L);  }"
