Course,Chapters,ALL Headings,Paragraphs,Unordered List Items,Ordered List Items,Tables,Code Examples
Learn D Programming,D Programming - Exception Handling,D Programming - Exception Handling|||Throwing Exceptions in D@@@Catching Exceptions in D@@@Useful Video Courses|||Example|||DB2 Online Training@@@Azure Data Lake Online Training@@@Android Online Training@@@Android Penetration Testing Online Training @@@Agile Methodology@@@3D Animation Online Training,"An exception is a problem that arises during the execution of a program. A D exception is a response to an exceptional circumstance that arises while a program is running, such as an attempt to divide by zero.|||Exceptions provide a way to transfer control from one part of a program to another. D exception handling is built upon three keywords try, catch, and throw.|||throw − A program throws an exception when a problem shows up. This is done using a throw keyword.|||catch − A program catches an exception with an exception handler at the place in a program where you want to handle the problem. The catch keyword indicates the catching of an exception.|||try − A try block identifies a block of code for which particular exceptions are activated. It is followed by one or more catch blocks.|||Assuming a block will raise an exception, a method catches an exception using a combination of the try and catch keywords. A try/catch block is placed around the code that might generate an exception. Code within a try/catch block is referred to as protected code, and the syntax for using try/catch looks like the following −|||You can list down multiple catch statements to catch different type of exceptions in case your try block raises more than one exception in different situations.|||Exceptions can be thrown anywhere within a code block using throw statements. The operand of the throw statements determines a type for the exception and can be any expression and the type of the result of the expression determines the type of exception thrown.|||The following example throws an exception when dividing by zero condition occurs −|||The catch block following the try block catches any exception. You can specify what type of exception you want to catch and this is determined by the exception declaration that appears in parentheses following the keyword catch.|||The above code catches an exception of ExceptionName type. If you want to specify that a catch block should handle any type of exception that is thrown in a try block, you must put an ellipsis,..., between the parentheses enclosing the exception declaration as follows −|||The following example throws a division by zero exception. It is caught in catch block.|||When the above code is compiled and executed, it reads the file created in previous section and produces the following result −",throw − A program throws an exception when a problem shows up. This is done using a throw keyword.@@@catch − A program catches an exception with an exception handler at the place in a program where you want to handle the problem. The catch keyword indicates the catching of an exception.@@@try − A try block identifies a block of code for which particular exceptions are activated. It is followed by one or more catch blocks.,,,"double division(int a, int b) {    if( b == 0 ) {       throw new Exception(""Division by zero condition!"");    }      return (a/b); }|||try {    // protected code } catch( ExceptionName e ) {    // code to handle ExceptionName exception }|||try {    // protected code } catch(...) {    // code to handle any exception }|||import std.stdio; import std.string;  string division(int a, int b) {    string result = """";        try {        if( b == 0 ) {         throw new Exception(""Cannot divide by zero!"");       } else {          result = format(""%s"",a/b);       }    } catch (Exception e) {       result = e.msg;    }      return result; }  void main () {    int x = 50;    int y = 0;        writeln(division(x, y));        y = 10;    writeln(division(x, y)); }"
Learn D Programming,D - Contract Programming,D - Contract Programming|||Body Block in D@@@In Block for Pre Conditions in D@@@Out Blocks for Post Conditions in D@@@Useful Video Courses|||DB2 Online Training@@@Azure Data Lake Online Training@@@Android Online Training@@@Android Penetration Testing Online Training @@@Agile Methodology@@@3D Animation Online Training,"Contract programming in D programming is focused on providing a simple and understandable means of error handling. Contract programming in D are implemented by three types of code blocks −|||Body block contains the actual functionality code of execution. The in and out blocks are optional while the body block is mandatory. A simple syntax is shown below.|||In block is for simple pre conditions that verify whether the input parameters are acceptable and in range that can be handled by the code. A benefit of an in block is that all of the entry conditions can be kept together and separate from the actual body of the function. A simple precondition for validating password for its minimum length is shown below.|||When the above code is compiled and executed, it reads the file created in previous section and produces the following result −|||The out block takes care of the return values from the function. It validates the return value is in expected range. A simple example containing both in and out is shown below that converts months, year to a combined decimal age form.|||When the above code is compiled and executed, it reads the file created in previous section and produces the following result −",body block@@@in block@@@out block,,,"import std.stdio; import std.string;  bool isValid(string password) in {    assert(password.length>=5); } body {    // other conditions    return true; }  void main() {    writeln(isValid(""password"")); }|||import std.stdio;import std.string;double getAge(double months,double years) in {    assert(months >= 0);    assert(months <= 12); } out (result) {    assert(result>=years); } body {    return years + months/12; }  void main () {    writeln(getAge(10,12)); } "
Learn D Programming,D Programming - Conditional Compilation,D Programming - Conditional Compilation|||Debug Statement in D@@@Debug (tag) Statement in D@@@Debug (level) Statement in D@@@Version (tag) and Version (level) Statements in D@@@Static if@@@Useful Video Courses|||DB2 Online Training@@@Azure Data Lake Online Training@@@Android Online Training@@@Android Penetration Testing Online Training @@@Agile Methodology@@@3D Animation Online Training,"Conditional compilation is the process of selecting which code to compile and which code to not compile similar to the #if / #else / #endif in C and C++. Any statement that is not compiled in still must be syntactically correct.|||Conditional compilation involves condition checks that are evaluable at compile time. Runtime conditional statements like if, for, while are not conditional compilation features. The following features of D are meant for conditional compilation −|||The debug is useful during program development. The expressions and statements that are marked as debug are compiled into the program only when the -debug compiler switch is enabled.|||The else clause is optional. Both the single expression and the code block above are compiled only when the -debug compiler switch is enabled.|||Instead of being removed altogether, the lines can be marked as debug instead.|||Such lines are included in the program only when the -debug compiler switch is enabled.|||The debug statements can be given names (tags) to be included in the program selectively.|||Such lines are included in the program only when the -debug compiler switch is enabled.|||The debug blocks can have tags as well.|||It is possible to enable more than one debug tag at a time.|||Sometimes it is more useful to associate debug statements by numerical levels. Increasing levels can provide more detailed information.|||The debug expressions and blocks that are lower than or equal to the specified level would be compiled.|||Version is similar to debug and is used in the same way. The else clause is optional. Although version works essentially the same as debug, having separate keywords helps distinguish their unrelated uses. As with debug, more than one version can be enabled.|||The debug expressions and blocks that are lower than or equal to the specified level would be compiled.|||Static if is the compile time equivalent of the if statement. Just like the if statement, static if takes a logical expression and evaluates it. Unlike the if statement, static if is not about execution flow; rather, it determines whether a piece of code should be included in the program or not.|||The if expression is unrelated to the is operator that we have seen earlier, both syntactically and semantically. It is evaluated at compile time. It produces an int value, either 0 or 1; depending on the expression specified in parentheses. Although the expression that it takes is not a logical expression, the is expression itself is used as a compile time logical expression. It is especially useful in static if conditionals and template constraints.|||When we compile and run we will get some output as follows.",debug@@@version@@@static if,,,"debug writefln(""%s debug only statement"", value); |||debug(mytag) {    //  }|||import std.stdio;  void myFunction() {    debug(1) writeln(""debug1"");    debug(2) writeln(""debug2"");}void main() {    myFunction(); } |||import std.stdio;  void myFunction() {    version(1) writeln(""version1"");    version(2) writeln(""version2"");     }  void main() {    myFunction(); }|||import std.stdio;enum Days {    sun,    mon,    tue,    wed,    thu,    fri,    sat };  void myFunction(T)(T mytemplate) {   static if (is (T == class)) {       writeln(""This is a class type"");    } else static if (is (T == enum)) {       writeln(""This is an enum type"");    } }  void main() {    Days day;    myFunction(day); } "
Learn D Programming,D Programming - Classes & Objects,D Programming - Classes & Objects|||D Class Definitions@@@Defining D Objects@@@Accessing the Data Members@@@Classes and Objects in D@@@Useful Video Courses|||DB2 Online Training@@@Azure Data Lake Online Training@@@Android Online Training@@@Android Penetration Testing Online Training @@@Agile Methodology@@@3D Animation Online Training,"Classes are the central feature of D programming that supports object-oriented programming and are often called user-defined types.|||A class is used to specify the form of an object and it combines data representation and methods for manipulating that data into one neat package. The data and functions within a class are called members of the class.|||When you define a class, you define a blueprint for a data type. This does not actually define any data, but it defines what the class name means, that is, what an object of the class will consist of and what operations can be performed on such an object.|||A class definition starts with the keyword class followed by the class name; and the class body, enclosed by a pair of curly braces. A class definition must be followed either by a semicolon or a list of declarations. For example, we defined the Box data type using the keyword class as follows −|||The keyword public determines the access attributes of the members of the class that follow it. A public member can be accessed from outside the class anywhere within the scope of the class object. You can also specify the members of a class as private or protected which we will discuss in a sub-section.|||A class provides the blueprints for objects, so basically an object is created from a class. You declare objects of a class with exactly the same sort of declaration that you declare variables of basic types. The following statements declare two objects of class Box −|||Both of the objects Box1 and Box2 have their own copy of data members.|||The public data members of objects of a class can be accessed using the direct member access operator (.). Let us try the following example to make the things clear −|||When the above code is compiled and executed, it produces the following result −|||It is important to note that private and protected members can not be accessed directly using direct member access operator (.). Shortly you will learn how private and protected members can be accessed.|||So far, you have got very basic idea about D Classes and Objects. There are further interesting concepts related to D Classes and Objects which we will discuss in various sub-sections listed below −|||A member function of a class is a function that has its definition or its prototype within the class definition like any other variable.|||A class member can be defined as public, private or protected. By default members would be assumed as private.|||A class constructor is a special function in a class that is called when a new object of the class is created. A destructor is also a special function which is called when created object is deleted.|||Every object has a special pointer this which points to the object itself.|||A pointer to a class is done exactly the same way a pointer to a structure is. In fact a class is really just a structure with functions in it.|||Both data members and function members of a class can be declared as static.",,,"Sr.No.@@@Concept & Description|||1@@@Class member functions
A member function of a class is a function that has its definition or its prototype within the class definition like any other variable.|||2@@@Class access modifiers
A class member can be defined as public, private or protected. By default members would be assumed as private.|||3@@@Constructor & destructor
A class constructor is a special function in a class that is called when a new object of the class is created. A destructor is also a special function which is called when created object is deleted.|||4@@@The this pointer in D
Every object has a special pointer this which points to the object itself.|||5@@@Pointer to D classes
A pointer to a class is done exactly the same way a pointer to a structure is. In fact a class is really just a structure with functions in it.|||6@@@Static members of a class
Both data members and function members of a class can be declared as static.","class Box {    public:       double length;   // Length of a box       double breadth;  // Breadth of a box       double height;   // Height of a box }|||import std.stdio;class Box {    public:       double length;   // Length of a box       double breadth;  // Breadth of a box       double height;   // Height of a box }  void main() {    Box box1 = new Box();    // Declare Box1 of type Box    Box box2 = new Box();    // Declare Box2 of type Box    double volume = 0.0;     // Store the volume of a box here        // box 1 specification    box1.height = 5.0;    box1.length = 6.0;    box1.breadth = 7.0;       // box 2 specification    box2.height = 10.0;    box2.length = 12.0;    box2.breadth = 13.0;      // volume of box 1    volume = box1.height * box1.length * box1.breadth;    writeln(""Volume of Box1 : "",volume);      // volume of box 2    volume = box2.height * box2.length * box2.breadth;    writeln(""Volume of Box2 : "", volume); } "
Learn D Programming,D Programming - Inheritance,D Programming - Inheritance|||Base Classes and Derived Classes in D@@@Access Control and Inheritance@@@Multi Level Inheritance@@@Useful Video Courses|||DB2 Online Training@@@Azure Data Lake Online Training@@@Android Online Training@@@Android Penetration Testing Online Training @@@Agile Methodology@@@3D Animation Online Training,"One of the most important concepts in object-oriented programming is inheritance. Inheritance allows to define a class in terms of another class, which makes it easier to create and maintain an application. This also provides an opportunity to reuse the code functionality and fast implementation time.|||When creating a class, instead of writing completely new data members and member functions, the programmer can designate that the new class should inherit the members of an existing class. This existing class is called the base class, and the new class is referred to as the derived class.|||The idea of inheritance implements the is a relationship. For example, mammal IS-A animal, dog IS-A mammal hence dog IS-A animal as well and so on.|||A class can be derived from more than one classes, which means it can inherit data and functions from multiple base classes. To define a derived class, we use a class derivation list to specify the base class(es). A class derivation list names one or more base classes and has the form −|||Consider a base class Shape and its derived class Rectangle as follows −|||When the above code is compiled and executed, it produces the following result −|||A derived class can access all the non-private members of its base class. Thus base-class members that should not be accessible to the member functions of derived classes should be declared private in the base class.|||A derived class inherits all base class methods with the following exceptions −|||The inheritance can be of multiple levels and it is shown in the following example.|||When the above code is compiled and executed, it produces the following result −","Constructors, destructors, and copy constructors of the base class.@@@Overloaded operators of the base class.",,,"import std.stdio;// Base class class Shape {    public:       void setWidth(int w) {          width = w;       }      void setHeight(int h) {          height = h;       }      protected:       int width;       int height; }  // Derived class class Rectangle: Shape {    public:       int getArea() {          return (width * height);       } }  void main() {    Rectangle Rect = new Rectangle();      Rect.setWidth(5);    Rect.setHeight(7);       // Print the area of the object.    writeln(""Total area: "", Rect.getArea()); } |||import std.stdio;// Base class class Shape {   public:      void setWidth(int w) {         width = w;       }      void setHeight(int h) {         height = h;       }   protected:       int width;       int height; }// Derived class class Rectangle: Shape {   public:      int getArea() {         return (width * height);       }} class Square: Rectangle {   this(int side) {      this.setWidth(side);       this.setHeight(side);    }}void main() {   Square square = new Square(13);   // Print the area of the object.   writeln(""Total area: "", square.getArea());}"
Learn D Programming,D Programming - Overloading,D Programming - Overloading|||Function Overloading@@@Operator Overloading@@@Operator Overloading Types@@@Useful Video Courses|||Example|||DB2 Online Training@@@Azure Data Lake Online Training@@@Android Online Training@@@Android Penetration Testing Online Training @@@Agile Methodology@@@3D Animation Online Training,"D allows you to specify more than one definition for a function name or an operator in the same scope, which is called function overloading and operator overloading respectively.|||An overloaded declaration is a declaration that had been declared with the same name as a previous declaration in the same scope, except that both declarations have different arguments and obviously different definition (implementation).|||When you call an overloaded function or operator, the compiler determines the most appropriate definition to use by comparing the argument types you used to call the function or operator with the parameter types specified in the definitions. The process of selecting the most appropriate overloaded function or operator is called overload resolution..|||You can have multiple definitions for the same function name in the same scope. The definition of the function must differ from each other by the types and/or the number of arguments in the argument list. You cannot overload function declarations that differ only by return type.|||The following example uses same function print() to print different data types −|||When the above code is compiled and executed, it produces the following result −|||You can redefine or overload most of the built-in operators available in D. Thus a programmer can use operators with user-defined types as well.|||Operators can be overloaded using string op followed by Add, Sub, and so on based on the operator that is being overloaded. We can overload the operator + to add two boxes as shown below.|||The following example shows the concept of operator overloading using a member function. Here an object is passed as an argument whose properties are accessed using this object. The object which calls this operator can be accessed using this operator as explained below −|||When the above code is compiled and executed, it produces the following result −|||Basically, there are three types of operator overloading as listed below.",,,"Sr.No.@@@Overloading Types|||1@@@Unary Operators Overloading 
|||2@@@Binary Operators Overloading 
|||3@@@Comparison Operators Overloading 
","import std.stdio; import std.string; class printData {    public:       void print(int i) {          writeln(""Printing int: "",i);       }      void print(double f) {          writeln(""Printing float: "",f );      }      void print(string s) {          writeln(""Printing string: "",s);       } };  void main() {    printData pd = new printData();        // Call print to print integer    pd.print(5);      // Call print to print float    pd.print(500.263);       // Call print to print character    pd.print(""Hello D""); } |||Box opAdd(Box b) {    Box box = new Box();    box.length = this.length + b.length;    box.breadth = this.breadth + b.breadth;    box.height = this.height + b.height;    return box; }|||import std.stdio;class Box {    public:        double getVolume() {          return length * breadth * height;       }      void setLength( double len ) {          length = len;       }       void setBreadth( double bre ) {          breadth = bre;       }      void setHeight( double hei ) {          height = hei;       }      Box opAdd(Box b) {          Box box = new Box();          box.length = this.length + b.length;          box.breadth = this.breadth + b.breadth;          box.height = this.height + b.height;          return box;       }    private:       double length;      // Length of a box       double breadth;     // Breadth of a box       double height;      // Height of a box }; // Main function for the program void main( ) {    Box box1 = new Box();    // Declare box1 of type Box    Box box2 = new Box();    // Declare box2 of type Box    Box box3 = new Box();    // Declare box3 of type Box    double volume = 0.0;     // Store the volume of a box here      // box 1 specification    box1.setLength(6.0);    box1.setBreadth(7.0);    box1.setHeight(5.0);      // box 2 specification    box2.setLength(12.0);    box2.setBreadth(13.0);    box2.setHeight(10.0);       // volume of box 1    volume = box1.getVolume();    writeln(""Volume of Box1 : "", volume);      // volume of box 2    volume = box2.getVolume();    writeln(""Volume of Box2 : "", volume);       // Add two object as follows:    box3 = box1 + box2;       // volume of box 3    volume = box3.getVolume();    writeln(""Volume of Box3 : "", volume);  } "
