Course,Chapters,ALL Headings,Paragraphs,Unordered List Items,Ordered List Items,Tables,Code Examples
Returns the real and imaginary part of a complex number.",(write (/ 1 2))(terpri)(write ( + (/ 1 2) (/ 3 4)))(terpri)(write ( + #c( 1 2) #c( 3 -4)))|||(write (/ 45 78))(terpri)(write (floor 45 78))(terpri)(write (/ 3456 75))(terpri)(write (floor 3456 75))(terpri)(write (ceiling 3456 75))(terpri)(write (truncate 3456 75))(terpri)(write (round 3456 75))(terpri)(write (ffloor 3456 75))(terpri)(write (fceiling 3456 75))(terpri)(write (ftruncate 3456 75))(terpri)(write (fround 3456 75))(terpri)(write (mod 3456 75))(terpri)(setq c (complex 6 7))(write c)(terpri)(write (complex 5 -9))(terpri)(write (realpart c))(terpri)(write (imagpart c))
Learn LISP,LISP - Characters,LISP - Characters|||Example@@@Special Characters@@@Character Comparison Functions@@@Useful Video Courses|||Example|||Practical AutoLISP Programming - Beginner to Advanced,"In LISP, characters are represented as data objects of type character.|||You can denote a character object preceding #\ before the character itself. For example, #\a means the character a.|||Space and other special characters can be denoted by preceding #\ before the name of the character. For example, #\SPACE represents the space character.|||The following example demonstrates this −|||Create a new source code file named main.lisp and type the following code in it.|||When you execute the code, it returns the following result −|||Common LISP allows using the following special characters in your code. They are called the semi-standard characters.|||Numeric comparison functions and operators, like, < and > do not work on characters. Common LISP provides other two sets of functions for comparing characters in your code.|||One set is case-sensitive and the other case-insensitive.|||The following table provides the functions −|||Create a new source code file named main.lisp and type the following code in it.|||When you execute the code, it returns the following result −",#\Backspace@@@#\Tab@@@#\Linefeed@@@#\Page@@@#\Return@@@#\Rubout,,"Case Sensitive Functions@@@Case-insensitive Functions@@@Description|||char=@@@char-equal@@@Checks if the values of the operands are all equal or not, if yes then condition becomes true.|||char/=@@@char-not-equal@@@Checks if the values of the operands are all different or not, if values are not equal then condition becomes true.|||char<@@@char-lessp@@@Checks if the values of the operands are monotonically decreasing.|||char>@@@char-greaterp@@@Checks if the values of the operands are monotonically increasing.|||char<=@@@char-not-greaterp@@@Checks if the value of any left operand is greater than or equal to the value of next right operand, if yes then condition becomes true.|||char>=@@@char-not-lessp@@@Checks if the value of any left operand is less than or equal to the value of its right operand, if yes then condition becomes true.",(write 'a)(terpri)(write #\a)(terpri)(write-char #\a)(terpri)(write-char 'a)|||; case-sensitive comparison(write (char= #\a #\b))(terpri)(write (char= #\a #\a))(terpri)(write (char= #\a #\A))(terpri)   ;case-insensitive comparision(write (char-equal #\a #\A))(terpri)(write (char-equal #\a #\b))(terpri)(write (char-lessp #\a #\b #\c))(terpri)(write (char-greaterp #\a #\b #\c))
Learn LISP,LISP - Arrays,LISP - Arrays|||Example 1@@@Example 2@@@Example 3@@@Complete Syntax for the make-array Function@@@Useful Video Courses|||Example 4@@@Example 5|||Practical AutoLISP Programming - Beginner to Advanced,"LISP allows you to define single or multiple-dimension arrays using the make-array function. An array can store any LISP object as its elements.|||All arrays consist of contiguous memory locations. The lowest address corresponds to the first element and the highest address to the last element.|||The number of dimensions of an array is called its rank.|||In LISP, an array element is specified by a sequence of non-negative integer indices. The length of the sequence must equal the rank of the array. Indexing starts from zero.|||For example, to create an array with 10- cells, named my-array, we can write −|||The aref function allows accessing the contents of the cells. It takes two arguments, the name of the array and the index value.|||For example, to access the content of the tenth cell, we write −|||Create a new source code file named main.lisp and type the following code in it.|||When you execute the code, it returns the following result −|||Let us create a 3-by-3 array.|||Create a new source code file named main.lisp and type the following code in it.|||When you execute the code, it returns the following result −|||Create a new source code file named main.lisp and type the following code in it.|||When you execute the code, it returns the following result −|||The make-array function takes many other arguments. Let us look at the complete syntax of this function −|||Apart from the dimensions argument, all other arguments are keywords. The following table provides brief description of the arguments.|||dimensions|||It gives the dimensions of the array. It is a number for one-dimensional array, and a list for multi-dimensional array.|||:element-type|||It is the type specifier, default value is T, i.e. any type|||:initial-element|||Initial elements value. It will make an array with all the elements initialized to a particular value.|||:initial-content|||Initial content as object.|||:adjustable|||It helps in creating a resizeable (or adjustable) vector whose underlying memory can be resized. The argument is a Boolean value indicating whether the array is adjustable or not, default value being NIL.|||:fill-pointer|||It keeps track of the number of elements actually stored in a resizeable vector.|||:displaced-to|||It helps in creating a displaced array or shared array that shares its contents with the specified array. Both the arrays should have same element type. The :displaced-to option may not be used with the :initial-element or :initial-contents option. This argument defaults to nil.|||:displaced-index-offset|||It gives the index-offset of the created shared array.|||Create a new source code file named main.lisp and type the following code in it.|||When you execute the code, it returns the following result −|||If the displaced array is two dimensional −|||When you execute the code, it returns the following result −|||Let's change the displaced index offset to 5 −|||When you execute the code, it returns the following result −|||Create a new source code file named main.lisp and type the following code in it.|||When you execute the code, it returns the following result −",,,"Sr.No.@@@Argument & Description|||1@@@dimensions
It gives the dimensions of the array. It is a number for one-dimensional array, and a list for multi-dimensional array.|||2@@@:element-type
It is the type specifier, default value is T, i.e. any type|||3@@@:initial-element
Initial elements value. It will make an array with all the elements initialized to a particular value.|||4@@@:initial-content
Initial content as object.|||5@@@:adjustable
It helps in creating a resizeable (or adjustable) vector whose underlying memory can be resized. The argument is a Boolean value indicating whether the array is adjustable or not, default value being NIL.|||6@@@:fill-pointer
It keeps track of the number of elements actually stored in a resizeable vector.|||7@@@:displaced-to
It helps in creating a displaced array or shared array that shares its contents with the specified array. Both the arrays should have same element type. The :displaced-to option may not be used with the :initial-element or :initial-contents option. This argument defaults to nil.|||8@@@:displaced-index-offset
It gives the index-offset of the created shared array.","(write (setf my-array (make-array '(10))))(terpri)(setf (aref my-array 0) 25)(setf (aref my-array 1) 23)(setf (aref my-array 2) 45)(setf (aref my-array 3) 10)(setf (aref my-array 4) 20)(setf (aref my-array 5) 17)(setf (aref my-array 6) 25)(setf (aref my-array 7) 19)(setf (aref my-array 8) 67)(setf (aref my-array 9) 30)(write my-array)|||(setf x (make-array '(3 3)    :initial-contents '((0 1 2 ) (3 4 5) (6 7 8))))(write x)|||(setq a (make-array '(4 3)))(dotimes (i 4)   (dotimes (j 3)      (setf (aref a i j) (list i 'x j '= (* i j)))   ))(dotimes (i 4)   (dotimes (j 3)      (print (aref a i j))   ))|||make-array dimensions :element-type :initial-element :initial-contents :adjustable :fill-pointer  :displaced-to :displaced-index-offset|||(setq myarray (make-array '(3 2 3)    :initial-contents    '(((a b c) (1 2 3))       ((d e f) (4 5 6))       ((g h i) (7 8 9))    ))) (setq array2 (make-array 4 :displaced-to myarray :displaced-index-offset 2)) (write myarray)(terpri)(write array2)|||(setq myarray (make-array '(3 2 3)    :initial-contents    '(((a b c) (1 2 3))       ((d e f) (4 5 6))       ((g h i) (7 8 9))    ))) (setq array2 (make-array '(3 2) :displaced-to myarray :displaced-index-offset 2)) (write myarray)(terpri)(write array2)|||(setq myarray (make-array '(3 2 3)    :initial-contents    '(((a b c) (1 2 3))       ((d e f) (4 5 6))       ((g h i) (7 8 9))    ))) (setq array2 (make-array '(3 2) :displaced-to myarray :displaced-index-offset 5)) (write myarray)(terpri)(write array2)|||;a one dimensional array with 5 elements, ;initail value 5(write (make-array 5 :initial-element 5))(terpri);two dimensional array, with initial element a(write (make-array '(2 3) :initial-element 'a))(terpri);an array of capacity 14, but fill pointer 5, is 5(write(length (make-array 14 :fill-pointer 5)))(terpri);however its length is 14(write (array-dimensions (make-array 14 :fill-pointer 5)))(terpri); a bit array with all initial elements set to 1(write(make-array 10 :element-type 'bit :initial-element 1))(terpri); a character array with all initial elements set to a; is a string actually(write(make-array 10 :element-type 'character :initial-element #\a)) (terpri); a two dimensional array with initial values a(setq myarray (make-array '(2 2) :initial-element 'a :adjustable t))(write myarray)(terpri);readjusting the array(adjust-array myarray '(1 3) :initial-element 'b) (write myarray)"
Learn LISP,LISP - Strings,LISP - Strings|||Example@@@String Comparison Functions@@@Case Controlling Functions@@@Trimming Strings@@@Other String Functions@@@Useful Video Courses|||Example@@@Example@@@Example@@@Calculating Length@@@Extracting Sub-string@@@Accessing a Character in a String@@@Sorting and Merging of Strings@@@Reversing a String@@@Concatenating Strings|||Practical AutoLISP Programming - Beginner to Advanced,"Strings in Common Lisp are vectors, i.e., one-dimensional array of characters.|||String literals are enclosed in double quotes. Any character supported by the character set can be enclosed within double quotes to make a string, except the double quote character ("") and the escape character (\). However, you can include these by escaping them with a backslash (\).|||Create a new source code file named main.lisp and type the following code in it.|||When you execute the code, it returns the following result −|||Numeric comparison functions and operators, like, < and > do not work on strings. Common LISP provides other two sets of functions for comparing strings in your code. One set is case-sensitive and the other case-insensitive.|||The following table provides the functions −|||Create a new source code file named main.lisp and type the following code in it.|||When you execute the code, it returns the following result −|||The following table describes the case controlling functions −|||string-upcase|||Converts the string to upper case|||string-downcase|||Converts the string to lower case|||string-capitalize|||Capitalizes each word in the string|||Create a new source code file named main.lisp and type the following code in it.|||When you execute the code, it returns the following result −|||The following table describes the string trimming functions −|||string-trim|||It takes a string of character(s) as first argument and a string as the second argument and returns a substring where all characters that are in the first argument are removed off the argument string.|||String-left-trim|||It takes a string of character(s) as first argument and a string as the second argument and returns a substring where all characters that are in the first argument are removed off the beginning of the argument string.|||String-right-trim|||It takes a string character(s) as first argument and a string as the second argument and returns a substring where all characters that are in the first argument are removed off the end of the argument string.|||Create a new source code file named main.lisp and type the following code in it.|||When you execute the code, it returns the following result −|||Strings in LISP are arrays and thus also sequences. We will cover these data types in coming tutorials. All functions that are applicable to arrays and sequences also apply to strings. However, we will demonstrate some commonly used functions using various examples.|||The length function calculates the length of a string.|||The subseq function returns a sub-string (as a string is also a sequence) starting at a particular index and continuing to a particular ending index or the end of the string.|||The char function allows accessing individual characters of a string.|||Example|||Create a new source code file named main.lisp and type the following code in it.|||When you execute the code, it returns the following result −|||The sort function allows sorting a string. It takes a sequence (vector or string) and a two-argument predicate and returns a sorted version of the sequence.|||The merge function takes two sequences and a predicate and returns a sequence produced by merging the two sequences, according to the predicate.|||Example|||Create a new source code file named main.lisp and type the following code in it.|||When you execute the code, it returns the following result −|||The reverse function reverses a string.|||For example, Create a new source code file named main.lisp and type the following code in it.|||When you execute the code, it returns the following result −|||The concatenate function concatenates two strings. This is generic sequence function and you must provide the result type as the first argument.|||For example, Create a new source code file named main.lisp and type the following code in it.|||When you execute the code, it returns the following result −",,,"Case Sensitive Functions@@@Case-insensitive Functions@@@Description|||string=@@@string-equal@@@Checks if the values of the operands are all equal or not, if yes then condition becomes true.|||string/=@@@string-not-equal@@@Checks if the values of the operands are all different or not, if values are not equal then condition becomes true.|||string<@@@string-lessp@@@Checks if the values of the operands are monotonically decreasing.|||string>@@@string-greaterp@@@Checks if the values of the operands are monotonically increasing.|||string<=@@@string-not-greaterp@@@Checks if the value of any left operand is greater than or equal to the value of next right operand, if yes then condition becomes true.|||string>=@@@string-not-lessp@@@Checks if the value of any left operand is less than or equal to the value of its right operand, if yes then condition becomes true.&&&Sr.No.@@@Function & Description|||1@@@string-upcase
Converts the string to upper case|||2@@@string-downcase
Converts the string to lower case|||3@@@string-capitalize
Capitalizes each word in the string&&&Sr.No.@@@Function & Description|||1@@@string-trim
It takes a string of character(s) as first argument and a string as the second argument and returns a substring where all characters that are in the first argument are removed off the argument string.|||2@@@String-left-trim
It takes a string of character(s) as first argument and a string as the second argument and returns a substring where all characters that are in the first argument are removed off the beginning of the argument string.|||3@@@String-right-trim
It takes a string character(s) as first argument and a string as the second argument and returns a substring where all characters that are in the first argument are removed off the end of the argument string.","(write-line ""Hello World"")(write-line ""Welcome to Tutorials Point"");escaping the double quote character(write-line ""Welcome to \""Tutorials Point\"""")|||; case-sensitive comparison(write (string= ""this is test"" ""This is test""))(terpri)(write (string> ""this is test"" ""This is test""))(terpri)(write (string< ""this is test"" ""This is test""))(terpri);case-insensitive comparision(write (string-equal ""this is test"" ""This is test""))(terpri)(write (string-greaterp ""this is test"" ""This is test""))(terpri)(write (string-lessp ""this is test"" ""This is test""))(terpri);checking non-equal(write (string/= ""this is test"" ""this is Test""))(terpri)(write (string-not-equal ""this is test"" ""This is test""))(terpri)(write (string/= ""lisp"" ""lisping""))(terpri)(write (string/= ""decent"" ""decency""))|||(write-line (string-upcase ""a big hello from tutorials point""))(write-line (string-capitalize ""a big hello from tutorials point""))|||(write-line (string-trim "" "" ""   a big hello from tutorials point   ""))(write-line (string-left-trim "" "" ""   a big hello from tutorials point   ""))(write-line (string-right-trim "" "" ""   a big hello from tutorials point   ""))(write-line (string-trim "" a"" ""   a big hello from tutorials point   ""))|||(write (length ""Hello World""))(terpri)(write-line (subseq ""Hello World"" 6))(write (char ""Hello World"" 6))|||;sorting the strings(write (sort (vector ""Amal"" ""Akbar"" ""Anthony"") #'string<))(terpri);merging the strings(write (merge 'vector (vector ""Rishi"" ""Zara"" ""Priyanka"")    (vector ""Anju"" ""Anuj"" ""Avni"") #'string<))|||(write-line (reverse ""Are we not drawn onward, we few, drawn onward to new era""))|||(write-line (concatenate 'string ""Are we not drawn onward, "" ""we few, drawn onward to new era""))"
Learn LISP,LISP - Sequences,LISP - Sequences|||Creating a Sequence@@@Generic Functions on Sequences@@@Standard Sequence Function Keyword Arguments@@@Finding Length and Element@@@Modifying Sequences@@@Sorting and Merging Sequences@@@Sequence Predicates@@@Mapping Sequences@@@Useful Video Courses|||Example@@@Example 1@@@Example 2@@@Example 1@@@Example 2@@@Example@@@Example|||Practical AutoLISP Programming - Beginner to Advanced,"Sequence is an abstract data type in LISP. Vectors and lists are the two concrete subtypes of this data type. All the functionalities defined on sequence data type are actually applied on all vectors and list types.|||In this section, we will discuss most commonly used functions on sequences.|||Before starting on various ways of manipulating sequences (i.e., vectors and lists), let us have a look at the list of all available functions.|||The function make-sequence allows you to create a sequence of any type. The syntax for this function is −|||It creates a sequence of type sqtype and of length sqsize.|||You may optionally specify some value using the :initial-element argument, then each of the elements will be initialized to this value.|||For example, Create a new source code file named main.lisp and type the following code in it.|||When you execute the code, it returns the following result −|||elt|||It allows access to individual elements through an integer index.|||length|||It returns the length of a sequence.|||subseq|||It returns a sub-sequence by extracting the subsequence starting at a particular index and continuing to a particular ending index or the end of the sequence.|||copy-seq|||It returns a sequence that contains the same elements as its argument.|||fill|||It is used to set multiple elements of a sequence to a single value.|||replace|||It takes two sequences and the first argument sequence is destructively modified by copying successive elements into it from the second argument sequence.|||count|||It takes an item and a sequence and returns the number of times the item appears in the sequence.|||reverse|||It returns a sequence contains the same elements of the argument but in reverse order.|||nreverse|||It returns the same sequence containing the same elements as sequence but in reverse order.|||concatenate|||It creates a new sequence containing the concatenation of any number of sequences.|||position|||It takes an item and a sequence and returns the index of the item in the sequence or nil.|||find|||It takes an item and a sequence. It finds the item in the sequence and returns it, if not found then it returns nil.|||sort|||It takes a sequence and a two-argument predicate and returns a sorted version of the sequence.|||merge|||It takes two sequences and a predicate and returns a sequence produced by merging the two sequences, according to the predicate.|||map|||It takes an n-argument function and n sequences and returns a new sequence containing the result of applying the function to subsequent elements of the sequences.|||some|||It takes a predicate as an argument and iterates over the argument sequence, and returns the first non-NIL value returned by the predicate or returns false if the predicate is never satisfied.|||every|||It takes a predicate as an argument and iterate over the argument sequence, it terminates, returning false, as soon as the predicate fails. If the predicate is always satisfied, it returns true.|||notany|||It takes a predicate as an argument and iterate over the argument sequence, and returns false as soon as the predicate is satisfied or true if it never is.|||notevery|||It takes a predicate as an argument and iterate over the argument sequence, and returns true as soon as the predicate fails or false if the predicate is always satisfied.|||reduce|||It maps over a single sequence, applying a two-argument function first to the first two elements of the sequence and then to the value returned by the function and subsequent elements of the sequence.|||search|||It searches a sequence to locate one or more elements satisfying some test.|||remove|||It takes an item and a sequence and returns the sequence with instances of item removed.|||delete|||This also takes an item and a sequence and returns a sequence of the same kind as the argument sequence that has the same elements except the item.|||substitute|||It takes a new item, an existing item, and a sequence and returns a sequence with instances of the existing item replaced with the new item.|||nsubstitute|||It takes a new item, an existing item, and a sequence and returns the same sequence with instances of the existing item replaced with the new item.|||mismatch|||It takes two sequences and returns the index of the first pair of mismatched elements.|||We have just discussed various functions and keywords that are used as arguments in these functions working on sequences. In the next sections, we will see how to use these functions using examples.|||The length function returns the length of a sequence, and the elt function allows you to access individual elements using an integer index.|||Create a new source code file named main.lisp and type the following code in it.|||When you execute the code, it returns the following result −|||Some sequence functions allows iterating through the sequence and perform some operations like, searching, removing, counting or filtering specific elements without writing explicit loops.|||The following example demonstrates this −|||Create a new source code file named main.lisp and type the following code in it.|||When you execute the code, it returns the following result −|||Create a new source code file named main.lisp and type the following code in it.|||When you execute the code, it returns the following result −|||The sorting functions take a sequence and a two-argument predicate and return a sorted version of the sequence.|||Create a new source code file named main.lisp and type the following code in it.|||When you execute the code, it returns the following result −|||Create a new source code file named main.lisp and type the following code in it.|||When you execute the code, it returns the following result −|||The functions every, some, notany, and notevery are called the sequence predicates.|||These functions iterate over sequences and test the Boolean predicate.|||All these functions takes a predicate as the first argument and the remaining arguments are sequences.|||Create a new source code file named main.lisp and type the following code in it.|||When you execute the code, it returns the following result −|||We have already discussed the mapping functions. Similarly the map function allows you to apply a function on to subsequent elements of one or more sequences.|||The map function takes a n-argument function and n sequences and returns a new sequence after applying the function to subsequent elements of the sequences.|||Create a new source code file named main.lisp and type the following code in it.|||When you execute the code, it returns the following result −",,,"Sr.No.@@@Function & Description|||1@@@elt
It allows access to individual elements through an integer index.|||2@@@length
It returns the length of a sequence.|||3@@@subseq
It returns a sub-sequence by extracting the subsequence starting at a particular index and continuing to a particular ending index or the end of the sequence.|||4@@@copy-seq
It returns a sequence that contains the same elements as its argument.|||5@@@fill
It is used to set multiple elements of a sequence to a single value.|||6@@@replace
It takes two sequences and the first argument sequence is destructively modified by copying successive elements into it from the second argument sequence.|||7@@@count
